10.1080/07900627.2019.1698413,"from Climatologies at High Resolution for the Earth Land Surface Areas (CHELSA; Karger et al., 2017). CHELSA is an organization",International Journal of Water Resources Development,Economically challenged and water scarce: identification of global populations most vulnerable to water crises,CHELSA
10.1080/01445340601113955,"Kluwer Academic Publishers. Halmos, P. R. 1962. Algebraic Logic, New York: Chelsa Publishing Company. Hardegree, G. M. 1981a. ‘Some Problems and",History and Philosophy of Logic,The Birth of quantum logic,CHELSA
10.1111/jbi.13841,"following climatic variables per plot from the global climate database set CHELSA (Karger et al., 2017): Annual mean temperature and precipitation",Journal of Biogeography,Latitudinal patterns of species richness and range size of ferns along elevational gradients at the transition from tropics to subtropics,CHELSA
10.1080/01621424.2016.1227008,"environment (Benner, Hooper-Kyriakidis, & Stannard, 2011). Benner, Tanner, and Chelsa (2009) described three skills that develop during this journey:",Home Health Care Services Quarterly,Relationship of embodied nursing knowledge and client outcomes in home health,CHELSA
10.1111/ddi.12836,"analyses, we used bioclimatic variables obtained from the recently published chelsa 1.2 database (Karger et al., 2017) for current (http://chelsa-climate.org/downloads/)",Diversity and Distributions,Topography explains the distribution of genetic diversity in one of the most fragile European hotspots,CHELSA
10.1016/j.ecolind.2022.109001,"i.e., climate and soil, were used. Climate variables were extracted from CHELSA V1.2 (Climatol­ ogies at high resolution for the earth’s land",Ecological Indicators,Plant community traits associated with nitrogen can predict spatial variability in productivity,CHELSA
10.1016/j.biocon.2021.109425,"1979–2013) and future climate for 2070 (average of 2061–2080) from the CHELSA dataset at a 30 arc-sec spatial resolution (Karger et al., 2017,",Biological Conservation,Anthropogenic climate change increases vulnerability of Magnolia species more in Asia than in the Americas,CHELSA
10.1007/s00704-020-03394-y,"Climatologies at High Resolution for the Earth’s Land Surface Areas (CHELSA), and European Environment Agency (ERA5) climate reanalysis data",Theoretical and Applied Climatology,"The sensitivity of the SPEI to potential evapotranspiration and precipitation at multiple timescales on the Huang-Huai-Hai Plain, China",CHELSA
10.1007/s11676-019-01011-x,"2013 retrieved from high resolution (30 arc sec, * 1 km) satellite data CHELSA (Climatologies at  High resolution for the Earth’s Land Surface",Journal of Forestry Research,Growth response of Abies spectabilis to climate along an elevation gradient of the Manang valley in the central Himalayas,CHELSA
10.1002/esp.4532,"example APHRODITE (Yatagai et al., 2012), CRU TS (Harris et al., 2014), and CHELSA (Karger et al., 2017). Assessing in detail the accuracy and potential",Earth Surface Processes and Landforms,Rock-glacier dams in High Asia,CHELSA
10.1016/j.foreco.2018.04.033,"using bioclimatic variables as independent variables (19 variables of the Chelsa database (Karger et al., 2017), and the De Martonne Aridity index",Forest Ecology and Management,Characterization of forest carbon stocks at the landscape scale in the Argentine Dry Chaco,CHELSA
10.3109/01612849609009404,"and knowing a person (Jenny & Logan, 1992; May, 1983; Tanner, Benner, Chelsa, & Gordon, 1993; Tillich, 1984).Knowing about a client connotes",Issues in Mental Health Nursing,Caring for Individuals with Severe and Persistent Mental Illness: The Contributions and Challenges of Residential Case Aides,CHELSA
10.1007/BF03160721,"Constructed Wetlands for Wastewater Treatment. Lewis Publishers, Inc., Chelsa, MI, USA. Bishel, L. 1994. Soil properties of natural reference",Wetlands,Plant and soil responses to salvaged marsh surface and organic matter amendments at a created wetland in central Pennsylvania,CHELSA
10.1016/j.cliser.2024.100512,"Copernicus Climate Change Service (C3S, Buontempo et al., 2022) and the CHELSA initiative, providing high-resolution climate data for the Earth’s",Climate Services,Leveraging observations and model reanalyses to support regional climate change adaptation activities: An integrated assessment for the Marche Region (Central Italy),CHELSA
10.1080/00927870701471845,"Verlag. Gantmacher, F. R. (1990). The Theory of Matrices. Vol. 1. New York: Chelsa. Gutman (1978). The energy of a graph. Ber. Math. Statist. Sekt.",Communications in Algebra,Energy Spectral Specifications for the Graph Reconstruction,CHELSA
10.1080/01904169509364972,"Metal Speciation: Theory, Analysis, and Application. Lewis Publishers, Chelsa, MI.  Chaney, R.L., P.F. Bell, and B.A. Coulombe. 1989. Screening",Journal of Plant Nutrition,Interaction between zinc deficiency and boron toxicity on growth and mineral nutrition of sour orange seedlings,CHELSA
10.1080/14767050802346980,"PRACTICE R. Gowda1, S. Richards2, S. Ray2, R. Nicholl2 1Neonatal Unit, Chelsae and Westminster Hospital, London, United Kingdom; 2Neonatal",The Journal of Maternal-Fetal & Neonatal Medicine,Oral and Poster Presentations,CHELSA
10.1111/cobi.13415,"resolution (Hagemeijer & Blair 1997). Climate data were obtained from the CHELSA database (http://chelsa-climate.org), which",Conservation Biology,Integrating intraseasonal grassland dynamics in cross‐scale distribution modeling to support waterbird recovery plans,CHELSA
10.1111/jvs.12710,"data. We retrieved data for all the 19 bioclimatic variables provided by CHELSA v1.1 (Karger et al., 2017) by averaging climatic data from the",Journal of Vegetation Science,sP lot – a new tool for global vegetation analyses,CHELSA
10.1111/johs.12185,"Biennial International Conference on Alcohol Drugs and Society in Africa, Chelsa Hotel Abuja 23 – 25 July,2008 p.4 37 Ibid 38 Thomas Babor, The",Journal of Historical Sociology,The Advertisement of Alcohol in Colonial and Post-Colonial Times in Southern Nigeria,CHELSA
10.1111/gcb.14755,"data from Worldclim (Hijmans, Cameron, Parra, Jones, & Jarvis, 2005) and CHELSA (Karger et al., 2017a, 2017b; ~800 m resolution). We then generated",Global Change Biology,Cold spot microrefugia hold the key to survival for Brazil's Critically Endangered Araucaria tree,CHELSA
10.1111/nuf.12303,"https://doi.org/10.1016/j.profnurs.2014.01.006 21. Benner P, Tanner C, Chelsa C. Expertise in Nursing Practices. 2nd ed. New York: Springer",Nursing Forum,Sound clinical judgment in nursing: A concept analysis,CHELSA
10.1016/j.ecoser.2018.08.005,"Climatologies at High resolution for the Earths Land and Surface Areas (CHELSA; Karger et al., 2016) and finally WorldClim V2 (Fick and Hijmans,",Ecosystem Services,Uncertainty in data for hydrological ecosystem services modelling: Potential implications for estimating services and beneficiaries for the CAZ Madagascar,CHELSA
10.1007/s13398-021-01025-3,"(2004) (Article 10) 16. Jordan, C.: The Calculus of Finite Differences. Chelsa Publishing Company, New York (1947) 17. Lewin, L.: Polylogarithms","Revista de la Real Academia de Ciencias Exactas, Físicas y Naturales. Serie A. Matemáticas",Parametric binomial sums involving harmonic numbers,CHELSA
10.1111/j.1365-2648.2011.05637.x,"nursing. Advances in Nursing Science 14(3), 13–28. Benner P., Tanner C. & Chelsa C. (2009) Expertise in Nursing Practice: Caring, Clinical Judgment,",Journal of Advanced Nursing,Knowledge mobilized by a critical thinking process deployed by nursing students in practical care situations: a qualitative study,CHELSA
10.1002/ncp.10207,"BSc, RD2; Roseann Nasser, MSc, RD, CNSC, FDC3; Jack Bell, PhD, AdvAPD4; Chelsa Marcell, BSc, RD2; Joseph Murphy, RD, MA5; Renata Valaitis, PhD1;",Nutrition in Clinical Practice,Impact of Facilitated Behavior Change Strategies on Food Intake Monitoring and Body Weight Measurements in Acute Care: Case Examples From the More-2-Eat Study,CHELSA
10.1111/geb.12804,"were collected with a layer of mean annual temperature within 30 arc s (CHELSA; Karger et al., 2017). However, such coor‐ dinates were available",Global Ecology and Biogeography,Cold and dark captivity: Drivers of amphibian longevity,CHELSA
10.1111/j.1369-7625.2006.00412.x,"International, 1992; 13: 241–248. 10 Tong EM, Sparacino PSA, Messias DKH, Foote D, Chelsa CA, Gillis CL. Growing up with congenital heart disease: the",Health Expectations,Exploring health-related experiences of children and young people with congenital heart disease,CHELSA
10.1016/S0367-2530(17)30519-4,"WDB. A. alexejanum REGEL - A. cristophii TRAUTV.  BG Duschanbe, UdSSR Chelsa Physic Gardens, GroBbritanien; PH Potsdam, BRD  3.2. Typen mit",Flora,Vergleichende Untersuchungen an Vertretern der AlliaceaeAgardh 1. Morphologie der Keimpflanzen der Gattung Allium L.,CHELSA
10.1080/00032719108052986,"Speciation,Separation andRecovew, J. Patterson editor, Lewis Publisher, Chelsa, Michigan, 1987,437. 22. G . Schwarzenbach and H. Flaschka, ComplexationTitration,Methuen,",Analytical Letters,Spectrometry: Speciation of Parts PER Billion of Metal Ions Using Silica and C18-Bonded Silica Columns and Graphite Furnace Atomic Absorption Spectrometry,CHELSA
10.1016/j.aucc.2008.02.003,"of the literature. J Clin Nurs 2002;11:140—8. 94. Benner P, Tanner CA, Chelsa CA. Expertise in nursing practice: caring, clinical judgement,",Australian Critical Care,Traumatic brain injury: An integrated clinical case presentation and literature review Part II: The continuum of care,CHELSA
10.1016/j.ecoleng.2022.106729,Centre (ISRIC) Climatologies at high resolution for the earth’s land (CHELSA)  surface  areas  factors into topographic and climate variables.,Ecological Engineering,Principal bioclimatic variables of ten dominant plant species in Korea wetland using the Maxent model,CHELSA
,"86.6 Chelsea, AL  393,000 VII  A very strong earthquake centering near Chelsa, Irondale, and Easonville, Alabama, threw down chimneys and broke",Open-File Report,Historical seismicity in the Southern Appalachian seismic zone,CHELSA
10.1016/j.catena.2023.107677,Types of covariates  Soil Sentinel 2 dataset Climate Climatic data from CHELSA Organisms Sentinel 2 dataset and CHELSA Relief,CATENA,Modelling and prediction of major soil chemical properties with Random Forest: Machine learning as tool to understand soil-environment relationships in Antarctica,CHELSA
10.1016/j.biocon.2021.109402,"and topography, we extracted breeding season climate variables from the CHELSA Bioclim database and three terrain variables (elevation, slope,",Biological Conservation,Balancing conservation priorities for grassland and forest specialist bird communities in agriculturally dominated landscapes,CHELSA
10.1002/ev.289,"health and illness. Thousand Oaks, CA: Sage. Benner, P., Tanner, C. A., & Chelsa, C. A. (1996). Expertise in nursing practice: Caring, clinical",New Directions for Evaluation,Toward developing competent evaluation managing,CHELSA
10.1207/s15327655jchn2301_5,"participants even discussing the potential threat of divorce. According to Chelsa et al. (2000), Latinos experience their diabetes holistically",Journal of Community Health Nursing,Living With Diabetes: Perceptions of Hispanic Migrant Farmworkers,CHELSA
10.1111/jbi.13001,"this purpose, we compared high-resolution interpolated climate data set CHELSA (Karger et al., 2016) and direct ﬁeld measurements of soil moisture",Journal of Biogeography,Niche asymmetry of vascular plants increases with elevation,CHELSA
10.1111/geb.13151,"climate (e.g., WorldClim; Hijmans, Cameron, Parra, Jones, & Jarvis, 2005; CHELSA; Karger et al., 2017) and soil data (e.g., Harmonised World Soil",Global Ecology and Biogeography,The edaphic control of plant diversity,CHELSA
10.1006/cbir.1996.0068,"Target Assays for Modern Herbicides and Related Phytotoxic Compounds. Chelsa, Lewis, 225–230. H M, O A, M G, C-P",Cell Biology International,INHIBITION OF CELLULAR GROWTH AND STEROID 11β-HYDROXYLATION INRAS-TRANSFORMED ADRENOCORTICAL CELLS BY THE FUNGAL TOXINS BETICOLINS,CHELSA
10.1111/jbi.13627,Climatologies at High Resolution for the Earth's Land Surface Areas (CHELSA) climatic variables and reflectance values from a basin‐wide,Journal of Biogeography,Discovering floristic and geoecological gradients across Amazonia,CHELSA
10.1016/j.geoderma.2010.12.005,"Modeling and Application. In: Selim, Ma, L. (Eds.), Ann Arbor Press, Chelsa, pp. 349–369. Gerke, H.H., Köhne, J.M., 2002. Estimating hydraulic",Geoderma,"Soil structure and flow rate-controlled molybdate, arsenate and chromium(III) transport through field columns",CHELSA
10.1890/04-0394,"publication, Society of Environmental Toxicology and Chemistry. Lewis Press, Chelsa, Michigan, USA. Lande, R. 1996. Statistics and partitioning of",Ecology,RELATIONSHIPS AMONG INDICES SUGGEST THAT RICHNESS IS AN INCOMPLETE SURROGATE FOR GRASSLAND BIODIVERSITY,CHELSA
10.1111/j.1440-1800.2011.00549.x,"reﬂections. Asia Paciﬁc Education Review 9: 50–61. Tanner C, P Benner, C Chelsa and D Gordon. 1993. The phenomenology of knowing the patient.",Nursing Inquiry,Nursing and competencies - a natural fit: the politics of skill /competency formation in nursing,CHELSA
10.1111/ddi.12953,"publicly available environmental data in conservation biogeography. KEYWORDS CHELSA, high‐throughput genomic data, IUCN, land cover, MODIS  1 | INTRODUCTION Most",Diversity and Distributions,The role of cryptic diversity and its environmental correlates in global conservation status assessments: Insights from the threatened bird's-eye primrose ( Primula farinosa L.),CHELSA
10.1080/00986440902834536,"EPA Environmental Assessment Sourcebook, ch. 4, 57–72, Ann Arbor Press, Chelsa, Mich. Also available at http:// www.epa.gov/ada/pubs/issue.html. Rana-Madaria,",Chemical Engineering Communications,A SIMPLE ROBUST CONTROL APPROACH FOR CR(VI) REGULATION OF WASTEWATER AT ELECTROCHEMICAL MIXED-FLOW REACTORS IN SERIES,CHELSA
10.1111/geb.13123,"millimetres per quarter) using 30 arc s (c.  1  km2) resolution data from CHELSA (Karger et  al.,  2017). We used LGM variables based on data",Global Ecology and Biogeography,The global abundance of tree palms,CHELSA
10.1111/geb.13108,"WorldClim v.1.4 (Hijmans, Cameron, Parra, Jones, & Jarvis, 2005) and CHELSA (http://chels​a-clima​te.org; Karger et al., 2017) climate variables",Global Ecology and Biogeography,A reply to the ‘critical evaluation of the Oscillayers methods and dataset’,CHELSA
10.1007/s00468-022-02271-7,located in the Chocó Region. The annual precipitation is shown based on CHELSA data (https://​chelsa-​clima​te.​org/) (Karger,Trees,Intra-annual isotope variations in tree rings reveal growth rhythms within the least rainy season of an ever-wet tropical forest,CHELSA
10.1016/j.ecolmodel.2022.109974,"occurrences for two species using a set of four bioclimatic variables from the Chelsa dataset (Karger et al., 2017), and 2) analysing occurrence datasets",Ecological Modelling,Discrepancies between point process models and environmental envelopes identify the niche centroid – geography configuration,CHELSA
10.1016/j.envpol.2022.120330,"representing air temperature and precipitation were retrieved from the CHELSA data­ base (Karger et al., 2017) (average 1979–2013) at the maximum",Environmental Pollution,Modelling the response of urban lichens to broad-scale changes in air pollution and climate,CHELSA
10.1111/j.1365-3180.2010.00785.x,"Management (eds JL HATFIELD, DD BUHLER & BA STEWART), 293. Ann Arbor Press, Chelsa, MI, USA. MORTIMER AM & MAXWELL BD (1994) Selection for herbicide",Weed Research,Weed communities of transgenic glyphosate-tolerant soyabean crops in ex-pasture land in the southern Mesopotamic Pampas of Argentina,CHELSA
10.1016/j.geoderma.2023.116649,"URL). Climate data primarily originated from the Modis, WorldClim, and Chelsa-climate datasets (DAAC, 2018; Hijmans et al., 2005; Karger et",Geoderma,A novel local-global dependency deep learning model for soil mapping,CHELSA
10.1016/j.geodrs.2023.e00687,periods was computed from the monthly precipitation data extracted from the CHELSA (Climatologies at high resolution for the earth’s land surface,Geoderma Regional,Applying RUSLE for soil erosion estimation in Romania under current and future climate scenarios,CHELSA
10.1007/s10113-021-01768-0,"islands’ climate stations, a time series analysis using monthly datasets of CHELSA (Karger et al. 2017) from the last 34 years (1979 to 2013) covering",Regional Environmental Change,Oceanic islands and climate: using a multi-criteria model of drivers of change to select key conservation areas in Galapagos,CHELSA
10.1016/j.beproc.2018.03.016,"like to thank Kristle Lambert for her assistance with data collection, Chelsae Rogers for help with behavioural coding, and Anne Storey for",Behavioural Processes,Social behaviour of domestic dogs (Canis familiaris) in a public off-leash dog park,CHELSA
10.1080/11263504.2019.1681532,classification system (WBCS) (Rivas-Martínez and al. 2011) using the CHELSA dataset as source data (Karger et al 2017). Bioclimatic variables,Plant Biosystems - An International Journal Dealing with all Aspects of Plant Biology,A phytosociological analysis of the Olea europaea L. var. sylvestris (Mill.) Lehr. forests in Sicily,CHELSA
10.1111/jbi.13734,climate variables for present and future conditions were taken from the CHELSA initiative with an original resolution of 30 arc‐sec (Karger,Journal of Biogeography,Model complexity affects species distribution projections under climate change,CHELSA
10.1111/j.1365-2702.2006.01345.x,"care. Journal of Nursing Administration 29, 31–38. Tanner C, Benner P, Chelsa C & Gordon D (1993) The phenomenology of knowing the patient.",Journal of Clinical Nursing,An evaluation of nursing practice models in the context of the severe acute respiratory syndrome epidemic in Hong Kong: a preliminary study,CHELSA
10.1002/ev.288,"of expert and to its use in nursing by Benner (2004; Benner, Tanner, & Chelsa, 1996). Dreyfus’s five-stage developmental model is presented,",New Directions for Evaluation,Deepening understanding of managing evaluation,CHELSA
10.1016/j.landusepol.2009.07.014,"Randers, J., Meadows, D., 2004. Limits to Growth—The 30 Year Update. Chelsa Green Publishing Company. Millennium Ecosystem Assessment—MEA,",Land Use Policy,Importing terrestrial biocapacity: The U.S. case and global implications,CHELSA
10.1016/j.ecoinf.2022.101702,"Climatologies at High-resolution for the Earth's Land Surface Areas (CHELSA) climate data (Karger et al., 2017). We down­ loaded DEM from",Ecological Informatics,"A MaxEnt modelling approach to understand the climate change effects on the distributional range of White-bellied Sholakili Sholicola albiventris (Blanford, 1868) in the Western Ghats, India",CHELSA
10.1016/j.jenvman.2021.113442,climatologies at high resolution for the Earth’s lands surface areas (http://chelsa-climate.org/ ); (2) land use and land cover (LULC) data (300,Journal of Environmental Management,Identification of conservation priorities in the major basins of Central Asia: Using an integrated GIS-based ordered weighted averaging approach,CHELSA
10.1016/j.dib.2023.109482,"point data with monthly covariates (global daily satellite rainfall data, CHELSA Climate Bioclimatic layers, NASA NEO long-term water vapour)",Data in Brief,Global rainfall erosivity database (GloREDa) and monthly R-factor data at 1 km spatial resolution,CHELSA
10.1016/j.epsl.2023.118233,"D.N., Nobis, M.P., Normand, S., Graham, C.H., Zimmermann, N.E., 2021. CHELSA-TraCE21k v1. 0. Downscaled transient temperature and precipitation",Earth and Planetary Science Letters,Climate oscillations and erosional processes in the Ordos tectonic block and implications for sediment supply to the Yellow River,CHELSA
10.1111/j.1399-3054.1988.tb02029.x,"Risk Communication, Amherst, MA April 21-27, 1987, Lewis Publishers, Chelsa, Ml. (In press). Baes, C. F. & McLaughlin, S. B. 1984. Trace",Physiologia Plantarum,Net CO2 exchange of Pinus taeda shoots exposed to variable ozone levels and rain chemistries in field and laboratory settings,CHELSA
10.1046/j.1365-2702.2002.00581.x,"distance them, to those that provided expert, creative and innovative care. Chelsa felt that: it may take exceptional personal power and clinical",Journal of Clinical Nursing,"Families, nurses and intensive care patients: a review of the literature",CHELSA
10.1007/s10113-020-01711-9,"conditions (1960–1990) and future projections (2061–2080) were obtained from CHELSA 1.2 (Karger et al. 2017) with a 30 arc-sec resolution, while",Regional Environmental Change,"High genetic diversity and low future habitat suitability: will Cupressus atlantica, endemic to the High Atlas, survive under climate change?",CHELSA
10.1111/eva.13029,"downscaling was based on the overlapping period with 302 the 1 km resolution Chelsa data (Karger et al., 2017). 303 We calculated 31 variables to",Evolutionary Applications,"Adaptation to drought is coupled with slow growth, but independent from phenology in marginal silver fir ( Abies alba Mill.) populations",CHELSA
10.1111/geb.13124,"precipitation seasonality (BIO15; to test Hypothesis 2). Climatic data are from CHELSA (Karger et al., 2017), and net primary productivity (NPP) data",Global Ecology and Biogeography,The global diversity and distribution of lizard clutch sizes,CHELSA
10.1111/j.1748-3743.2010.00261.x,"within a practical settings, rather than outcomes (Sussman et al., 2006; Chelsa, 2008). Speciﬁcally, it provides a continuum from the development",International Journal of Older People Nursing,Efficacy of the use of evidence-based algorithmic guidelines in the acute care setting for pain assessment and management in older people: a critical review of the literature,CHELSA
10.1080/00207239508711016,"Recovery, (Eds.), J. W. Patterson and R. Passina, Lewis Publishers, Inc., Chelsa, Michigan. 475-492 (1987). 23. R. R. Trussell, A. Trussell and",International Journal of Environmental Studies,Removal of selenium from water and wastewater,CHELSA
10.1016/j.pbi.2021.102169,"distribution data (https://www.gbif.org/), climatic variables (https://chelsa-climate.org/), nutrient data (https://www.try-db.org/ de/de.php,",Current Opinion in Plant Biology,Scaling up neodomestication for climate-ready crops,CHELSA
10.1007/BF02537375,"Carbonates: Mineralogy and chemistry.- Reviews in mineralogy, I 1,265-300, Chelsa (Miner. Soc. Amer. Book crafters)  VERttAGEN, B., TREDOUX, M.,",Facies,"Stable isotope stratigraphy across the K/T boundary, and isotopic investigations of an ‘Ignored’ worm bed, Eastern Desert, Egypt",CHELSA
10.1016/j.hrtlng.2004.08.001,"and illness. Thousand Oaks (CA): Sage; 1994. 37. Benner P, Tanner CA, Chelsa CA. From beginner to expert: gaining a differentiated clinical",Heart & Lung: The Journal of Acute and Critical Care,Accustomed to enduring: Experiences of African-American women seeking care for cardiac symptoms,CHELSA
10.1016/j.applanim.2016.12.013,"The authors appreciate the assistance of Kyle Krumsick, David Wilson, Chelsae Rogers, Alexandra Hayward, Rachael Johnston, Christine Ford,",Applied Animal Behaviour Science,Comparing two canine personality assessments: Convergence of the MCPQ-R and DPQ and consensus between dog owners and dog walkers,CHELSA
10.1016/j.geoderma.2023.116405,"ratios; a Boolean (0–1) vegetation layer obtained from the NDVI; and the CHELSA net primary productivity (NPP), placed to represent the vegetation",Geoderma,Machine learning applied for Antarctic soil mapping: Spatial prediction of soil texture for Maritime Antarctica and Northern Antarctic Peninsula,CHELSA
10.1111/nph.15544,"each species using locality data and climate layers obtained from the CHELSA (Karger et al., 2017) dataset. Highly correlated variables were",New Phytologist,The rise of the Andes promoted rapid diversification in Neotropical Phlegmariurus (Lycopodiaceae),CHELSA
10.1080/0260137032000172060,"(California: Addison-Wesley Publishing Co.). BENNER, P., TANNER, C. and CHELSA, C. (1996) Expertise in Nursing Practice (New York: Springer",International Journal of Lifelong Education,An integrated model of professional expertise and its implications for higher education,CHELSA
10.1111/ecog.04027,"species niches we considered the bioclimatic variables available from CHELSA (Karger et al. 2016) for the period 1979–2013, the land cover",Ecography,Addressing common pitfalls does not provide more support to geographical and ecological abundant-centre hypotheses,CHELSA
10.1111/btp.12535,for each site was obtained for a number of climatic variables from the CHELSA database (Karger et al. 2016) (1 km2 resolution) and is often,Biotropica,Tropical tree species diversity in a mountain system in southern Mexico: local and regional patterns and determinant factors,CHELSA
10.1111/2041-210X.13359,"Böhner, J., Kawohl, T., Kreft, H., Soria-Auza, R. W., … Kessler, M. (2016). CHELSA climatologies at high resolution for the earth's land surface",Methods in Ecology and Evolution,Improving the accuracy of land cover classification in cloud persistent areas using optical and radar satellite image time series,CHELSA
10.1111/jzs.12375,"Arya, 2006). As climatic data, we used the 19 bioclimatic layers from CHELSA (www.chelsa-clima​ te.org). Following the suggestions of Barve",Journal of Zoological Systematics and Evolutionary Research,"Multiple refugia and glacial expansions in the Tucumane–Bolivian Yungas: The phylogeography and potential distribution modeling of Calomys fecundus (Thomas, 1926) (Rodentia: Cricetidae)",CHELSA
