10.1080/00063657.2020.1732864,variables at the 1 km2 scale (average of the period 1979–2013) from the CHELSA (Climatologies at high resolution for the Earth’s land surface,Bird Study,Modelling the potential spread of the Red-billed Leiothrix Leiothrix lutea in Italy,CHELSA
10.1016/j.dib.2024.110384,"temperature, annual precipitation, temperature seasonality (obtained from CHELSA [27]; we used CHELSA data instead of EURO–CORDEX",Data in Brief,A harmonized database of European forest simulations under climate change,CHELSA
10.1016/j.heliyon.2024.e35315,"potential climate change scenarios, we used the climate projections of the CHELSA 2.1 project [32]. We used data from three forecasting algorithms:",Heliyon,"Insights into climate change dynamics: A tourism climate index-based evaluation of Gilgit-Baltistan, Pakistan",CHELSA
10.1111/oik.06141,"(1979–2013) annual temperature at a resolution of 30 arc-seconds (Biol 1, CHELSA Bioclim, Karger  et  al. 2017), and the slopes and intercepts",Oikos,Opening the black box of plant nutrient uptake under warming predicts global patterns in community biomass and biological carbon storage,CHELSA
10.1111/1365-2664.13197,"We used the WorldClim data rather than more recent alternatives (e.g. CHELSA, Karger et al., 2017), because it better reflects climatic conditions",Journal of Applied Ecology,European ornamental garden flora as an invasion debt under climate change,CHELSA
10.1002/app.46121,"1992, 25, 3492. 65. Jonscher, A. K. Dielectric Relaxation in Solids; Chelsa Dielectric: London, UK, 1983. 66. Ram, M.; Annapoorni, K. S.;",Journal of Applied Polymer Science,Investigation of dielectric properties of free standing electrospun nonwoven mat,CHELSA
10.1111/jbi.13926,"used occurrence data from CDH and bioclimatic variables provided by the CHELSA project (Karger et al., 2017) at 2.5-min resolution as explanatory",Journal of Biogeography,"Testing macroecological abundance patterns: The relationship between local abundance and range size, range position and climatic suitability among European vascular plants",CHELSA
10.1111/j.1365-2702.2007.01970.x,"Research, 2nd edn. Sage, Thousand Oaks, California. Tanner C, Benner P, Chelsa C & Gordon D (1993) The phenomenology of knowing the patient.",Journal of Clinical Nursing,Passing the audition - the appraisal of client credibility and assessment by nurses at triage,CHELSA
10.1080/00131857.2013.763590,"development of expertise (e.g. Dreyfus & Dreyfus, 1980 Benner, Tanner, & Chelsa, 1996; Charness et al., 2006) may well be helpful here. But I",Educational Philosophy and Theory,Competency-Based Approaches: Linking theory and practice in professional education with particular reference to health education,CHELSA
10.1002/ecm.1347,"the study area. Therefore, we downscaled the CRU on the basis of the CHELSA high-resolution layers of mean annual temperature and calculated",Ecological Monographs,Traditionally managed landscapes do not prevent amphibian decline and the extinction of paedomorphosis,CHELSA
10.1016/S1322-7696(08)60533-8,"nursing. Journal of Nursing Administration 32:509-523 Benner P,Tanner C, Chelsa A 1996 Expertise in nursing practice. Caring, clinical judgment",Collegian,Documentation of medication management by graduate nurses in patient progress notes: A way forward for patient safety,CHELSA
10.1002/jccs.198900040,"Binentoym, J.; Girman, J. E., in: Advances in Air Sampling. Lewis Publishers, Chelsa, Michigan, 1988, pp. 143-157. 5. Oliver, K. D.; Pleil, J. D.;",Journal of the Chinese Chemical Society,"Advanced Methodologies for Sampling and Analysis of Toxic Organic Chemicals in Ambient Outdoor, Indoor, and Personal Respiratory Air",CHELSA
10.1111/j.0022-3840.1981.1503_165.x,"State Political Parties, Arthur M. Schlesinger, Jr., editor. (New York: Chelsa House Publishers, 1973),11, 1006. Kleppner, The Cross of Culture,",The Journal of Popular Culture,"The Historical Images In Republican Campaign Songs, 1860-1900",CHELSA
10.1016/j.quascirev.2017.05.026,"Soria-Auza, R.W., Zimmermann, N.E., Linder, H.P., Kessler, M., 2016. CHELSA climatologies at high resolution for the earth's land surface",Quaternary Science Reviews,"Environmental dynamics and carbon accumulation rate of a tropical peatland in Central Sumatra, Indonesia",CHELSA
10.1016/j.hrtlng.2007.02.005,and family members’ perceptions. J Neurosci Nurs 1999;31: 348-56. 35. Chelsa CA. Reconciling technologic and family care in critical care,Heart & Lung: The Journal of Acute and Critical Care,Needs of family members of critically ill patients: A comparison of nurse and family perceptions,CHELSA
10.1080/00207239908711212,"McIntosh, Metal Ecotoxicology-Concept and Application (Lewis Publishers, MI. Chelsa), (1991) pp. 389-399. [3] E. Niebohr and D. H. S. Richardson,",International Journal of Environmental Studies,"Metals in aquatic ecosystems: mechanisms of uptake, accumulation and release‐Ecotoxicological perspectives",CHELSA
10.1007/s11356-022-21265-z,"precipitation of the wettest month for each stream site were obtained from CHELSA Bioclim (Karger et al. 2017, 2018; http://​www.​ chelsa-​clima​te.​org)",Environmental Science and Pollution Research,Fatty acid composition of macroinvertebrate scrapers in relation to environmental conditions in subtropical mountain streams,CHELSA
10.1016/j.ecoinf.2022.101773,"Rasters for 19 bioclimatic variables were downloaded from two databases: CHELSA (LGM, current climate, and future conditions (Karger et al. 2017;",Ecological Informatics,The impact of climate change on the future geographical distribution range of the endemic relict tree Gleditsia caspica (Fabaceae) in Hyrcanian forests,CHELSA
10.1016/j.biocon.2022.109560,"predictor variables (Table A3) that included bioclimatic variables from the CHELSA v2.1 database (Karger et al., 2017), edaphic variables from the",Biological Conservation,Range-wide priority setting for the conservation and restoration of Asian rosewood species accounting for multiple threats and ecogeographic diversity,CHELSA
10.1016/j.dib.2023.109621,"Time-series 2000–2020: ARD Landsat bands [7], derived vegetation indices, CHELSA images (precipitation, mean, min. and max. air temperature [8]),",Data in Brief,Global mangrove soil organic carbon stocks dataset at 30 m resolution for the year 2020 based on spatiotemporal predictive machine learning,CHELSA
10.1016/j.agrformet.2024.110039,cm) and subsurface (5–15 cm) soil layers. 2.2. Reanalysis data 2.2.1. CHELSA air temperature Climatologies at high resolution for the earth’s,Agricultural and Forest Meteorology,Evaluation of soil temperature in CMIP6 multimodel simulations,CHELSA
10.1016/j.catena.2023.107618,climatologies at high res­ olution for the earth’s land surface areas (CHELSA) database with a spatial resolution of about one kilometer (https://,CATENA,Machine learning-driven scenario-based models for predicting desert dust sources in central playas of Iran,CHELSA
10.1111/mec.15011,"1 month preceding the sampling date, using the timeseries data sets in the Chelsa database (Karger et al., 2017). Finally, seven physical and chemical",Molecular Ecology,Speciation in protists: Spatial and ecological divergence processes cause rapid species diversification in a freshwater chrysophyte,CHELSA
10.1016/j.ecolmodel.2022.110105,"their habitat requirements. We obtained 19 bioclimatic variables from the CHELSA database v.1.2 (Karger et al., 2017) which are derived from the",Ecological Modelling,Contrasting occupancy models with presence-only models: Does accounting for detection lead to better predictions?,CHELSA
10.1007/PL00005395,L.C. (1980): Lectures on the Calculus of Variations and Optimal Control. Chelsa,Numerische Mathematik,Estimates for numerical approximations of rank one convex envelopes,CHELSA
10.1080/00206810109465060,"of humic substances and coal: Techniques, problems, and solu­ tions: Chelsa, MI, Lewis Publishers. Wersin, P., Charlet, L., Kathrein, R.",International Geology Review,"Sorption of Trace Elements on Mineral Surfaces: Modern Perspectives from Spectroscopic Studies, and Comments on Sorption in the Marine Environment",CHELSA
10.1080/19443927.2012.761643,"Everyday Skillful Ethical Comportment. In: P. Benner, C. Tanner and C. Chelsa, eds. Expertise in Nursing Practice: Caring, Clinical Judgement,","Theatre, Dance and Performance Training",Here's one I made earlier: dialogues on the construction of an applied theatre practitioner,CHELSA
10.1111/1475-6765.00313,"sur l’application de l’analyse a` la probabilite` des voix. New York: Chelsa (orig. Paris: Imprimerie Boyale). Cox, G. (1987). The uncovered",European Journal of Political Research,Political competition,CHELSA
10.1016/0043-1354(95)00224-3,"11(13), 241-250. Pankow J. F. (1991) Aquatic Chemistry Concepts. Lewis, Chelsa, Mich. Rhoades J. D. (1982) Cation exchange capacity. In Methods  of",Water Research,Electroosmotically driven water flow in sediments,CHELSA
10.1016/S0965-2302(98)90053-4,"nursesuse intuition. American Journal of Nursing 87: 23-31 Benner P,Tanner C, Chelsa C 1992 From beginner to expert: gaining a differentiated clinical",Accident and Emergency Nursing,A & E nurses' constructs on the nature of nursing expertise: a repertory grid technique,CHELSA
10.1016/j.ecoinf.2018.06.005,"Climatologies at high resolution for the earth's land surface areas (CHELSA) (Karger et al., 2017a, 2017b). We assigned an increasing value",Ecological Informatics,Mapping uncertainty of ICP-Forest biodiversity data: From standard treatment of diffusion to density-equalizing cartograms,CHELSA
10.3133/pp1032B,"G.? nodosa. I removed the holotype from hard black shale collected at Chelsa, Ind., from the basal 2 feet of the New Albany Shale (Huddle",Professional Paper,Conodonts from the Genesee Formation in western New York,CHELSA
10.1046/j.1322-7114.2003.00404.x,"Perception. London: Routledge and Kegan Paul, 1962. 7 Benner P, Tanner C, Chelsa C. Experience in Nursing Practice: Caring, Clinical Judgment",International Journal of Nursing Practice,Nursing experience in Iran,CHELSA
10.1016/j.jaging.2007.11.002,"systematic fashion (Braudy Harris, 2002; Keady & Gilliard, 1999; Phinney & Chelsa, 2003; Snyder, 2001; Steeman, de Casterlé, Godderis, & Grypdonck,",Journal of Aging Studies,From ‘not a big deal’ to ‘hellish’: Experiences of older people with dementia,CHELSA
10.1007/s10682-019-10016-1,"index, minimum and maximum monthly temperatures) were downloaded from CHELSA (http://chels​a-clima​tic.org/), a climatic dataset providing",Evolutionary Ecology,Arid environments select for larger seeds in pines (Pinus spp.),CHELSA
10.1016/S0043-1354(00)00250-5,"Health Eects, Vol. 6, ed. R. E. Jolley, pp. 955±966. Lewis Publ Inc., Chelsa, Michigan, USA. Narkis N. and Kott Y. (1992) Comparison between",Water Research,Removal of chlorine dioxide disinfection by-products by ferrous salts,CHELSA
10.1007/s10113-020-01655-0,"(e.g. leading to aridity). The climate variables were downloaded from CHELSA (Karger et al. 2017) such as monthly mean, maximum, and minimum",Regional Environmental Change,Mediterranean wetland conservation in the context of climate and land cover change,CHELSA
10.1007/s10113-021-01831-w,niches (Sillero 2011) between sampling periods using climatic data from CHELSA dataset (Karger et al. 2017) and ecospat R package (Broennimann,Regional Environmental Change,Climate change in action: local elevational shifts on Iberian amphibians and reptiles,CHELSA
10.1080/10236190108808289,"Groningen (1998). [3] L. M. Milne-Thomson, The Calculus o f finite d~yerence, Chelsa Publishing Company, New York, 1981. [4] N. E. Norlund, Lecons",Journal of Difference Equations and Applications,Gevrey character of formal solutions of differential—difference equations with polynomials coefficients,CHELSA
10.1016/j.catena.2018.04.042,"(slope aspect) data. The sources used were the freely, online-available CHELSA high resolution (~1 km) climate world database (Karger et al.,",CATENA,Model-based spatio-temporal analysis of land desertification risk in Greece,CHELSA
10.1080/10572317.2018.1471963,"and information Consortium. (2014). South Africa: Joint statement by CHELSA, LIASA, NCLIS and SANLIC, digital media VAT could contribute",International Information & Library Review,The Deployment and Impact of LibGuides at Public Universities in South Africa,CHELSA
10.1080/08989621.2018.1442218,"legalistic and regulatory understandings of ethics (Benner, Tanner, and Chelsa 2009). Drawing on this literature, the person-oriented research",Accountability in Research,Person-oriented research ethics: integrating relational and everyday ethics in research,CHELSA
10.1111/hex.12080,"adults with type 2 diabetes. The Diabetes Educator, 2006; 32: 603– 613. 51 Chelsa CA, Chun KM. Accommodating type 2 diabetes in the Chinese American",Health Expectations,A systematic review of research into black and ethnic minority patients' views on self-management of type 2 diabetes,CHELSA
10.1002/tea.3660150103,"classroom: I. Testing a whole class at the same time. Unpublished manuscript, Chelsa College, University of London, 1975. Sills, T. W., & Herron,",Journal of Research in Science Teaching,The development and validation of a classroom test of formal reasoning,CHELSA
10.1111/oik.06693,"annual mean temperature and annual precipitation for each site from the CHELSA high-resolution climate data (Karger et al. 2017), as well as",Oikos,"Forest biomass, soil and biodiversity relationships originate from biogeographic affinity and direct ecological effects",CHELSA
10.1016/j.accre.2024.03.001,"precipitation were used to produce the current climate variables based on the CHELSA-EarthEnv dataset (Karger et al., 2020). The TDD and FDD were",Advances in Climate Change Research,Machine learning-based predictions of current and future susceptibility to retrogressive thaw slumps across the Northern Hemisphere,CHELSA
10.1016/j.dib.2023.109806,Climatologies at high resolution for the earth’s land surface areas (CHELSA v2.1) (https://envicloud.wsl.ch/#/?preﬁx=chelsa%2Fchelsa_V2%2FGLOBAL%2F),Data in Brief,Integrated social-ecological data for regional natural resource management,CHELSA
10.1016/j.gca.2022.04.022,"et al., 2020). For each site, daily average temperature measurements (CHELSA database version 2.1, Karger et al., 2017) were used to determine",Geochimica et Cosmochimica Acta,A nonlinear model for resolving the temperature bias of branched glycerol dialkyl glycerol tetraether (brGDGT) temperature proxies,CHELSA
10.1111/jbi.13527,potential niches. These three environmental variables were downloaded from Chelsa (http://chelsa-climate.org/) version 1.2,Journal of Biogeography,Phylogenetic and spatial analyses suggest minimum temperature as an environmental filter for turtle communities,CHELSA
10.1080/1072303X.2018.1472164,"and information Consortium. (2014). South Africa: Joint statement by CHELSA, LIASA, NCLIS and SANLIC, digital media VAT could contribute","Journal of Interlibrary Loan, Document Delivery & Electronic Reserve","Interlending Services: Trends, Languages, and use for Collection Development at North-West University",CHELSA
10.1016/j.foreco.2018.08.019,"However, other climatic databases including CliMond (Kriticos et al., 2012), CHELSA (Karger et al., 2017), MERRAClim (Vega et al., 2017) and ENVIREM",Forest Ecology and Management,Species distribution modelling tools and databases to assist managing forests under climate change,CHELSA
10.1111/j.1478-5153.2011.00448.x,"International Journal of Nursing Practice; 10: 10–20. Benner P, Tanner C, Chelsa C. (1996). Excellence and Power in Clinical Nursing Practice:",Nursing in Critical Care,Steering a course towards advanced nurse practitioner: a critical care perspective,CHELSA
10.1080/24704067.2019.1670089,"choosing a two-year institution versus a fouryear institution. For instance, Chelsae felt that breaking it up in two-years was a better option instead",Journal of Global Sport Management,Junior College or the NCAA: The Case of a U.S. Women’s Tennis Team with No U.S. Players,CHELSA
10.1016/0094-5765(89)90025-8,"Celestial Mechanics (Translated by N. Bowditch), Vol. 2, pp. 933-967. Chelsa, New York (1966). 6. F. Tisserand, Trait~ de Mdcanique Cbleste,",Acta Astronautica,Attitude stability of rigid satellites via a normalized Hamiltonian,CHELSA
10.1002/evl3.154,"large parts of the globe (e.g., WorldClim2, Fick and Hijmans 2017; or CHELSA, Karger et al. 2017). Species’ distribution records are publicly",Evolution Letters,Evolutionary genomics can improve prediction of species’ responses to climate change,CHELSA
10.1111/geb.13056,"Celsius; Climatologies at high resolution for the earth’s land surface areas CHELSA; Karger et al., 2017) and two isolation metrics, namely the distance",Global Ecology and Biogeography,Species–area relationships on small islands differ among plant growth forms,CHELSA
10.3133/wri024228,"unnumbered pages. ———1989, Drinking water health advisory—pesticides: Chelsa, Michigan, Lewis Publ., 819 p. ———2000a, Drinking water standards",Water-Resources Investigations Report,"Quality of shallow ground water in areas of recent residential and commercial development, Wichita, Kansas, 2000",CHELSA
10.1080/02772249509358249,"Sediments: Chemistry and Toxicity of In-Place Pollutants, Lewis Publ., Chelsae, MI (1990). 88. G. T. Ankley, R. A. Hoke, J. P. Giesy and P.",Toxicological & Environmental Chemistry,A review of microtox test and its applications,CHELSA
10.1080/03067319708028371,"(Paul T. Kostecki. Edward, J. Calabrese, eds. Lewis Publishers Inc., Chelsa, MI, 1992). lpp. 121 L. H. Hilpert, W. E. May, S. A. Wise, S.N.",International Journal of Environmental Analytical Chemistry,Practicality of Supercritical Fluid Extraction/Ir for the Measurement of Petroleum Hydrocarbons in Aged Soil: A Comparative Study Between Two Commercial Extractors,CHELSA
10.1046/j.1365-2648.2000.01600.x,"Helping the Client. A Creative Practical Guide.  Benner P., Tanner C. & Chelsa C. (1996) Expertise in Nursing  Sage, London, Newbury Park, California.  Practice:",Journal of Advanced Nursing,Clinical supervision as an emancipatory process: avoiding inappropriate intent,CHELSA
10.1016/j.ecolmodel.2022.110133,"available at a resolution of 30 arc-seconds (~1 km2 at the equator) in CHELSA 1.2 (Karger et al., 2017). First, to avoid multicollinearity,",Ecological Modelling,Insights on biodiversity drivers to predict species richness in tropical forests at the local scale,CHELSA
10.1101/2023.07.12.548617,"Zimmermann, N.E., Hari, C., Pellissier, L., Karger, D. (2022): Data from: CHELSA-BIOCLIM+ A novel set of global climate-related predictors at",Cold Spring Harbor Laboratory,The recency and geographical origins of the bat viruses ancestral to SARS-CoV and SARS-CoV-2,CHELSA
10.1002/eap.1834,"results found for West Africa (Nicholson et al. 2003, Ali et al. 2005). The CHELSA (climatologies at high resolution for the earth’s land surface",Ecological Applications,"Assessing regional drought impacts on vegetation and evapotranspiration: a case study in Guanacaste, Costa Rica",CHELSA
10.1080/0371750X.2013.851624,"York, USA (1987). 2. A. K. Jonscher, Dielectric Relaxation in Solids, Chelsa Dielectric Press, London, UK (1983). 3. R. K. Katare, “Application",Transactions of the Indian Ceramic Society,On the Impedance Measurement of High Resistivity Materials by Using a Parallel Resistor in Two Probe Arrangement,CHELSA
10.1111/j.1742-9544.2010.00013.x,"society, which has been described as more collectivist (Hwang, 1999; Park & Chelsa, 2007). It is possible that the foreclosure status may be longer",Australian Psychologist,Characteristics and Predictors of Romantic Relationships in Late Adolescence and Young Adulthood in Hong Kong and Australia,CHELSA
10.1016/j.ympev.2021.107292,"of current and LGM with 2.5-minutes resolution were obtained from the CHELSA (http://ch elsa-climate.org/) (Brown et al., 2018). Pearson’s",Molecular Phylogenetics and Evolution,Speciation along the elevation gradient: Divergence of Roscoea species within the south slope of the Himalayas,CHELSA
10.1016/j.agrformet.2024.110249,"potential evapo­ transpiration (PET, mm) at 30 arc sec resolution from CHELSA database (http://chelsa-climate.org/), according",Agricultural and Forest Meteorology,Patterns and controls of leaf litter nitrogen and phosphorus of broad-leaved tree species across and within the tropics and the extra-tropics,CHELSA
10.1007/s001990050303,"Gantmacher, F.R.: The theory of matrices, vol.2, pp.173-250. New York: Chelsa Publishing Company 1964 14. Karni, E., Schmeidler, D.: Fixed",Economic Theory,Fashion and wealth accumulation,CHELSA
10.1016/j.envres.2022.113906,arc-second resolution (approxi­ mately 30 m). Precipitation data were from CHELSA (Climatologies at high resolution for the earth’s land surface,Environmental Research,Urinary nitrate and sodium in a high-risk area for upper gastrointestinal cancers: Golestan Cohort Study☆,CHELSA
10.1111/jan.12040,"Categories/ThePracticeofProfessionalNursing/NursingStandards/ ANAPrinciples on 26 October 2012. Benner P., Tanner C. & Chelsa C. (2009) Expertise in Nursing Practice. Springer Publishing",Journal of Advanced Nursing,Nursing intellectual capital theory: operationalization and empirical validation of concepts,CHELSA
10.1111/j.1365-3040.1991.tb01545.x,"Application (eds ,I.R. Kramer & H.E. Allen), pp. 219-247. Lewis Publishers. Chelsa. MI. Coehran, W.G. & Cox, G.M. (1957) Factorial experiments in","Plant, Cell and Environment","Interactions of Cd with Zn, Cu, Mn and Fe for lettuce (Lactuca sativa L.) in hydroponic culture",CHELSA
10.1016/j.jenvman.2012.06.001,"Schmidtke, N.W. (Ed.), Toxic Contamination in Large Lakes. Lewis Publishers, Chelsa, Michigan, USA, pp. 237e281. Tenhulscher, T.E.M., Vandervelde,",Journal of Environmental Management,"Diffusive exchange of PAHs across the air–water interface of the Kaohsiung Harbor lagoon, Taiwan",CHELSA
10.1016/j.mad.2006.01.016,"ageing * Present address: Department of Immunology, Faculty of Medicine, Chelsa & Westminster Hospital, 369 Fulham Road, London SW10 9NH, UK.",Mechanisms of Ageing and Development,"T cell development, ageing and Interleukin-7",CHELSA
10.1111/nph.15663,"niches of terrestrial plant species: 19 bioclimatic variables from the CHELSA database (Karger et al., 2017) at c. 1 km2 resolution; a selection",New Phytologist,Niche divergence and limits to expansion in the high polyploid Dianthus broteri complex,CHELSA
10.1111/jvs.12746,"quality checks (Dauby et al., 2016). The climate data was extracted from CHELSA 1.2, a global climatology database at 1 km resolution (Karger",Journal of Vegetation Science,Tropical monodominant forest resilience to climate change in Central Africa: a Gilbertiodendron dewevrei forest pollen record over the past 2700 years,CHELSA
10.1111/jbi.13709,"quar‐ ter of the year (DryQRain)—were inferred from models generated by CHELSA (Karger et al., 2017) for each species, and the mean for each",Journal of Biogeography,"Rare species, Restionaceae, and the Cape flora",CHELSA
10.1002/bit.10555,"standards were determined by nephelometry using a QM300 nephelometer (Sanofi, Chelsa, MN) Complement Activation In an additional series of tests,",Biotechnology and Bioengineering,Immunoaffinity removal of xenoreactive antibodies using modified dialysis or microfiltration membranes,CHELSA
10.1002/rse2.102,"Conrad, J. Bo€hner, T. Kawohl, H. Kreft, R. W. Soria-Auza, et al. (2016). CHELSA climatologies at high resolution for the earth’s land surface",Remote Sensing in Ecology and Conservation,"A comparison of satellite remote sensing data fusion methods to map peat swamp forest loss in Sumatra, Indonesia",CHELSA
10.1007/s004100050326,"pressure-temperature-time paths. Mineral Soc Am Monogr, BookCrafters Inc, Chelsa Michigan Sterner SM, Bodnar RJ (1989) Synthetic ¯uid inclusions.",Contributions to Mineralogy and Petrology,"Retrograde fluids in the Archean Shawmere anorthosite, Kapuskasing Structural Zone, Ontario, Canada",CHELSA
10.1016/j.procbio.2003.11.046,"In: Proceedings of the 48th Purdue Industrial Waste Conference, 1993; Chelsa, MI, USA. [2] Yan YG, Tay JH. Characterization of the granulation",Process Biochemistry,Treatment of trichlorotoluene in an anaerobic/aerobic sequential reactor system,CHELSA
10.1007/BF00213296,"JK, Inskip MJ (t981) Health effects of methylmercury.  MARC Report 24, Chelsa College, London  Reynolds HT (1977) The analysis of cross classifications.",Archives of Environmental Contamination and Toxicology,"Organochlorine pesticides, octachlorostyrene, and mercury in the blood of Elb River residents, Germany",CHELSA
10.1007/BF03011474,"2odd. Vol. V de  la collection ~ ,Monografje m a t e m a t y c z n e ,,, Chelsa,  New-York (1952), 15•  329 p., 312 rdf. ~)ibl.  Prix : 6 $,",Annales Des Télécommunications,Bulletin analytique du Comité de Coordination des Télécommunications de l’Union Française,CHELSA
10.1080/00036811.2013.867018,"equations: theory and numerical analysis. North-Holland-Amsterdam: AMS Chelsa Publishing; 1984. [20] Cao Y, Lunasin EM, Titi E. Global well-posedness",Applicable Analysis,Global attractor for the regularized Bénard problem,CHELSA
10.1111/jbi.13851,"(MTCM, in °C) and annual precipitation (AP, in mm) were extracted from the CHELSA climate dataset (Karger et al., 2017). CHELSA",Journal of Biogeography,Influence of elevation on the species–area relationship,CHELSA
10.1002/ece3.4156,"and longitude). Third, we downloaded all 19 BIOCLIM variables from the CHELSA (Climatologies at high resolution for the earth’s land surface",Ecology and Evolution,Spatial analyses of two color polymorphisms in an alpine grasshopper reveal a role of small‐scale heterogeneity,CHELSA
