10.1890/12-2063.1,"A. Lipowsky, and C. Roscher, unpublished data), and from international plant trait databases: TRY (Kattge",Ecology,Predicting invertebrate herbivory from plant traits: Polycultures show strong nonadditive effects,Plant Trait Database
10.1016/j.envsoft.2006.05.001,ecology. To address the speciﬁc needs of scientists analysing data from a plant trait database developed,Environmental Modelling & Software,Web-based tools for data analysis and quality assurance on a life-history trait database of plants of Northwest Europe,Plant Trait Database
10.1111/nph.13889,her terminology of bark regions. The data set was uploaded to the TRY Plant Trait Database (Kattge,New Phytologist,Bark thickness across the angiosperms: more than just fire,Plant Trait Database
10.1016/S1364-8152(06)00191-5,"modelling, 121 Plant nitrogen concentration, 1042 Plant nutrient uptake, 45 Plant trait database, 1594 Plug-in",Environmental Modelling & Software,"Volume 21 Contents, Author, Subject Index",Plant Trait Database
10.1111/avsc.12001,"Academia, Praha, CZ. Ku¨ hn, I., Durka, W. & Klotz, S. 2004. BiolFlor – a new plant-trait database as a tool",Applied Vegetation Science,"Plant seedlings in a species-rich meadow: effect of management, vegetation type and functional traits",Plant Trait Database
10.1111/avsc.12066,"Science 16: 479–486. Ku€hn, I., Durka, W. & Klotz, S. 2004. BiolFlor: a new plant-trait database as a tool",Applied Vegetation Science,Impact of mid-successional dominant species on the diversity and progress of succession in regenerating temperate grasslands,Plant Trait Database
10.1111/geb.12501,"research consortium compiling global vegetation plot data, linked to the plant trait database TRY (see",Global Ecology and Biogeography,Big data for forecasting the impacts of global change on plant communities,Plant Trait Database
10.1029/2018JG004504,"Ecophysiological Traits and Yield (BETY, betydb.org, see section 2.5.1) plant trait database and a TBM",Journal of Geophysical Research: Biogeosciences,What Limits Predictive Certainty of Long-Term Carbon Uptake?,Plant Trait Database
10.1111/geb.13086,"170122. https://doi. org/10.1038/sdata.2017.122 Kattge, J. (2019). TRY plant trait database. Retrieved",Global Ecology and Biogeography,Assessing the reliability of predicted plant trait distributions at the global scale,Plant Trait Database
10.1016/j.ppees.2018.05.003,unpublished studies and complemented by additional data from the TRY Plant Trait Database (Kattge,"Perspectives in Plant Ecology, Evolution and Systematics","The ecology of Central European tree species: Trait spectra, functional trade-offs, and ecological classification of adult trees",Plant Trait Database
10.1016/j.dib.2018.12.005,"http://dx.doi.org/10.1016/j.ecss.2018.11.016. [2] I. Kühn, W. Durka, S. Klotz, BiolFlor: a new plant-trait database as a tool",Data in Brief,Species composition and plant traits of south Atlantic European coastal dunes and other comparative data,Plant Trait Database
10.1016/j.envexpbot.2018.10.015,"Perennials. pp. 168. Kühn, I., Durka, W., Klotz, S., 2004. BiolFlor: a new plant-trait database as a tool",Environmental and Experimental Botany,Temporal and spatial trade-offs between resistance and performance traits in herbaceous plant species,Plant Trait Database
10.1016/j.biocon.2015.03.034,"Evol. 3, 53–64. Kühn, I., Durka, W., Klotz, S., 2004. BiolFlor – a new plant-trait database as a tool",Biological Conservation,A cross-taxon analysis of the impact of climate change on abundance trends in central Europe,Plant Trait Database
10.1111/nph.14473,"Naturalist 104: 501–528. Ku€hn I, Durka W, Klotz S. 2004. BiolFlor: a new plant-trait database as a tool",New Phytologist,Functionally dissimilar neighbors accelerate litter decomposition in two grass species,Plant Trait Database
10.1111/1365-2435.13148,"https://doi.org/10.1002/ecm.1289 Kühn, I., Durka, W., & Klotz, S. (2004). BiolFlor -­ a new plant-­trait database as a tool",Functional Ecology,"Delivering the promises of trait-based approaches to the needs of demographic approaches, and vice versa",Plant Trait Database
10.1111/avsc.12383,"Diversity, S., Issue, S., Invasion, P., & Sep, E. (2004). BiolFlor : A New Plant-­Trait Database as a Tool",Applied Vegetation Science,"Is there more than meets the eye? Seed bank analysis of a typical novel ecosystem, the extensive green roof",Plant Trait Database
10.1111/j.1654-1103.2005.tb02363.x,"database is designed to enable linkages to existing soil, floristic or plant-trait databases. Keywords:",Journal of Vegetation Science,EcoPlant: A forest site database linking floristic data with soil and climate variables,Plant Trait Database
10.1111/j.1654-1103.2012.01421.x,"118: 69–75. Ku¨ hn, I., Durka, W. & Klotz, S. 2004. BiolFlor – a new plant-trait database as a tool",Journal of Vegetation Science,Patterns of weed co-occurrence at the field and landscape level,Plant Trait Database
10.1111/j.1600-0706.2011.19672.x,"structuring species, mean trait values were extracted from the alpine plants trait database ANDROSACE",Oikos,On the importance of intraspecific variability for the quantification of functional diversity,Plant Trait Database
10.1016/j.ecolind.2014.12.010,"North-western European trait database, Kleyer et al., 2008; and BROT, a plant trait database for Mediterranean",Ecological Indicators,"Evaluation of leaf features in forest trees: Methods, techniques, obtainable information and limits",Plant Trait Database
10.1111/1365-2435.12718,analysis (Cornelissen et al. 2003). Trait data were obtained from the TRY Plant Trait Database (Kattge,Functional Ecology,Shifts and linkages of functional diversity between above- and below-ground compartments along a flooding gradient,Plant Trait Database
10.1111/jvs.12292,"Universit€atstrasse 16, 8092 Zu¨ rich, Switzerland  Abstract Aim: Do plant trait databases represent",Journal of Vegetation Science,Estimating themissing species bias in plant trait measurements,Plant Trait Database
10.1111/brv.12481,"Seed Information Database of the Kew Garden (data.kew .org/sid), the TRY Plant Trait Database (https://www",Biological Reviews,Synzoochory: the ecological and evolutionary relevance of a dual interaction,Plant Trait Database
10.1016/j.agrformet.2019.05.005,trait plasticity that extends our understanding beyond sparse spatial plant trait database and improve,Agricultural and Forest Meteorology,A data-conditioned stochastic parameterization of temporal plant trait variability in an ecohydrological model and the potential for plasticity,Plant Trait Database
10.1016/j.gloenvcha.2011.04.010,"K., No¨ llert, S., Sartor, K., Wirth, C., 2010. A generic structure for plant trait databases. Methods",Global Environmental Change,Representing human behaviour and decisional processes in land system models as an integral component of the earth system,Plant Trait Database
10.1111/ddi.12384,"102, 632–640. Ku€hn, I., Durka, W. & Klotz, S. (2004) BiolFlor – a new plant-trait database as a tool",Diversity and Distributions,Past landscape explains forest periphery-to-core gradient of understorey plant communities in a reforestation context,Plant Trait Database
10.1111/nph.16109,collations (e.g. GLOPNET: Wright et al. 2004; TRY: Kattge et al. 2011; China Plant Trait Database: Wang et,New Phytologist,Functional ecology of congeneric variation in the leaf economics spectrum,Plant Trait Database
10.1111/2041-210X.12752,enabling integration with other databases and platforms such as the TRY plant traits database (Kattge,Methods in Ecology and Evolution,The Global Pollen Project: a new tool for pollen identification and the dissemination of physical reference collections,Plant Trait Database
10.1111/geb.12820,"al.,s 2009), and average plant height for trees (obtained from the TRY plant trait database: Kattge",Global Ecology and Biogeography,Habitat suitability estimated by niche models is largely unrelated to species abundance,Plant Trait Database
10.1111/1365-2745.12401,"strategy. Restoration Ecology, 19, 470–479. Kattge, J. et al. (2011) TRY Plant Trait Database. http://try-db.org",Journal of Ecology,"Globally, functional traits are weak predictors of juvenile tree growth, and we do not know why",Plant Trait Database
10.1111/avsc.12296,"21: 248–261. Ku€hn, I., Durka, W. & Klotz, S. 2004. BiolFlor – a new plant-trait database as a tool",Applied Vegetation Science,Response of understory plant communities and traits to past land use and coniferous plantation,Plant Trait Database
10.1111/nph.13234,"the ETH of Zurich, and data for 51 species were obtained from the TRY plant trait database (http://www.try-db.org/TryWeb/Home.php)",New Phytologist,As old as the mountains: the radiations of the Ericaceae,Plant Trait Database
10.1890/10-0630.1,"172:127–139. Ku¨ hn, I., W. Durka, and S. Klotz. 2004. BIOLFLOR: new plant-trait database as a tool",Ecological Monographs,Successful invaders co-opt pollinators of native flora and accumulate insect pollinators with increasing residence time,Plant Trait Database
10.1016/j.agrformet.2013.03.010,respiration); and (iii) the validation (e.g. continental discharge and plant trait database) of a process-based,Agricultural and Forest Meteorology,"From site-level to global simulation: Reconciling carbon, water and energy fluxes over different spatial scales using a process-based ecophysiological land-surface model",Plant Trait Database
10.1016/j.buildenv.2021.107733,"Leadley, S. Tautenhahn, G.D. Werner, T. Aakala, M. Abedi, et al., TRY plant trait database – enhanced",Building and Environment,Vegetation cover and plant-trait effects on outdoor thermal comfort in a tropical city,Plant Trait Database
10.1016/j.agrformet.2014.09.024,"databases already assemble information on seed traits (for instance the TRY Plant trait database, Kattge",Agricultural and Forest Meteorology,Ranges of critical temperature and water potential values for the germination of species worldwide: Contribution to a seed trait database,Plant Trait Database
10.1016/j.agrformet.2023.109650,"plant trait data (Table 1) comes from BIEN (Enquist et al., 2009) and the Plant Trait Database (TRY) (Kattge",Agricultural and Forest Meteorology,Predicted range shifts of alien tree species in Europe,Plant Trait Database
10.1111/1365-2664.13292,"https://doi.org/10.1111/ plb.12180 Kühn, I., Durka, W., & Klotz, S. (2004). BiolFlor – A new plant-­trait database as a tool",Journal of Applied Ecology,Management trade-offs on ecosystem services in apple orchards across Europe: Direct and indirect effects of organic production,Plant Trait Database
10.1111/1365-2435.13542,"S., Lavorel, S., Prentice, I. C., Leadley, P., … Wirth, C. (2020). TRY plant trait database – Enhanced",Functional Ecology,Choosy grazers: Influence of plant traits on forage selection by three cattle breeds,Plant Trait Database
10.1111/pce.13091,"Morris, Plavcová, et al. (2016) and Table S1 and are accessible via the TRY Plant Trait Database (https://www.try‐db.org/TryWeb/Home.php;","Plant, Cell & Environment",Vessel diameter is related to amount and spatial arrangement of axial parenchyma in woody angiosperms,Plant Trait Database
10.3170/2008-8-18453,"faced by plants, i.e. dispersal, establishment and persistence. As no plant trait database was available",Journal of Vegetation Science,Successional patterns of plant species and community diversity in a semi-deciduous tropical forest under shifting cultivation,Plant Trait Database
10.1111/geb.12882,expanded this dataset by including species from the recently published China Plant Trait Database (Wang et,Global Ecology and Biogeography,Domestic gardens play a dominant role in selecting alien species with adaptive strategies that facilitate naturalization,Plant Trait Database
10.1111/j.1558-5646.2012.01776.x,"26:1463– 1464. Ku¨hn, I., W. Durka, and S. Klotz. 2004. BiolFlor—a new plant-trait database as a tool",Evolution,DEGREE OF SPECIALIZATION IS RELATED TO BODY SIZE IN HERBIVOROUS INSECTS: A PHYLOGENETIC CONFIRMATION,Plant Trait Database
10.1111/1442-1984.12026,majority of species was extracted from available databases (such as BIOLFLOR plant trait database (Klotz,Plant Species Biology,Exploring the generality of associations between plant functional traits: evidence within ecological groups along an altitudinal gradient in Hyrcanian forest,Plant Trait Database
10.1002/ece3.2479,"their relationships, and the extent to which we can benefit from global plant trait databases to explain",Ecology and Evolution,Potential and limitations of inferring ecosystem photosynthetic capacity from leaf functional traits,Plant Trait Database
10.1016/j.agrformet.2018.03.012,version of this article).  the mean Vcmax25 derived for C3 crops using a plant trait database (https://www.try-db.org/TryWeb/Home.php).,Agricultural and Forest Meteorology,Comparing crop growth and carbon budgets simulated across AmeriFlux agricultural sites using the Community Land Model (CLM),Plant Trait Database
10.1111/geb.12406,"K., Nöllert, S., Sartor, K. & Wirth, C. (2011) A generic structure for plant trait databases. Methods",Global Ecology and Biogeography,Modes of functional biodiversity control on tree productivity across the European continent,Plant Trait Database
10.1016/j.jnc.2014.08.006,"Ecology and Evolution, 18, 182–188. BiolFlor. (2004). BiolFlor – A new plant-trait database as a tool",Journal for Nature Conservation,Plant functional diversity in agricultural margins and fallow fields varies with landscape complexity level: Conservation implications,Plant Trait Database
10.1016/j.limno.2021.125911,"Diaz, S., Lavorel, S., Prentice, I.C., Leadley, P., et al., 2020. TRY plant trait database - enhanced",Limnologica,Litter breakdown of invasive alien plant species in a pond environment: Rapid decomposition of Solidago canadensis may alter resource dynamics,Plant Trait Database
10.1111/geb.12515,"96, 1266–1274. Ku€hn, I., Durka, W. & Klotz, S. (2004) BiolFlor – a new plant-trait database as a tool",Global Ecology and Biogeography,Functional diversity underlies demographic responses to environmental variation in European forests,Plant Trait Database
10.1016/j.foreco.2013.01.019,"Ecol. 47, 169–222. Kühn, I., Durka, W., Klotz, S., 2004. BiolFlor – a new plant-trait database as a tool",Forest Ecology and Management,Effect of soil and canopy factors on vegetation of Quercus robur woodland in the boreo-nemoral zone: A plant-trait based approach,Plant Trait Database
10.1016/j.foreco.2015.11.050,"Mediterranean Basin. Ecology 90, 1420. Paula, S., Pausas, J.G., 2013. BROT: a plant trait database for Mediterranean",Forest Ecology and Management,Understory fuel load and structure eight to nine years after prescribed burning in Mediterranean pine forests,Plant Trait Database
10.1111/nph.12839,"initiatives such as the XFT Database, which will be made available via the TRY Plant Trait Database (http://www.try-db.org/TryWeb/Home.",New Phytologist,From systematic to ecological wood anatomy and finally plant hydraulics: are we making progress in understanding xylem evolution?,Plant Trait Database
10.1111/nph.13646,(Xylem Functional Traits Database; XFT) can be accessed from the TRY Plant Traits Database (https://www.try-db.org/TryWeb/Home.php),New Phytologist,Weak tradeoff between xylem safety and xylem-specific hydraulic efficiency across the world's woody plant species,Plant Trait Database
10.1111/j.1600-0587.2011.07286.x,"levels. – Ecol. Lett. 13: 597–605. Kühn, I. et al. 2004. BiolFlor – a new plant-trait database as a tool",Ecography,Effect of habitat area and isolation on plant trait distribution in European forests and grasslands,Plant Trait Database
10.1111/1365-2745.12178,"Nadrowski, K., N€ollert, S., Sartor, K. & Wirth, C. (2011) A generic structure for plant trait databases. Methods",Journal of Ecology,A model-based meta-analysis for estimating species-specific wood density and identifying potential sources of variation,Plant Trait Database
10.1111/geb.12996,19‐14‐00038 Editor: Andrew Kerkhoff  FLORES‐MORENO et al. Abstract Aim: Plant trait databases often,Global Ecology and Biogeography,Robustness of trait connections across environmental gradients and growth forms,Plant Trait Database
10.1111/gcb.13988,"eddy covariance network Fluxnet (Baldocchi et al., 2001) or the global plant trait database (Kattge",Global Change Biology,Models meet data: Challenges and opportunities in implementing land management in Earth system models,Plant Trait Database
10.1111/nph.14748,"climate change (Dıaz et al., 2007b; Valladares et al., 2015). Accordingly, plant trait databases have been",New Phytologist,Root traits are more than analogues of leaf traits: the case for diaspore mass,Plant Trait Database
10.1016/j.jag.2015.05.009,"al., 2014). This is encouraging, as it makes it possible  to use general plant trait databases for a",International Journal of Applied Earth Observation and Geoinformation,The imprint of plants on ecosystem functioning: A data-driven approach,Plant Trait Database
10.1111/jvs.12646,"(Supporting Information Appendix S2, S3, and S4) or accessible via the TRY Plant Trait Database (Kattge",Journal of Vegetation Science,BryForTrait - A life-history trait database of forest bryophytes,Plant Trait Database
10.1029/2019MS001609,"C:N ratios with spatial and temporal variation in the cost of N uptake. Plant trait databases (e.g.,",Journal of Advances in Modeling Earth Systems,Parametric controls on vegetation responses to biogeochemical forcing in the CLM5,Plant Trait Database
10.1111/ecog.04481,"spatial, taxonomic  www.ecography.org  Introduction In perhaps the first plant trait database, Theophrastus",Ecography,What we (don't) know about global plant diversity,Plant Trait Database
10.1016/j.earscirev.2013.12.007,circumMediterranean studies are compiled in the on-line BROT database [Plant Trait Database for Mediterranean,Earth-Science Reviews,"Wildland fire ash: Production, composition and eco-hydro-geomorphic effects",Plant Trait Database
10.1016/j.actao.2015.09.002,"databases are available for terrestrial plants (e.g. LEDA, BIOPOP and TRY plant traits databases, Poschlod",Acta Oecologica,Meta-analysis on the responses of traits of different taxonomic groups to global and local stressors,Plant Trait Database
10.1002/env.2239,"Nadrowski K, Nöllert S, Sartor K, Wirth C. 2011. A generic structure for plant trait databases. Methods",Environmetrics,Reversible jump MCMC for inference in a deterministic individual-based model of tree growth for studying forest dynamics,Plant Trait Database
10.1111/nph.13737,"from Zheng & Martınez-Cabrera (2013), which are accessible via the TRY Plant Trait Database (https://www.try-db.org/",New Phytologist,A global analysis of parenchyma tissue fractions in secondary xylem of seed plants,Plant Trait Database
10.1016/j.flora.2014.04.006,"Hydrobiol. 34, 175–187. Kühn, I., Durka, W., Klotz, S., 2004. BiolFlor–a new plant-trait database as a tool","Flora - Morphology, Distribution, Functional Ecology of Plants",Vegetation patterns of floodplain meadows along the climatic gradient at the Middle Elbe River,Plant Trait Database
10.1002/ece3.989,"hypotheses, and one multiple imputation method were tested using a large plant trait database, together",Ecology and Evolution,Filling the gap in functional trait databases: use of ecological hypotheses to replace missing data,Plant Trait Database
10.1111/1365-2664.12826,"12, 235–244. Ku€hn, I., Durka, W. & Klotz, S. (2004) BiolFlor – a new plant-trait database as a tool",Journal of Applied Ecology,Increasing species richness but decreasing phylogenetic richness and divergence over a 320-year period of urbanization,Plant Trait Database
10.1002/ecy.1649,"­improved the manuscript greatly. The study has been supported  by the TRY plant trait database, which",Ecology,The association of leaf lifespan and background insect herbivory at the interspecific level,Plant Trait Database
10.1080/01431161.2012.744491,"20: 230–40. Kuhn, I., W. Durka, and S. Klotz. 2004. “BiolFlor: A New Plant-Trait Database as a Tool",International Journal of Remote Sensing,Spectral separability of riparian forests from small and medium-sized rivers across a latitudinal gradient using multispectral imagery,Plant Trait Database
10.1111/avsc.12450,phylogeny  2.6 | Trait data acquisition and standardization We used the TRY Plant Trait Database to gather,Applied Vegetation Science,Hardscape floristics: Functional and phylogenetic diversity of parking lot plants,Plant Trait Database
10.1016/j.baae.2013.10.006,"Díaz, S., Lavorel, S., Madin, J., et al. (2011). A generic structure for plant trait databases. Methods",Basic and Applied Ecology,The more the merrier: Multi-species experiments in ecology,Plant Trait Database
10.1016/j.tree.2014.09.010,(estimated from their Figure 1) 1700 species of woody plants from the global plant trait database of the,Trends in Ecology & Evolution,Bimodality of plant height: fact or artifact? A response to Scheffer et al.,Plant Trait Database
10.1111/nph.12454,"(leaf N, Chl, SLA) and month could not explain. Plant trait data from a plant trait database (Biofuel",New Phytologist,Scale dependence in the effects of leaf ecophysiological traits on photosynthesis: Bayesian parameterization of photosynthesis models,Plant Trait Database
10.1002/ajb2.1059,allow users to subset trait data from online repositories such as the TRY Plant Trait Database  Name reconciliation,American Journal of Botany,Challenges of comprehensive taxon sampling in comparative biology: Wrestling with rosids,Plant Trait Database
10.1111/nph.13904,of wood and leaf nutrients suggest that leaf nutrient values in global plant trait databases have the,New Phytologist,Variation in wood nutrients along a tropical soil fertility gradient,Plant Trait Database
10.1111/oik.02367,the data. Data from this investigation are publically available in the Plant Trait Database (TRY) < www.try-db.org/TryWeb/,Oikos,Species diversity and identity effects on the water consumption of tree sapling assemblages under ample and limited water supply,Plant Trait Database
10.1111/nph.14735,of being readily available traits for large numbers of species in many plant trait databases (e.g.,New Phytologist,Can dispersal investment explain why tall plant species achieve longer dispersal distances than short plant species?,Plant Trait Database
10.1111/nph.15524,leaf litter decay rates by combining observations from the TRY global plant traits database (accessed,New Phytologist,"Leaf litter decay rates differ between mycorrhizal groups in temperate, but not tropical, forests",Plant Trait Database
10.1111/jvs.12507,"span, vegetative reproduction and dormant bud position was sourced from a plant trait database held in",Journal of Vegetation Science,Biotic homogenization in an increasingly urbanized temperate grassland ecosystem,Plant Trait Database
10.1016/j.landurbplan.2015.07.016,"http://dx.doi.org/10.1111/j.1461-0248.2010.01457.x Kuhn, I., Durka, W., & Klotz, S. (2004). BiolFlor—A new plant-trait database as a tool",Landscape and Urban Planning,Landscape effects on plants in forests: Large-scale context determines local plant response,Plant Trait Database
10.1111/j.1654-1103.2012.01435.x,regional/national species lists (e.g. Rameau et al. 1989; Schmidt et al. 2003) and plant trait databases (e.g.,Journal of Vegetation Science,Understorey plant species show long-range spatial patterns in forest patches according to distance-to-edge,Plant Trait Database
10.1002/2017RG000581,replacing plant functional types by continuous trait spectra. The global plant trait database TRY (www.try-db.org),Reviews of Geophysics,Pedotransfer functions in Earth system science: challenges and perspectives,Plant Trait Database
10.1016/j.biocon.2018.02.008,"plant population matrices (Salguero-Gómez et al., 2015) combined with a plant trait database (Kattge",Biological Conservation,Relating plant height to demographic rates and extinction vulnerability,Plant Trait Database
10.1029/2019MS001841,dead stems). Leaf C:N:P stoichiometry data primarily came from the TRY plant trait database [Kattge,Journal of Advances in Modeling Earth Systems,Assessing impacts of plant stoichiometric traits on terrestrial ecosystem carbon accumulation using the E3SM land model,Plant Trait Database
10.1111/gcb.12674,"Bull, 2011), and due to the lack of published information also the online Plant Trait Database (Kattge",Global Change Biology,Effects of high-severity fire drove the population collapse of the subalpine Tasmanian endemic conifer Athrotaxis cupressoides,Plant Trait Database
10.1111/nph.13881,Cvalues database (http://data.kew.org/cvalues/) is integrated into the TRY Plant Trait database (https://www.try-db.org/TryWeb/,New Phytologist,Genome size and ploidy influence angiosperm species' biomass under nitrogen and phosphorus limitation,Plant Trait Database
10.1080/11263504.2018.1559250,"Biol. 17(9):2905–2935. Ku€hn I, Durka W, Klotz S. 2004. BiolFlor: a new plant-trait database as a tool",Plant Biosystems - An International Journal Dealing with all Aspects of Plant Biology,Plant–environment interactions through a functional traits perspective: a review of Italian studies,Plant Trait Database
10.1016/j.flora.2022.152116,"Prentice, I.C., Leadley, P., Tautenhahn, S., Werner, G., et al., 2020. TRY plant trait database–enhanced",Flora,Relationships between topographic variation and plant functional trait distribution across different biomes,Plant Trait Database
