10.1111/fwb.13080,been linked to predation on other seed vectors such as crayfish. In the plant trait database Baseflore,Freshwater Biology,Crayfish invasion facilitates dispersal of plants and invertebrates by gulls,Plant Trait Database
10.1111/geb.12821,GitHub repository with data cleaning scripts in R; con‐ tribution to TRY plant trait database (www.try-db.org),Global Ecology and Biogeography,Tundra Trait Team: A database of plant traits spanning the tundra biome,Plant Trait Database
10.1002/bes2.1460,"specific stressors, as highlighted in the talk by D’Antonio using the plant trait database REST (Ostertag",The Bulletin of the Ecological Society of America,Global Change and the Vulnerability of Chaparral Ecosystems,Plant Trait Database
10.1016/j.ecoinf.2018.11.003,"Living Australia, the National Ecological Observatory Network, and the TRY Plant Traits Database serve",Ecological Informatics,The Bari Manifesto: An interoperability framework for essential biodiversity variables,Plant Trait Database
10.1016/j.biocon.2018.11.010,"in China (Chen and Huang, 2000), KEW seed (http://data.kew.org/), TRY plant trait database (https://www.try-db.org/).",Biological Conservation,Priorities and conservation gaps across three biodiversity dimensions of rare and endangered plant species in China,Plant Trait Database
10.1016/j.ppees.2011.04.003,"K., Nöllert, S., Sartor, K., Wirth, K., 2011. A generic structure for plant trait databases. Methods","Perspectives in Plant Ecology, Evolution and Systematics",When and how should intraspecific variability be considered in trait-based plant ecology?,Plant Trait Database
10.1002/ecs2.3140,"e03140   AGROECOSYSTEMS  GARCIA ET AL.  et al. 2016, Gaba 2017). In this context, the use of plant trait databases (Kleyer",Ecosphere,Seasonal and interannual variations in functional traits of sown and spontaneous species in vineyard inter‐rows,Plant Trait Database
10.1016/j.ecolind.2022.108707,"Zirbel, C.R., Zizka, G., Zo-Bi, I.C., Zotz, G., Wirth, C., 2020. TRY plant trait database - enhanced",Ecological Indicators,"Species-based indicators to assess habitat degradation: Comparing the conceptual, methodological, and ecological relationships between hemeroby and naturalness values",Plant Trait Database
10.1016/j.ecolmodel.2015.07.005,"Nöllert, S., Sartor, K., Wirth, C., 2011a. a: A generic structure for plant trait databases. Methods",Ecological Modelling,Merging trait-based and individual-based modelling: An animal functional type approach to explore the responses of birds to climatic and land use changes in semi-arid African savannas,Plant Trait Database
10.1016/j.landurbplan.2010.07.001,"Res. 6, 749–764. Kühn, I., Durka, W., Klotz, S., 2004b. BiolFlor—a new plant-trait database as a tool",Landscape and Urban Planning,Testing taxonomic and landscape surrogates for biodiversity in an urban setting,Plant Trait Database
10.1016/j.envsoft.2006.05.016,"development of a Web-based data mining tool for analysing data from a plant trait database, an approach",Environmental Modelling & Software,Environmental informatics,Plant Trait Database
10.1002/ecy.1928,was equal among treatments (Saville 1990). Nitrophilic species Since a plant trait database of nitrophily,Ecology,Non-random species loss in a forest herbaceous layer following nitrogen addition,Plant Trait Database
10.1111/avsc.12345,"collated from the Australian Fire Ecology Database, available from the TRY plant trait database (Kattge",Applied Vegetation Science,"Effects of fire regime on plant species richness and composition differ among forest, woodland and heath vegetation",Plant Trait Database
10.1111/jbi.13623,"S., Lavorel, S., Madin, J., … Wirth, C. (2011). A generic structure for plant trait databases. Methods",Journal of Biogeography,GIFT – A Global Inventory of Floras and Traits for macroecology and biogeography,Plant Trait Database
10.1016/j.geoderma.2023.116380,lifespan and growth rates. With the rapid development of open-access plant-trait databases (Guerrero-Ramírez,Geoderma,Influences of plant traits on the retention and redistribution of bioavailable nitrogen within the plant-soil system,Plant Trait Database
10.1016/j.agee.2014.01.003,insect-pollinators and plants because such data are still lacking in most plant trait databases of the,"Agriculture, Ecosystems & Environment",Plant diversity in Mediterranean cereal fields: Unraveling the effect of landscape complexity on rare arable plants,Plant Trait Database
10.1002/jctb.5000502508,"JIIIICI!#. 1031  CIIEhI[RTRY AND INDUSTRY  519  REVIEWS  clictil2lc. Clicinical iudustry is,",Journal of the Society of Chemical Industry,"A history of the british chemical industry. By stephen miall. With a foreword by Sir Hurry McGowan, K.B.E. written for the society of chemical industry on the occasion of the fiftieth anniversary of its foundation. Pp. xvi+273. London: E. Benn, Ltd., 1931. 10s. 6d",rtry
10.3133/ofr6779,"principally of flna to vtry aaavaa aaai aaJ Thtrtaftar, lnt*x%oaaod laytrt of rtry flat to nadltBi aand aad lay prrralltd to a oepta of abant fOO",Open-File Report,"Preliminary results of the investigation of the saline-water resources in the Hueco Bolson near El Paso, Texas",rtry
10.3109/00016486609127063,"attributed in three c:i\es to iiieacle\, meningitis or cerehral concu\sion. X-rtry stzzclic~srevcaled normal 1)iieni~iatizatioii n all 27 cases. Abnoriiial",Acta Oto-Laryngologica,Unilateral Deafness in Children,rtry
10.1080/00766097.1978.11735411,RIT AI N I N 197 7  17 1  SCO T L AN D DUMFRIES AI'D GALLOWAY (Stewa rtry of K irkcud brigh tshire}: THREAVE CASTLE (N X 7396~22 ) . G .,Medieval Archaeology,Medieval Britain in 1977,rtry
10.1111/j.1432-1033.1991.tb16188.x,"27. Slobin, L. I . , Clark, R. V. & Olson, M. 0 . J. (1981) Biochemi,rtry 20, 5761 - 5767. 28. Amons, R., Pluijms, W., Roobol, K. & Moller,",European Journal of Biochemistry,Association of ribosomal subunits. A new functional role for yeast EF-1alpha in protein biosynthesis,rtry
10.1016/S0014-5793(02)03495-6,"Brandstetter). Abbreviations: rf9a, recombinant factor IXa; rf10a, recombinant factor Xa; rTry, recombinant trypsin; rXYa, recombinant factor Xatrypsin hybrid;",FEBS Letters,The influence of residue 190 in the S1 site of trypsin-like serine proteases on substrate selectivity is universally conserved,rtry
10.1111/j.2042-7158.1991.tb06707.x,"L. D O R R I S , Department of Pharmacology. Baylor College of Denti,rtry. Dallas, Trxus 75246, U S A  Abstract-Mice were exposed to nitrous",Journal of Pharmacy and Pharmacology,Protection of acetylcholinesterase by meptazinol in mice exposed to di-isopropyl fluorophosphate. Comparison with physostigmine,rtry
10.1002/hlca.19980810106,"R. W. Sobol, R. J. Suhadolnik, R. Charubala, W. Pfleiderer, Biochemi,rtry 1987, 26, 7136. 1161 R. Charnhala, W. Pfleiderer, ‘Progress in",Helvetica Chimica Acta,Nucleotides. Part LV. Synthesis and application of a novel linker for solid-phase synthesis of modified oligonucleotides,rtry
10.3109/00016355809064110,"ker:itinizcd. 'l'his concept is shnretl by in:iny ~ L I thors iRernier and Rtry, 1952). There are three possihle routes of excretion: First, if",Acta Odontologica Scandinavica,The Passage of Tissue Fluid into the Clinically Healthy Gingival Pocket,rtry
10.1002/ange.19941060104,"Guiles, R. D. Britt, S. L. Dexheimer, K. Sauer, M. P. Klein, Biochemi,rtry 1987, 26, 5967. [125] V. K. Yachandra, R. D. Guiles, A. McDermott,",Angewandte Chemie,"Röntgenabsorptionsspektroskopie an amorphen Festkörpern, Flüssigkeiten, katalytischen und biochemischen Systemen — Möglichkeiten und Grenzen",rtry
10.1007/s10404-009-0427-4,"velocity across the microchannel at 100 discrete phases over one period (e = RtRy|un(y,t)-ua(y,t)| / RtRy|ua(y,t)|) was found",Microfluidics and Nanofluidics,Numerical analysis of high frequency pulsating flows through a diffuser-nozzle element in valveless acoustic micropumps,rtry
,"Avail* Witty Bute. Release Unlimited _ c3.0 Ar11J-.Z31.I f1  ­ 11. S.c,rtry Class (T1+is R.owd Unclassified 211. Socart y cta.. (Me. Ps,r,l Unclassified",,OFR 95-86 - Availability of Strategic and Critical Minerals: Role of the Republic of South Africa. 1986.,rtry
,"Drilled(ft)  92(?) 23(?) N/A 148 380 7 338 62 46 1 80 1,1 7 7  Conv. Rtry  no  Conv. Rrty  no  Percussion  no  RC(?)  no  “Percussion”  RC  no  DDH  ?  RC  yes  DDH  yes  RC  yes  Mud",,"NI 43-101 Technical Report for the Robertson Project in Nevada, United States dated January 2008",rtry
10.1002/pro.5560071019,"likely related to their different functions in the bacterial cell. The X-rtry ,str/:c.t/:re.os f' IIA""""' ( I d IIA"""" The structure of lIA""l""",Protein Science,The functional importance of structural differences between the mannitol-specific IIA mannitol and the regulatory IIA nitrogen,rtry
10.3200/JOER.98.2.79-93,"were over 1.1 rnillior-i teacher aides in classrooms throughout the conr-rtry (Br-rreau of Labor Statistics, 2000) of whom nost were assigned",The Journal of Educational Research,Classroom Organization and Student Behavior in Kindergarten,rtry
10.1002/jctb.5000502509,"JIIIICI!#. 1031  CIIEhI[RTRY AND INDUSTRY  519  REVIEWS  clictil2lc. Clicinical iudustry is,",Journal of the Society of Chemical Industry,"A History of the british chemical industry. By Stephen Miall. With a Foreword by Sir Harry McGowan, K.B.E. Written for the Society of chemical industry on the occasion of the fiftieth anniversary of its foundation. Pp. xvi+273. London: E. Benn. Ltd., 1931. 10s. 6d",rtry
10.1080/00140139.2014.897374,Post  p-valueb  Pre  FIT Post  p-valueb  Pre  MOV Post  p-valueb  ASLR HSTP ILNG PSHP RTRY SHLD DSQT COMP  1.8 (0.17) 1.9 (0.08) 2.1 (0.13) 2.0 (0.19) 2.0,Ergonomics,Physical fitness improvements and occupational low-back loading – an exercise intervention study with firefighters,rtry
10.1080/02648725.1998.10647963,"glycosylphosphatidylinositol protein  anchors. An1lual Reviews in Bioche11,;.rtry 62, 121-138.  FANKHAUSER, C., HOMANS, S.W., THOMAS-OATES,. J.E.,",Biotechnology and Genetic Engineering Reviews,Cell Wall Proteins of Saccharomyces cerevisiae,rtry
10.1111/j.1432-1033.1985.tb09143.x,"Waterborg, J. IT., Mueller, R. D. & Matthews, H . R. (3983) Biochemi,rtry 22, 38-51. 3. Chambers, T. C., Langan, T. A., Matthews, H. R. &",European Journal of Biochemistry,Physical studies by NMR and circular dichroism determining three structurally different domains in Physarum polycephalum histone H1,rtry
10.1139/o72-150,"only.  Bantisg and Best Department of MedicaB Research and Dqar~rnenbof Biocherni,rtry, Uniusrsdty of Toronto, Toronlo, Ontario Received December E 3,",Canadian Journal of Biochemistry,A Role of Cytidine 5′-Diphosphocholine in the Transfer of N -Acetylglncosamine from UDP- N -acetylglucosamine into Endogenous Acceptor Lipids and Proteins in Rat and Hen Liver Microsomes,rtry
10.1080/23796529.2000.11674553,"' .. /-""trI_ t)fIh d """"v'''''~  , III ..........,...' _""""""~ """"'IM'I,~rtrY  prof'''........J 'J''''''''';'' i .....J""· /0''''.'<11,11 b, """"f.US  ,~,",Journal of Visual Literacy,"Culture, Visual Literacy, and Literacy Training in Nepal",rtry
10.1139/b78-076,For personal use only.  FIGS.29-37. M i c r o g l o e ~ r ~ ~ ~ perxr rtry~pie in BPI. Fig. 29. Vertical section of a coniclioma. x 170. Fig.,Canadian Journal of Botany,"Genera coelomycetum. XIV. Allelochaeta, Basilocula, Ceuthosira, Microgloeum, Neobarclaya, Polynema, Pycnidiochaeta, and Xenodomus",rtry
10.1007/s12204-014-1524-4,= [u(1) λ(1)]T ⎪⎪⎪⎪⎭  y = [u(2) λ(2)]T  Then we obtain STSz + RTa = 0 RTRy − STb = 0 . (8)  The Lagrange multiplier vectors a and b are obtained,Journal of Shanghai Jiaotong University (Science),Intrusion detection model with twin support vector machines,rtry
10.1002/jctb.5000420418,"17 48 40 60 Mg. of t I, ,I   Journal oj the Society of Ciwmical ZnfZ~~rtry.  Jnn. 20. 1023.1  LANEAND EYNON.-DETERB~INATOFIORNEDUCIXa SUOzUW.  35T  nboiit",Journal of the Society of Chemical Industry,Transactions,rtry
10.1139/p80-015,"30Znfollowing electron bombardment  A N A N DN . N I G A MA N D SUSHMAKO-THARI ,Y-rtry Lt//~ot.t~to~.iDcr,sp,tr1.ttiretlt c~fP/ry.sic.s.Uttiro,:rity c!f'./ot//rplir.",Canadian Journal of Physics,New K α satellites of 30 Zn following electron bombardment,rtry
10.1016/0022-2836(90)90199-V,"Clarendon Press.  Oxford.  Cambillau. C. (1989). Tn Silicon Graphics (:aom,rtry  Partners Directory (Silicon Graphics, rd.). p. 61.  Mountain View.",Journal of Molecular Biology,X-ray crystal structure determination and refinement at 1.9 Å resolution of isolectin I from the seeds of Lathyrus ochrus,rtry
10.1080/03087298.1983.10442780,(Non-destructive Elemental Analysis of Photographic Paper and Emulsions by X-rtry Fluorescence Spectroscopy) is Director of the Center of Creative,History of Photography,Contributors to this issue,rtry
10.1007/BF02881122,"CHRISTENSEN University of Minnesota and H. A. RODENHISER Bureau of Plant Indu,rtry~ PRYSIOLOr SPECIALIZATmn It has long been known that within species",The Botanical Review,Physiologic specialization and genetics of the smut fungi,rtry
10.1111/j.1432-1033.1985.tb09125.x,"Kastenschmidt, L. L., Kastcnschmidt, J. & Hclmrcich, E. (1968) Biochemi,rtry 7, 3590 -3608. 17. Sziics. K., Vereb, G . & Bot, G . (1983) l n",European Journal of Biochemistry,Phosphorylase kinase from chicken gizzard. Partial purification and characterization,rtry
10.1111/j.1600-0773.1998.tb01408.x,"ycast alcohol dehydrogenase to hypocfiloride and peroxynitritc. Biochc.mi,rtry 1995, 34, 3544 3552. Iklaney, C. A.. R.Tyrbcrg, L. Bouwens, H.",Pharmacology & Toxicology,Peroxynitrite: A Putative Cytotoxin,rtry
10.1080/03087298.1983.10442779,(Non-destructive Elemental Analysis of Photographic Paper and Emulsions by X-rtry Fluorescence Spectroscopy) is Director of the Center of Creative,History of Photography,Photography in Florida,rtry
10.3133/wsp1160,r? 1? 1 Q 77.20_^ 77.21 ryrt QQ P*17 Xf\ rjrj >if\ 77.33 77.35 1717 ze rtry xe rrry *r c 77.35 77.40 77.40 77.39 11 A.9 1717 A 1*  77.46 77.47,Water Supply Paper,"Water levels and artesian pressure in observation wells in the United States, 1949, Part 5, Northwestern States",rtry
10.1111/j.1439-0507.1996.tb00159.x,"Hormones and Hair Growth. In: Goldsmith, L. A. (ed.)  Physiologv,Hiorhenii,rtry, and klolecular Biology qf the Skin, Vol. I,  2nd edn. New York:",Mycoses,Human androgenic steroids affect growth of dermatophytes in vitro,rtry
10.1111/j.1399-3011.1991.tb01422.x,"Gruyter, Berlin 21. Riniker, B. & Hartmann. A. (1989) in Peptides, Chenii,rtry, Slrtrcfure und Biology: Proceeditig.7 o f the Ilrh American  Pepride",International Journal of Peptide and Protein Research,Cleavage kinetics and anchor linked intermediates in solid phase peptide amide synthesis,rtry
10.1002/jctb.5000513113,"151, 14.5. * Since tliu tiiiiu o f writing, ilie rcniiltR o f iiii S-rtry iiiwntigir- tion of two forinti (if iiitl.iJCt.lliiIos(!-riC'UtoiiL'",Journal of the Society of Chemical Industry,Transactions and communications,rtry
10.1300/J042v13n03_04,"over 0.50. These tactors were labelled as: firm efficieiicy aiid itidii rtry cmipetiliorr, nirriiagericzl arid tecliriicnl ktrow-how, trniisnciiorr-spe- cijlic",Journal of Global Marketing,Strategic Motives and Partner Selection Criteria in International Joint Ventures in Turkey,rtry
10.1080/00304940009356742,"Boston, MA 02/25, USA Associate Editor Prof. M. 1.Heam Department of Chemi,rtry Welleslev College Wellesley, MA 02481. USA  Associate Editor Prof.",Organic Preparations and Procedures International,Editorial Board Page,rtry
10.1002/jctb.5000300101,"11 fc\v Iioiir~,  uf rntliiiiit C!, tliure is still nn eniision of y-rtrys, 111wu milst  ll~rorc~sIIL' ~ H Uto nicsnthorium. The r~~1ntioiishipof",Journal of the Society of Chemical Industry,The Society of Chemical Industry,rtry
10.1080/00665983.1977.11078441,"(London, !823).  9 W. J. Sollas, 'Paviland Cave: an Aurignacian station in Wales',]. Rtry. Anthrop. lnst., 43 (1913), 1-50. 10 The early Upper Palaeolithic",Archaeological Journal,Palaeolithic/Mesolithic,rtry
10.1002/jctb.5000331207,"I~otliinuncnl nd A. 131irg~tnllcr. JIonirfrll. of n vnciiuiii tulic by ciitliotlc rtrys in tlic prcscncu of  Cllcln., 1913, 34, 665-704.  hydrogcu (this",Journal of the Society of Chemical Industry,Journal and patent literature,rtry
10.1002/jctb.5000592202,Pull ~)iirticularsiirc given in tlic itiiiiual rcport. Iii c i d i cou~rtry~ 1 0 cso~-opcratioii is bciiig inni~itr~incwdith thc Go\~criiniciitsn,Journal of the Society of Chemical Industry,Biochemistry of brain tissue,rtry
10.1016/0001-6160(70)90093-3,"reletion v = MF extrapolating to the origin, indicative of intrinsic bound- rtry motion, is observed. When Ip < 2.3 x lO’dyn/cm, however, the mscroscopic",Acta Metallurgica,Tilt boundary migration in NaCl bicrystals,rtry
10.1139/v92-101,an ethanol solution were used for X-ray crystallographic analysis. X-rtry crys~crllographiccrrlcrlyses Crystallographic data for Hcmp and,Canadian Journal of Chemistry,Physical and structural studies of N -carboxymethyl- and N -( p -methoxyphenyl)-3-hydroxy-2-methyl-4-pyridinone,rtry
10.1002/jctb.5000424317,iiiiiv:ilibnt nnioiis. Tlio uxistcncu of tlic red s:iIts  lti;ttt!/.rtl rtry iti ~*e.sli!~citioroifs sgstci/is rctptrbls o j ~ l / l / l l l,Journal of the Society of Chemical Industry,Abstracts,rtry
10.1080/00359197509519440,"southern African lakes, Part IV: The benthos of Logoa Poe1e1a. Trans. rtry. Soc. S. Afr. 41 (3): 273-281. Cholnoky, B. J. 1968. Die diatomeenassoziationem",Transactions of the Royal Society of South Africa,THE ORIGIN OF SOUTHERN AFRICAN COASTAL LAKES,rtry
10.1080/10937404.2017.1408552,"genotoxicity (Table 2). Two tryptophan-requiring strains of E. coli, B/rtry WP2 and WP2 try hcr, and four histidineand biotin-requiring strains","Journal of Toxicology and Environmental Health, Part B",Risk assessment of benzalkonium chloride in cosmetic products,rtry
10.1111/j.0954-6820.1981.tb09847.x,"subjects undergoing catheterization of the renal artery for arteriography. X-rtry .studies A chest roentgenogram was taken for each patient, and",Acta Medica Scandinavica,Secondary Hypertension in a Medical Ward,rtry
10.1002/jctb.5000301501,"tlie actinium cninnntiou eonsists of two products, cnch of which emits a rtrys. The first hnsn period of 1seconds nntl emits a rnys of n rnnge",Journal of the Society of Chemical Industry,New York section,rtry
10.3109/08039489309104113,parents’ concept of the family and family adjustment. Am J 0rthopsychi;rtry 1964;34:45-55. 18. van der Veen F. The parents’ concept of the,Nordic Journal of Psychiatry,Assessment of families,rtry
10.1029/91WR03083,"decreasesasthesizeof  thenpaddedarraylengthosfatleastNp = 512areneeded. theaveraginvgolumiencreaseFso. rtry,= 4, atthefi• We next turn our attention to the secondquestion:how",Water Resources Research,Determination of the effective hydraulic conductivity for heterogeneous porous media using a numerical spectral approach: 2. Results,rtry
10.3109/10253899809167292,"dcprc\sivc illness iis iiiciisuiwcl hy coiiiputctl tomography. Hiol /'\\c/ii(rtry JI : I 140-1 142. Touitou Y.. Sulon J.. Hugdaii A,. Reiiibcrg A",Stress,"Effects of Major Depression, Aging and Gender upon Calculated Diurnal Free Plasma Cortisol Concentrations: a Re-Evaluation Study",rtry
10.1002/iroh.19750600202,the ot Iicr three forins of nitrogen.  (c) Strcttijied F h w to Cook Rtry I’ntler IYirtte/ Ire Corer Chentical stratification under winter,Internationale Revue der gesamten Hydrobiologie und Hydrographie,Nutrient loading to cook bay of lake Simcoe from the Holland river watershed,rtry
10.1080/00324728.1957.10413223,"(H The Growth of Population and the Factors which control it "", Jour, Rtry, Statist, SO{"" vol. lxxxviii.)   264  D. E. C. EVERSLEY  Whether",Population Studies,A survey of population in an area of Worcestershire from 1660-1850 on the basis of parish records,rtry
10.1002/jctb.5000331904,"1010, 04!L-'l'.  F. 1%.  illtC'iibi~Yis obtninctl. Thu ultrit-violet rtrys, Iirotlucc!cl  IJY tliu aparkn, iiioy be i i ~ fdor. aterilieing",Journal of the Society of Chemical Industry,Journal and patent literature,rtry
10.1111/j.1471-4159.1993.tb03231.x,"Joumul o/ Nrwrothtwzi rtry Raven Press, Ltd New York M I993 International Society for Neurochemistry Characterization",Journal of Neurochemistry,Characterization of a Human NK 1 Tachykinin Receptor in the Astrocytoma Cell Line U 373 MG,rtry
10.1046/j.1471-4159.1995.64041734.x,"lnurnal of Neurnchemi .rtry Raven Press, 1_td ., New York C) 1995 International Soci°ty tor",Journal of Neurochemistry,Lactate Metabolism and Its Effects on Glucose Metabolism in an Excised Neural Tissue,rtry
10.1002/jctb.5000281904,"otlior nt tho dcvicc scnsitivo to Iicnt, tlic lnttcr IJcing protcctcd from rtrys proccctling tlirougli tho npcrt,iiro dircctly from tho hot body.",Journal of the Society of Chemical Industry,Journal and patent literature,rtry
10.1139/b78-366,"rufuluml  JOSEL. BEZERRAA' N D JAMESW. K I M B R O U G H Deptrrttrrc,trt.\ ofBot(rtry(rrrd P / ( I IPI(~it/roI(>g.v,Urlil.er.\ity oj'F1orid0, C o i t",Canadian Journal of Botany,A new species of Tremella parasitic on Rhytidhysterium rufulum,rtry
10.1016/S0277-3791(00)00081-0,"concentrations, and hence, in  DibnetsweGde(tei)mn, ieDsMnotcah(rtry)oandnsodsceDanrabt(etes.)cpAornlotshbtroauubcgltyhedrce.hsMualntogfsretosdmiin!ceuhrpaentnagckeeess  rates",Quaternary Science Reviews,ESR isochron exercises: how accurately do modern dose rate measurements reflect paleodose rates?,rtry
10.1080/00223980.1961.9916524,Prsm. --4 R t r y . Prsm. 0 Art*  'i.St. Prsm.  I rs 8 2c .ga - =1 0 0-  --Rtry. Plrd.  .y): 0  Art. Pup.  0  FIGURE 1 SCHEMATICREPRESENTATOIFOTNHE,The Journal of Psychology,Measurements of Simultaneous Brightness Contrast Across the Retina,rtry
10.1080/21548331.1984.11702805,"characteristics-i.e., the functional effects of a stenosis. Accuracy ofx-rtry prediction, compared to direct measurement by implanted catheter",Hospital Practice,Cardiovascular Imaging: Coronary Artery Stenosis,rtry
10.1016/0022-2836(92)90576-6,"2.57.  (iuinier, .A. & Fournrr. C. (1955). Small Angle %YrttWing of  LY-rtrys. CVilev. h-ew York.  Hartt. .J. & Mrntlelson. R. (1980). X-ray",Journal of Molecular Biology,X-ray diffraction studies on oriented gels of vertebrate smooth muscle thin filaments,rtry
10.1111/j.1749-6632.1963.tb17679.x,20 21  5000  0  /noAVERACE INICllVATOR VmflsLUcEu :TRhSYLOL) “Nl1.S  rTRY PSlN  21 lWP5lNOCEN U   372 Annals New York Academy of Sciences Edema,Annals of the New York Academy of Sciences,THERAPY WITH KALLIKREIN AND PROTEASE INHIBITORS,rtry
10.1111/j.1600-0773.1993.tb00301.x,"methylation affect polyamine biosynthesis in mouse brain. In: Eiochemi,rtry of S-adenosylmethionine and related compounds. Eds. E. Usdin, R.",Pharmacology & Toxicology,Enhanced Endogenous Ornithine Concentrations Protect Against Tonic Seizures and Coma in Acute Ammonia Intoxication,rtry
10.1300/J097v04n03_04,"the long rrr~z,arisi~rgfrom FDI, ca~zbe achieved w1le11the srrm of corr~rtry's rmcertai~ztiesis mi~rimald ~ ~ r i nthge expected exploitation",Journal of East-West Business,Megamarketing,rtry
10.1111/j.2150-1092.2005.tb00934.x,"under the current Early Decision scheme.-Chair, Deparrnrent ofCCherni,rtry, Jutiiata (‘allege. 0836-40/GMT  SELECTION CRITERIA Garrison-Wade,",Higher Education Abstracts,ADMISSIONS,rtry
10.1002/jctb.5000321206,"Vcitch  rrntl -1. S.Rogcm. U.8. Dcpt. Agric., Burcnu of Chom.,  m i . NO. 106, i\rtry O, 1913. 20 lltlgcs.  Ax,iixsk:s of well.tnnnct1 ticourcd lcnthcm",Journal of the Society of Chemical Industry,Journal and patent literature,rtry
10.1111/j.1432-1033.1988.tb14411.x,"A., Wright, S. T., Martin, M. U. & Kaniinsky, L. S. (1982) Biocherni,rtry 21, 6019 -6030. 27. le Provost, E., Cresteil, T., Columelli, S.",European Journal of Biochemistry,Inhibitors of liver lysosomal acid phospholipase A1,rtry
10.1111/j.1365-2265.1985.tb01104.x,"ofglucose by measurement of rate of oxygen comsumption. Clinicul Cliet?ii,rtry,14, 116-131. KCZWAH. .. BLIx. P.M.. HORWITZD. .L., STEINERD. .",Clinical Endocrinology,FAILURE TO SUPPRESS C-PEPTIDE SECRETION BY EUGLYCAEMIC HYPERINSULINAEMIA: A NEW DIAGNOSTIC TEST FOR INSULINOMA?,rtry
10.1016/0006-291X(62)90058-X,synthesis  of all these enzymes is not repressed  by trypto-  phan. This mutant (Rtry) is interpreted  as the result of the mutation  in the  regulator  gene.,Biochemical and Biophysical Research Communications,"The regulatory mechanism of enzyme synthesis in the tryptophan biosynthetic pathway of Escherichia,coli K-12",rtry
10.1016/0092-8674(89)90242-0,"FR------  IYGGTPTRHGLFPHWAA  vR2 TNTNPDCE""DVRGMXDCIPFHL~""P""ER~IP~P~~~P -NIN""""-EG--NQQF--------ISASKSI""HPSY--RTRY--E---RK""&K------ISMLDIIYIHPRY-WRPQLN-ETSATQQD--------IRILIT""L""PXY--  NWKENLDR'~IALLKLKRPIELSDYIHPVCLPDKQTAA",Cell,"The role of easter, an apparent serine protease, in organizing the dorsal-ventral pattern of the Drosophila embryo",rtry
10.1080/02255189.1981.9669983,"counlries  Toral producers  Jupon  Second-  Toral  U . S . A . Europe Primary  rtry Consumsrs  + +PP 223.2 +2,629.1 265.7 +4,485.6 +4.425.2 - 7.871.3",Canadian Journal of Development Studies / Revue canadienne d'études du développement,Stabilizing the International Copper Market: The Viability and Impacts of Alternate Market Management Arrangements,rtry
10.3109/00016356309019777,111. Direct w c ( r ~ i i e ( i s i i r e n i e n fcs.orreltrted with X-rtry nieccsirrements.  Type of tooth  empirical regression line  standard,Acta Odontologica Scandinavica,Root Surface Measurement and A Method for X-Ray Determination of Root Surface Area,rtry
