10.1111/gcbb.12420,"Plants (NRCS 2014), USDA Quick Stats (quickstats.nass.usda.gov), and TRY databases (Kattge et al., 2011). These databases,",GCB Bioenergy,"BETYdb: a yield, trait, and ecosystem service database applied to second-generation bioenergy feedstock production",TRY Database
10.1057/s41303-017-0053-2,of the concept in this category.  Category: overcome  Concept  Rel.%  Trying Database Volunteer Organization Management,European Journal of Information Systems,The role of context in IT assimilation: A multi-method study of a SaaS platform in the US nonprofit sector,TRY Database
10.1890/09-1509.1,data are available upon request directly to the author or through the TRY database (available online).6 Estimates of nutrient,Ecology,Leaf habit and woodiness regulate different leaf economy traits at a given nutrient supply,TRY Database
10.1007/s10113-022-01929-9,fruiting and flowering season. Fruiting types were mostly derived from the TRY database (Kattge et al. 2020). We used Rao’s,Regional Environmental Change,Is the vegetation archetype of the Garden of Eden located in the Irano-Turanian region and safe against climate change?,TRY Database
10.1111/nph.14289,"trait data that overlaps with 222 species present in Fig. 2 from the TRY database (Kattge et al., 2011; Adler et al.,",New Phytologist,Applications of the fast-slow continuum and reproductive strategy framework of plant life histories,TRY Database
10.1111/gcb.14046,"inputs (Allan et al., 2015). We obtained species SLA values from the TRY database (Kattge et al., 2011), which contains",Global Change Biology,High land-use intensity exacerbates shifts in grassland vegetation composition after severe experimental drought,TRY Database
10.1002/ecs2.2633,"2012), the Botanical Information and Ecology Network (BIEN 4.0), and TRY database (White et al. 2000, Wright et al. 2004,",Ecosphere,Impact of land composition and configuration on the functional trait assembly of forest communities in southern Ontario,TRY Database
10.1016/j.tree.2014.11.001,"biomes, or oversampling of forestry species with economic importance in the TRY database [3], which might have resulted in the",Trends in Ecology & Evolution,The mystery of missing trubs revisited: a response to McGlone et al. and Qian and Ricklefs,TRY Database
10.1016/j.biocon.2016.07.014,"interoperability of existing datasets. Species traits data are available from the TRY database (https://www.try-db.org/), and data",Biological Conservation,Global biodiversity monitoring: From data sources to Essential Biodiversity Variables,TRY Database
10.1890/12-0328.1,"al. 2008), and Biolﬂor (Klotz et al. 2002). The data extracted from the TRY database include several different sources listed",Ecology,Predicting invertebrate herbivory from plant traits: evidence from 51 grassland species in experimental monocultures,TRY Database
10.1111/1365-2435.12883,atmospheric N2) were established based on the information provided in the TRY database (https://www.try-db.org/ TryWeb/Home.php).,Functional Ecology,Sampling roots to capture plant and soil functions,TRY Database
10.1016/j.landurbplan.2021.104220,"not available for all rare species, I used trait data from the LEDA and TRY databases (Kattge et al., 2020; Kleyer et al.,",Landscape and Urban Planning,Enhancing landscape planning: Vegetation-mediated ecosystem services predicted by plant traits,TRY Database
10.1111/j.1365-2486.2011.02451.x,"biodiversity (McMahon et al., 2011). For several traits the data coverage in the TRY database is sufﬁcient to quantify the relative",Global Change Biology,TRY - a global database of plant traits,TRY Database
10.1111/nph.13096,similar magnitude for some traits (c. 68% for NA and 115% for AA) to the TRY database at the time of its publication (Kattge,New Phytologist,"A worldwide analysis of within-canopy variations in leaf structural, chemical and physiological traits across plant functional types",TRY Database
10.1111/j.1461-0248.2010.01582.x,"considered separately, where available. The data set is available in TRY database according to the intellectual property",Ecology Letters,Global patterns of leaf mechanical properties,TRY Database
10.1111/nph.14944,species (Ruppia maritima) has root depth records within the Plant Trait (TRY) database (https://www.trydb.org/TryWeb/Home.php). Soil,New Phytologist,Niche partitioning of intertidal seagrasses: evidence of the influence of substrate temperature,TRY Database
10.1111/nph.15592,ecosystems above 40°N. Observations represent a combination of data from the TRY database (https://www.try-db.org/; 22 066 observations),New Phytologist,Plant traits inform predictions of tundra responses to global change,TRY Database
10.1111/1365-2435.13135,"other level of organization”—Violle et al., 2007) was compiled from the TRY database (www.try-db.org) and the standardized",Functional Ecology,Trait selection and community weighting are key to understanding ecosystem responses to changing precipitation regimes,TRY Database
10.1016/j.jenvman.2018.08.060,"Database (Zanne et al., 2009). Speciﬁc leaf area was retrieved from the TRY database (Kattge et al., 2011). Mean values",Journal of Environmental Management,"Topsoil application during the rehabilitation of a manganese tailing dam increases plant taxonomic, phylogenetic and functional diversity",TRY Database
10.1016/j.jenvman.2021.113054,"Kleunen et al., 2010)]. Curating data from the aggregated global data sets (TRY Database, trait-specific databases, and the",Journal of Environmental Management,Different factors influence naturalization and invasion processes – A case study of Indian alien flora provides management insights,TRY Database
10.1016/j.agrformet.2024.109992,"dominant species at 11 sampling sites (Table 1) from literature and the TRY database (www.try-db.org) (Kattge et al., 2020),",Agricultural and Forest Meteorology,"Precipitation change, functional traits and stand structure jointly control the spatiotemporal variability of radial growth in alpine treeline ecotones across northern China",TRY Database
10.1111/j.1365-2745.2009.01615.x,"characteristics. All leaf, stem and root trait data is available through the try database: http://www.try-db.org. Table S2. Contributions",Journal of Ecology,Evidence of the ‘plant economics spectrum’ in a subarctic flora,TRY Database
10.1111/geb.12623,"LNC (in milligrams per gram) and LPC (in milligrams per gram) from the TRY database (Kattge et al., 2011), complemented",Global Ecology and Biogeography,Plant community structure and nitrogen inputs modulate the climate signal on leaf traits,TRY Database
10.1002/ece3.2281,"included as online supporting information. Data are to be available via the TRY database. References Ackerly, D. 2004. Functional",Ecology and Evolution,Examining variation in the leaf mass per area of dominant species across two contrasting tropical gradients in light of community assembly,TRY Database
10.1111/icad.12211,open access by 2018 with similar Intellectual Property Guidelines to the TRY database (https://www.try-db.org/TryWeb/TRY_Intellectual_Prope,Insect Conservation and Diversity,GlobalAnts : a new database on the geography of ant traits (Hymenoptera: Formicidae),TRY Database
10.1111/jvs.12710,"traits, we expanded this backbone to integrate plant names used in the TRY database (Kattge et al., 2011). The taxon names",Journal of Vegetation Science,sP lot – a new tool for global vegetation analyses,TRY Database
10.1016/j.ecolind.2023.109869,"final rating (Fig. S1). These functional traits were obtained from the TRY Database, Kew Seed Information Database, and",Ecological Indicators,"How urban riparian corridors affect the diversity of spontaneous herbaceous plants as pollination and dispersal routes - a case of the Wenyu River- North Canal in Beijing, China",TRY Database
10.1111/nph.14889,in the database obtained from compilation of available data and in the TRY database were strongly correlated (Pearson’s,New Phytologist,Nutrient-rich plants emit a less intense blend of volatile isoprenoids,TRY Database
10.1016/j.eja.2015.08.002,"to the range of trait values measured in wild species worldwide in the TRY database (Kattge et al., 2011), the range of",European Journal of Agronomy,Trait-based characterisation of cover plants’ light competition strategies for weed control in banana cropping systems in the French West Indies,TRY Database
10.1016/j.ecoinf.2012.01.005,"“functional” monitoring data. For instance, the recently presented global TRY database of “plant traits” (Kattge et al., 2011)",Ecological Informatics,Analyzing floristic inventories with multiple maps,TRY Database
10.1016/j.agrformet.2017.11.020,"these data, paired measurements of Jmax and leaf-N are taken from the TRY database (Kattge et al., 2009; n = 536). Although",Agricultural and Forest Meteorology,Decadal trends in photosynthetic capacity and leaf area index inferred from satellite remote sensing for global vegetation types,TRY Database
10.1016/j.ppees.2017.04.002,"are often absent from major trait databases. For example, the Canadian TRY database (Kattge et al., 2011) has a species","Perspectives in Plant Ecology, Evolution and Systematics",The status of non-vascular plants in trait-based ecosystem function studies,TRY Database
10.1111/jvs.12554,"seed mass (SM, mg) were previously published values obtained from the TRY database (Kattge et al. 2011), www.try-db.org,",Journal of Vegetation Science,Predicting habitat affinities of plant species using commonly measured functional traits,TRY Database
10.1111/ecog.00580,establishment and expansion of large vegetation databases. One example is the TRY database that includes information on life history,Ecography,Using dynamic vegetation models to simulate plant range shifts,TRY Database
10.1890/14-0589.1,tree or liana species after assigning habit to each species from the TRY database (Kattge et al. 2011). We then retained,Ecology,Linking environmental filtering and disequilibrium to biogeography with a community climate framework,TRY Database
10.1111/ele.12063,"of existing regional or more trait-speciﬁc, specialty databases, the TRY database seeks to collect trait data for a broad",Ecology Letters,The biogeography of marine plankton traits,TRY Database
10.1111/1365-2745.13163,"ecosystem function and services, leaf nitrogen, leaf phosphorous, MODIS, TRY database  1 | INTRODUCTION The composition of",Journal of Ecology,The relationship of woody plant size and leaf nutrient content to large-scale productivity for forests across the Americas,TRY Database
10.1111/nph.14687,2013). The increasing availability of large leaf trait databases (e.g. TRY database; www.try-db.org) and efforts to discover,New Phytologist,The bias of a two-dimensional view: comparing two-dimensional and three-dimensional mesophyll surface area estimates using noninvasive imaging,TRY Database
10.1111/gcb.14096,"depth and vulnerability to cavitation or w50—were extracted from the TRY database   T A B L E 1 Location, species and",Global Change Biology,Drought timing and local climate determine the sensitivity of eastern temperate forests to drought,TRY Database
10.1111/jbi.13809,"distributions were compared against observed plant trait data from the TRY database (Kattge et al., 2011), see Data S1",Journal of Biogeography,Simulating functional diversity of European natural forests along climatic gradients,TRY Database
10.1016/j.soilbio.2015.06.006,more limited species-based approaches. The most prominent example is the TRY database which facilitated new impulses for,Soil Biology and Biochemistry,Understanding mechanisms of soil biota involvement in soil aggregation: A way forward with saprobic fungi?,TRY Database
10.1111/1365-2745.13018,"informa‐ tion for maximum plant height and specific leaf area (SLA) from the TRY database (Kattge et al., 2011). We used a subset",Journal of Ecology,Intransitivity increases plant functional diversity by limiting dominance in drylands worldwide,TRY Database
10.1002/ecm.1410,95 species gathered for the present study (data are available from the TRY database online).2 When the same species was,Ecological Monographs,Xylem vessel‐diameter–shoot‐length scaling: ecological significance of porosity types and other traits,TRY Database
10.1016/j.biocon.2022.109815,for 19 species) and seed dry mass (available for 6 species) from the TRY database at www.try-db.org/TryWeb/Data.php (Appendix,Biological Conservation,"Past and present effects of habitat amount and fragmentation per se on plant species richness, composition and traits in a deforestation hotspot",TRY Database
10.1111/nph.14003,"(Lucash et al., 2007). To illustrate this difference: the plant trait TRY database includes almost 10,000 observations",New Phytologist,Towards a multidimensional root trait framework: a tree root review,TRY Database
10.1111/nph.13623,"related to different functional roles in plants. The main source was the TRY database (Kattge et al., 2011) (accession date",New Phytologist,Variation in trait trade-offs allows differentiation among predefined plant functional types: implications for predictive ecology,TRY Database
10.1890/15-1852.1,"seed ecology, we did not query databases with unpublished data, such as TRY database (Kattge et al. 2011). We did not focus",Ecological Applications,Assessing bias and knowledge gaps on seed ecology research: implications for conservation agenda and policy,TRY Database
10.1002/2013GB004665,"litter generated by CLM4cn is of lower quality than observations from the TRY database [Brovkin et al., 2012]. Thus, to produce",Global Biogeochemical Cycles,Evaluating soil biogeochemistry parameterizations in Earth system models with observations,TRY Database
10.1016/j.tree.2011.02.012,"crucial, and the availability of measurements of these traits in the TRY database. (This is not a comprehensive list",Trends in Ecology & Evolution,Improving assessment and modelling of climate change impacts on global terrestrial biodiversity,TRY Database
10.1002/ece3.5388,"height, seed dispersal—data for this trait are also obtained from the TRY database (Kattge et al., 2011), seed numbers,",Ecology and Evolution,Plant community responses to environmentally friendly piste management in northeast Iran,TRY Database
10.1002/2018JG004502,"favorably with many ecological databases outside of EC. For example, the TRY database (Kattge et al., 2011) documentation",Journal of Geophysical Research: Biogeosciences,Data Sharing and Scientific Impact in Eddy Covariance Research,TRY Database
10.1111/nph.14522,"have a role in ecosystem models as they are encoded today. Although the TRY database of plant traits (Kattge et al., 2011)",New Phytologist,Introduction to a Virtual Issue on root traits,TRY Database
10.1111/nph.14740,"calculated photosynthetic parameters and biochemical trait data to the TRY database (Kattge et al., 2011) and the database",New Phytologist,Terrestrial biosphere models underestimate photosynthetic capacity and CO 2 assimilation in the Arctic,TRY Database
10.1111/geb.12557,"to this literature search, a number of values were obtained from the TRY database (Kattge et al., 2011), especially SLA.",Global Ecology and Biogeography,A new approach to optimal discretization of plant functional types in a process-based ecosystem model with forest management: a case study for temperate conifers,TRY Database
10.1002/ece3.2703,"plant species from 20 water bodies of North Italy were extracted from the TRY database (Kattge et al., 2011). Additional data",Ecology and Evolution,Growth-form and spatiality driving the functional difference of native and alien aquatic plants in Europe,TRY Database
10.1111/ddi.12815,in the supplementary material. Plant traits can be retrieved from the TRY database (https://www.try-db.org/).  ORCID David,Diversity and Distributions,Plant niche breadths along environmental gradients and their relationship to plant functional traits,TRY Database
10.1111/avsc.12408,"green). Species regeneration traits taken from BROT (Paula et al., 2009), TRY databases (Kattge et al., 2011) and Naveh (1975)",Applied Vegetation Science,Fire season modifies the perennial plant community composition through a differential effect on obligate seeders in eastern Mediterranean woodlands,TRY Database
10.1002/eap.1812,"leaf area, seed mass, and leaf nitrogen content) came primarily from the TRY database (Kattge et al. 2011), supplemented",Ecological Applications,"Testing the effects of four urbanization filters on forest plant taxonomic, functional, and phylogenetic diversity",TRY Database
10.1111/1365-2745.12091,"follows from the ranking of these traits by standard deviation in the TRY database: CH (0.78), SLA (0.26) and LDMC (0.17)",Journal of Ecology,Do plant traits retrieved from a database accurately predict on-site measurements?,TRY Database
10.1111/nph.15536,"Data on vessel diameter and maximum plant height were obtained from the TRY Database (Kattge et al., 2011) and from the",New Phytologist,"Vestured pits and scalariform perforation plate morphology modify the relationships between angiosperm vessel diameter, climate and maximum plant height",TRY Database
10.1111/jvs.12066,species (11–39 species) measured in the ﬁeld and those extracted from the TRY database (Kattge et al. 2011a). Even if the,Journal of Vegetation Science,Are trait-based species rankings consistent across data sets and spatial scales?,TRY Database
10.1111/avsc.12330,"based on Kew’s Seed Information Database (2015), Baskin (2014) and the TRY database (Green 2009; Kattge et al. 2011) in",Applied Vegetation Science,Quantifying establishment limitations during the ecological restoration of species-rich Nardus grassland,TRY Database
10.1080/15435075.2019.1653879,"solar or light radiation.  Weather data based on the test reference year (TRY) databases of representative cities, state capital",International Journal of Green Energy,Energy performance of PV integrated office buildings with fan-assisted double skin façades under tropical climates,TRY Database
10.1111/2041-210X.13092,"climates, and land-­ use types (Burkhardt et al., 2014) that resemble the TRY database for plants (Kattge et al., 2011). However,",Methods in Ecology and Evolution,"Using plant, microbe, and soil fauna traits to improve the predictive power of biogeochemical models",TRY Database
10.1111/geb.12783,"tundra plant traits by combining 18,613 plant trait records from the TRY database (Kattge et al., 2011; Appendix B) with",Global Ecology and Biogeography,Traditional plant functional groups explain variation in economic but not size‐related traits across the tundra biome,TRY Database
10.1016/j.ecoser.2017.06.008,"obtained from our own measurements and integrated with data from the TRY database (e.g. from Everwand et al., 2014; Kerkhoff",Ecosystem Services,Future impacts of changing land-use and climate on ecosystem services of mountain grassland and their resilience,TRY Database
10.1111/jvs.12325,impede answering certain ecological questions. Using a subsample of the TRY database restricted to herbaceous plants and,Journal of Vegetation Science,Trait databases: misuses and precautions,TRY Database
10.1111/nph.12902,"relationship with root form and function, in a global database (e.g. the TRY database, http://www.try-db.org/ TryWeb/Home.php),",New Phytologist,Using root form to improve our understanding of root function,TRY Database
10.1111/1365-2745.12735,"2012a); and  (ii) data for SLA and maximum plant height, retrieved from the TRY database (Kattge et al. 2011). The 124 sites",Journal of Ecology,Testing the environmental filtering concept in global drylands,TRY Database
10.1111/ddi.13113,versus short-lived (during summer or over-wintering)  Personal observation TRY database 1 – 6 TRY database,Diversity and Distributions,Native distribution characteristics rather than functional traits explain preadaptation of invasive species to high‐UV‐B environments,TRY Database
10.1016/j.agrformet.2019.03.012,"Vilà-Cabrera et al., 2015), we retrieved wood density of each species from the TRY database (Kattge et al., 2011). Wood densities",Agricultural and Forest Meteorology,A synthesis of bias and uncertainty in sap flow methods,TRY Database
10.1016/j.ecoinf.2013.12.003,"relationship between beetles, dead-wood amount, and temperature. The TRY database (Kattge et al., 2011b) as another example,",Ecological Informatics,A conceptual model for data management in the field of ecology,TRY Database
10.1016/j.tree.2011.07.007,"introduced. Indeed, even in the most comprehensive databases (e.g. the TRY database of plant traits [7]), there is a large",Trends in Ecology & Evolution,"Fame, glory and neglect in meta-analyses",TRY Database
10.1002/ece3.3609,"1999).  All traits related to vegetative growth were obtained from the TRY database (Kattge et al., 2011). Missing entries",Ecology and Evolution,Nutrient stoichiometry and land use rather than species richness determine plant functional diversity,TRY Database
10.1111/geb.12662,"containing dispersal data (Vittoz & Engler, 2007; Willson, 1993) and the TRY database (Kattge et al., 2011) to identify species",Global Ecology and Biogeography,Trait correlations equalize spread velocity across plant life histories,TRY Database
10.1111/nph.14486,"(Supporting Information Notes S1), and the widely used global plant trait ‘TRY’ database (www.try-db.org) reports that < 1%",New Phytologist,A global Fine-Root Ecology Database to address below-ground challenges in plant ecology,TRY Database
10.1111/gcb.12870,"values, we used all observations of broad-leaved trees recorded in the TRY database to conserve the intraspeciﬁc variability",Global Change Biology,Leaf and stem economics spectra drive diversity of functional plant traits in a dynamic global vegetation model,TRY Database
10.1111/j.1461-0248.2012.01844.x,"growth rate (RGR) and leaf N content (leaf N) were obtained from the TRY database (Kattge et al. 2011), which contains",Ecology Letters,Abiotic drivers and plant traits explain landscape-scale patterns in soil microbial communities,TRY Database
10.1111/jvs.12525,et al. 2011; Atzberger et al. 2015) and available trait data from the TRY database (Kattge et al. 2011; compare Appendix,Journal of Vegetation Science,Linking plant strategies and plant traits derived by radiative transfer modelling,TRY Database
10.1111/oik.02090,"between members of each species-pair. Trait values  were obtained from the TRY database (Kattge et al. 2011,  see also Supplementary",Oikos,Contrasting effects of tree diversity on young tree growth and resistance to insect herbivores across three biodiversity experiments,TRY Database
10.1111/jvs.12659,measured wood density on 20 shrub species that did not have entries in the TRY database. A 4-­to 6-­cm section of stem was,Journal of Vegetation Science,Invasive plants in Minnesota are “joining the locals”: A trait-based analysis,TRY Database
10.1016/j.biocon.2022.109531,"Gardarin et al., 2014; Tasset et al., 2018). Trait data were extracted from TRY database (Kattge et al., 2020) (data release",Biological Conservation,Agri-environmental payments drive the conservation and forage value of semi-natural grasslands by modifying fine-scale grazing intensity,TRY Database
10.1111/jbi.13171,"habit, macroecology, plant functional traits, plant functional types, TRY database  1 | INTRODUCTION The geography of",Journal of Biogeography,Spatial patterns and climate relationships of major plant traits in the New World differ between woody and herbaceous species,TRY Database
10.1016/j.enbuild.2022.112770,"building performance simulation in Brazil [30]: the Test Reference Year (TRY) database [31], the National Institute of Meteorology",Energy and Buildings,A thermal performance standard for residential buildings in warm climates: lessons learned in Brazil,TRY Database
10.1016/j.baae.2022.03.003,in the LTSER site “Zone Atelier Armorique” and plant traits from the TRY database (http://www.try-db.org). The TRY,Basic and Applied Ecology,Increasing habitat connectivity in agricultural landscapes as a weed management strategy reconciling ecology and agronomy,TRY Database
10.1002/ece3.932,median and 97.5 and 2.5% quantiles for the same trait derived from the TRY database (Kattge et al. 2011). Note that only,Ecology and Evolution,Predicting leaf traits of herbaceous species from their spectral characteristics,TRY Database
10.1111/nph.15881,could reach tall heights. We obtained maximum plant height data from the TRY database and observed no significant relationship,New Phytologist,Assessing the potential functions of nocturnal stomatal conductance in C 3 and C 4 plants,TRY Database
10.1111/nph.14247,"thousands) for different categories of plant traits available in the TRY database (Kattge et al., 2011). Information",New Phytologist,Below-ground frontiers in trait-based plant ecology,TRY Database
10.1139/er-2015-0072,"widely available (87% of North American tree species available in the TRY database; Table 1), rooting depth remains difﬁcult",Environmental Reviews,"Traits to stay, traits to move: a review of functional traits to assess sensitivity and adaptive capacity of temperate and boreal trees to climate change",TRY Database
10.1111/1365-2664.12976,"Bongers et al., 2013; Martínez-­Garza, Tobon, Campo, & Howe, 2013) and the TRY database (Kattge et al., 2011). Few species’",Journal of Applied Ecology,Planting accelerates restoration of tropical forest but assembly mechanisms appear insensitive to initial composition,TRY Database
