10.1002/ldr.3295,"https://doi.org/10.1002/ecy.1745 Kühn, I., Durka, W., & Klotz, S. (2004). BiolFlor—A new plant‐trait database as a tool",Land Degradation & Development,Recovery of species richness lags behind functional recovery in restored grasslands,Plant Trait Database
10.1111/jvs.12710,"means and variances of traits using gap-­filled data from the global plant trait database TRY. Moreover,",Journal of Vegetation Science,sP lot – a new tool for global vegetation analyses,Plant Trait Database
10.1016/j.flora.2022.152089,"Metabolic dimension can be obtained by online repositories (e.g., TRY Plant Trait Database, Kattge",Flora,Towards a “periodic table” of abiotic stress tolerance strategies of woody plants,Plant Trait Database
10.1016/j.flora.2022.152072,"10.1111/j.0022-0477.2005.00992.x. Falster, D., Gallagher, R., Wenk, E.H., et al., 2021. AusTraits, a curated plant trait database for the",Flora,Tropical wet and dry forest tree species exhibit contrasting hydraulic architecture,Plant Trait Database
10.1016/j.ecolmodel.2018.02.013,"http://dx.doi.org/10.1016/j.scitotenv.2016.05.144. Kühn, I., Durka, W., Klotz, S., 2004. BiolFlor – a new plant-trait database as a tool",Ecological Modelling,Modelling vegetation dynamics in managed grasslands: Responses to drivers depend on species richness,Plant Trait Database
10.1139/CJPS-2018-0120,"Diaz, S., Westoby, M., and Rice, B.L. 2016. Leaf mechanical resistance in plant trait databases: comparing",Canadian Journal of Plant Science,Mechanical properties of Polygonatum multiflorum Mill. leaves after treatment with growth stimulants,Plant Trait Database
10.1111/nph.14459,Some advances can be accomplished quickly thanks to improved coverage in plant trait databases and by,New Phytologist,Building a better foundation: improving root-trait measurements to understand and model plant and ecosystem processes,Plant Trait Database
10.1111/jvs.12459,"Gardens Seed Information Database, the C3/C4 database and the global plant trait database TRY, along",Journal of Vegetation Science,Vegetation science in the age of big data,Plant Trait Database
10.1002/ecy.2144,"V. Figueiredo, Janaina Casella, and Érica F. G. G. de Sá 500 The China Plant Trait Database: toward",Ecology,Issue Information,Plant Trait Database
10.1111/j.1472-4642.2009.00602.x,"10, 417–425. Ku¨hn, I., Durka, W. & Klotz, S. (2004b) BIOLFLOR – a new plant-trait database as a tool",Diversity and Distributions,The global invasion success of Central European plants is related to distribution characteristics in their native range and species traits,Plant Trait Database
10.1016/j.ppees.2009.11.001,"6, 749–764. Ku¨ hn, I., Durka, W., Klotz, S., 2004b. BiolFlor – a new plant-trait database as a tool","Perspectives in Plant Ecology, Evolution and Systematics",Changes in the functional composition of a Central European urban flora over three centuries,Plant Trait Database
10.1016/j.tree.2014.10.006,"range of communities, ecosystems and biomes. Databases such as the TRY Plant Trait Database [83] are",Trends in Ecology & Evolution,Going underground: root traits as drivers of ecosystem processes,Plant Trait Database
10.1111/gcb.13900,"archives such as DataOne (dataone.org), VegBank (vegbank.org), and the TRY plant trait database (try-db.org)",Global Change Biology,Multi-model comparison highlights consistency in predicted effect of warming on a semi-arid shrub,Plant Trait Database
10.1111/1365-2745.12851,"from the original publication (Aiba et al., 2016) or online from the TRY Plant Trait database (https://",Journal of Ecology,Environmental controls on the causes and functional consequences of tree species diversity,Plant Trait Database
10.1111/ecog.03480,"comprehensive functional trait databases compiled to date (i.e. the TRY Plant Trait Database, Kattge et al.",Ecography,Assessing among-lineage variability in phylogenetic imputation of functional trait datasets,Plant Trait Database
10.1111/ele.13210,"Dukes (2017a), Tarvainen et al. (2013), Togashi et al. (2018a,b), the TRY plant trait database (Kattge",Ecology Letters,Global photosynthetic capacity is optimized to the environment,Plant Trait Database
10.1016/j.agrformet.2019.107708,the lifespans for major conifer species in Canada are found in the TRY plant Trait database (http://www.try-db.org/TryWeb/Home.php),Agricultural and Forest Meteorology,Seasonality of leaf area index and photosynthetic capacity for better estimation of carbon and water fluxes in evergreen conifer forests,Plant Trait Database
10.1016/j.flora.2022.152165,"Netherlands, pp. 226–232. Kühn, I., Durka, W., Klotz, S., 2004. BiolFlor – a new plant-trait database as a tool",Flora,Pollinator distribution in patches of suitable habitat depends more on patch isolation than on floral abundance,Plant Trait Database
10.1111/j.1654-1103.2007.tb02559.x,"database is designed to enable linkages to existing soil, ﬂoristic or plant trait databases. The study",Journal of Vegetation Science,Long-term datasets: From descriptive to predictive data using ecoinformatics,Plant Trait Database
10.1016/j.geoderma.2023.116641,"Y., Bai, F., Togashi, H.F., Wang, M., Zhou, S., Ni, J., 2018. The China Plant Trait Database: toward",Geoderma,The inverse texture effect of soil on vegetation in temperate grasslands of China: Benchmarking soil texture effect,Plant Trait Database
10.1002/ecm.1410,http://onlinelibrary.wiley.com/doi/10.1002/ecm.1410/full DATA AVAILABILITY Data are available from the TRY Plant Trait Database at https://doi.org/10.17871/TRY.57,Ecological Monographs,Xylem vessel‐diameter–shoot‐length scaling: ecological significance of porosity types and other traits,Plant Trait Database
10.1111/pce.13665,"S., Lavorel S., Prentice I.C., Leadley P., . . . Wirth C. (2020). TRY plant trait database —enhanced","Plant, Cell & Environment",Day length regulates seasonal patterns of stomatal conductance in Quercus species,Plant Trait Database
10.1111/geb.13079,"species (Lutes & Keane, 2017). Maximum tree height was derived from the TRY plant trait database (Kattge",Global Ecology and Biogeography,Biogeography of fire regimes in western U.S. conifer forests: A trait‐based approach,Plant Trait Database
10.1111/j.1654-109X.2012.01198.x,"trait data were included in our database, The Willamette Valley Prairie Plant Trait Database, which",Applied Vegetation Science,Plant traits - a tool for restoration?,Plant Trait Database
10.1890/14-1525,meta-­analysis. Wetland plants also tend to be underrepresented in online plant trait databases (Wright,Ecological Applications,Effects of wetland plants on denitrification rates: a meta-analysis,Plant Trait Database
10.1111/1365-2435.12716,"13, 597–605. Ku€hn, I., Durka, W. & Klotz, S. (2004) BiolFlor – a new plant-trait database as a tool",Functional Ecology,Spatial scale and specialization affect how biogeography and functional traits predict long-term patterns of community turnover,Plant Trait Database
10.1111/j.1654-109X.2009.01058.x,indicator values Data on seed mass and seed longevity were obtained from two plant trait databases: BIOLFLOR,Applied Vegetation Science,Potential of endozoochorous seed dispersal by sheep in calcareous grasslands: correlations with seed traits,Plant Trait Database
10.1111/j.0269-8463.2004.00846.x,"ranking plant species in terms of palatability, and can be used to compile plant trait databases. However,",Functional Ecology,Plant palatability can be inferred from a single-date feeding trial,Plant Trait Database
10.1016/j.landurbplan.2016.06.005,support students or gardeners by focusing on the visual aspects. The TRY plant trait database (Boenisch,Landscape and Urban Planning,Citree: A database supporting tree selection for urban areas in temperate climate,Plant Trait Database
10.1111/geb.12557,this method needs a large number of data for model calibration. Although plant trait databases are building,Global Ecology and Biogeography,A new approach to optimal discretization of plant functional types in a process-based ecosystem model with forest management: a case study for temperate conifers,Plant Trait Database
10.1111/nph.13001,"the next generation vegetation and Earth system models. However, global plant trait databases have a",New Phytologist,Is there a species spectrum within the world-wide leaf economics spectrum? Major variations in leaf functional traits in the Mediterranean sclerophyll Quercus ilex,Plant Trait Database
10.1002/2014JG002709,observations of leaf nitrogen content per dry mass available from a global plant trait database [Kattge,Journal of Geophysical Research: Biogeosciences,Improving ecosystem productivity modeling through spatially explicit estimation of optimal light use efficiency,Plant Trait Database
10.1111/nph.16029,reflected in the very poor geographical coverage of tropical plants in plant trait databases (Kattge,New Phytologist,"Leaf reflectance spectroscopy captures variation in carboxylation capacity across species, canopy environment, and leaf age in lowland moist tropical forests",Plant Trait Database
10.1016/j.cosust.2018.04.001,"Nadrowski K, No¨ llert S, Sartor K, Wirth C: A generic structure for  plant trait databases [Internet].",Current Opinion in Environmental Sustainability,"Observations, indicators and scenarios of biodiversity and ecosystem services change — a framework to support policy and decision-making",Plant Trait Database
10.1016/j.ecoser.2022.101414,"Díaz, S., Lavorel, S., Prentice, I.C., Leadley, P., et al., 2020. TRY plant trait database – enhanced",Ecosystem Services,"Spatiotemporally explicit prediction of future ecosystem service provisioning in response to climate change, sea level rise, and adaptation strategies",Plant Trait Database
10.1111/boj.12362,"description ﬁeld (Enquist et al., 2009; http://bien.nceas.ucsb.edu/bien/), the Plant Trait Database (TRY) (Kattge",Botanical Journal of the Linnean Society,Patterns and drivers of plant functional group dominance across the Western Hemisphere: a macroecological re-assessment based on a massive botanical dataset,Plant Trait Database
10.1002/2013JG002392,"molecular composition, as these data are in short supply and current plant trait databases [Kattge",Journal of Geophysical Research: Biogeosciences,A quantitative assessment of a terrestrial biosphere model's data needs across North American biomes,Plant Trait Database
10.1016/j.actao.2014.01.004,"Environ. 74,187e228. Kuhn, I., Durka, W., Klotz, S., 2004. BiolFlor e a new plant-trait database as a tool",Acta Oecologica,Landscape heterogeneity as an ecological filter of species traits,Plant Trait Database
10.1002/ece3.5895,upon reasonable request. All data will be publically available from TRY—Plant Trait Database after publication,Ecology and Evolution,Grazing effects on intraspecific trait variability vary with changing precipitation patterns in Mongolian rangelands,Plant Trait Database
10.1111/gcb.14980,AVAIL ABILIT Y STATEMENT The GlopResp database is accessible at the TRY plant trait database (www.try-db.org),Global Change Biology,Acclimation of leaf respiration consistent with optimal photosynthetic capacity,Plant Trait Database
10.1016/j.foreco.2018.07.002,"158–174  ecosystem. Fire Ecol. 6, 1–12. Paula, S., Pausas, J.G., 2013. BROT: a plant trait database for Mediterranean",Forest Ecology and Management,Leaf and bark functional traits predict resprouting strategies of understory woody species after prescribed fires,Plant Trait Database
10.1111/geb.12625,"predictive forest biomass models. Integrating diverse datasets, such as plant trait databases and forest",Global Ecology and Biogeography,Climate-driven trends in stem wood density of tree species in the eastern United States: Ecological impact and implications for national forest carbon assessments,Plant Trait Database
10.1111/j.1365-2745.2010.01753.x,"K., Noellert, S., Sartor, K. & Wirth, C. (2010) A generic structure for plant trait databases. Methods",Journal of Ecology,Using plant functional traits to understand the landscape distribution of multiple ecosystem services,Plant Trait Database
10.1111/j.1461-0248.2012.01787.x,"6, 749–764. Ku¨hn, I., Durka, W. & Klotz, S. (2004b). BiolFlor – a new plant-trait database as a tool",Ecology Letters,Origin matters: widely distributed native and non-native species benefit from different functional traits,Plant Trait Database
10.1016/j.jaci.2022.08.028,"Kattge J, Bonisch G, Diaz S, Lavorel S, Prentice IC, Leadley P, et al. TRY plant trait database—enhanced",Journal of Allergy and Clinical Immunology,Drug allergy: A 2022 practice parameter update,Plant Trait Database
10.1111/jvs.12066,description of the environment in these worldwide databases. While recent plant trait databases have been,Journal of Vegetation Science,Are trait-based species rankings consistent across data sets and spatial scales?,Plant Trait Database
10.1111/j.1654-1103.2007.tb02568.x,"database is designed to enable linkages to existing soil, ﬂoristic or plant-trait databases. This",Journal of Vegetation Science,The RAINFOR database: monitoring forest biomass and dynamics,Plant Trait Database
10.1016/j.ecolind.2016.09.035,"Res. 6, 749–764. Kühn, I., Durka, W., Klot, S., 2004b. BiolFlor—a new plant-trait database as a tool",Ecological Indicators,"Trade-offs between plant species richness and carbon storage in the context of afforestation – Examples from afforestation scenarios in the Mulde Basin, Germany",Plant Trait Database
10.1002/eap.1758,"Phytotaxonomica 26:277–286. Ku€hn, I., W. Durka, and S. Klotz. 2004. BiolFlor—a new plant-trait database as a tool",Ecological Applications,Novel model coupling approach for resilience analysis of coastal plant communities,Plant Trait Database
10.1016/j.ecoinf.2016.08.002,"K., Noellert, S., Sartor, K., Wirth, C., 2011. A generic structure for plant trait databases. Methods",Ecological Informatics,Unified data management for distributed experiments: A model for collaborative grassroots scientific networks,Plant Trait Database
10.1111/2041-210X.13075,traits inferred by a deep learning algorithm to databases such as the TRY Plant Trait Database can yield,Methods in Ecology and Evolution,Machine learning for image based species identification,Plant Trait Database
10.1111/1365-2435.12490,grant (SA-21331). Data accessibility Trait data have been uploaded to the Plant Trait Database TRY: https://,Functional Ecology,"Functional leaf traits of vascular epiphytes: vertical trends within the forest, intra- and interspecific trait variability, and taxonomic signals",Plant Trait Database
10.1002/ecy.2162,traits (Laughlin 2014). These trait data have been deposited in the TRY plant trait database (https://www.try-db.org/TryWeb/Home.php).  Measuring,Ecology,Community divergence and convergence along experimental gradients of stress and disturbance,Plant Trait Database
10.1111/1365-2745.12913,and Geel (2011). Dispersal syndromes for each taxon were taken from the plant trait database Baseflore,Journal of Ecology,Endozoochory of aquatic ferns and angiosperms by mallards in Central Europe,Plant Trait Database
10.1111/ddi.13113,weight and leaf persistence data of all 25 species were obtained from the Plant Trait Database TRY (Kattge,Diversity and Distributions,Native distribution characteristics rather than functional traits explain preadaptation of invasive species to high‐UV‐B environments,Plant Trait Database
10.1080/17550874.2013.777483,homepage: http://www.tandfonline.com/loi/tped20 Expanding the coverage of plant trait databases – A comparison,Plant Ecology & Diversity,Expanding the coverage of plant trait databases – A comparison of specific leaf area derived from fresh and dried leaves,Plant Trait Database
10.1080/17550874.2013.826744,"418:770–774. Queenborough SA, Porras C. 2014. Expanding the coverage of plant trait databases – a comparison",Plant Ecology & Diversity,The ecosystem dynamics of Amazonian and Andean forests,Plant Trait Database
10.1016/j.ecoinf.2013.12.003,"temperature. The TRY database (Kattge et al., 2011b) as another example, is a plant trait database for quantifying",Ecological Informatics,A conceptual model for data management in the field of ecology,Plant Trait Database
10.1080/0028825X.2018.1482928,"IC, Yang Y, Bai F, Togashi HF, Wang M, Zhou S, Ni J. 2018. The China plant trait database: toward",New Zealand Journal of Botany,Evidence that emergent Nothofagus dombeyi do not depress carbon sequestration rates of canopy species in an old-growth Chilean temperate forest,Plant Trait Database
10.1111/nph.14486,from these databases are available in FRED 1.0. Interfacing with the TRY plant trait database The FRED,New Phytologist,A global Fine-Root Ecology Database to address below-ground challenges in plant ecology,Plant Trait Database
10.1016/j.advwatres.2023.104405,"I.C., Leadley, P., Tautenhahn, S., Werner, G.D.A., et al., 2020. TRY plant trait database – enhanced",Advances in Water Resources,Optimal plant water use strategies explain soil moisture variability,Plant Trait Database
10.1016/j.agrformet.2024.110143,"some species that have not been collected were obtained from the ""China plant trait database version",Agricultural and Forest Meteorology,"Forest demography depends on stand structure, functional traits, and climate in the eastern region of the Qinghai-Tibet Plateau",Plant Trait Database
10.1016/j.catena.2024.108364,"246 (2024) 108364 Kattge, J., Boenisch, G., Diaz, S., et al., 2020. TRY plant trait database - enhanced",CATENA,Non-hazardous seed transport by runoff on slopes determines composition and ecological strategies of plants in patches and interpatches in drylands: A trait-based approach,Plant Trait Database
10.1007/s00468-016-1442-1,"Co, Calcutta Queenborough SA, Porras C (2014) Expanding the coverage of plant trait databases: a comparison",Trees,"Growth rings in tropical trees: role of functional traits, environment, and phylogeny",Plant Trait Database
10.1016/j.ecolmodel.2012.05.004,"Science 188, 389–397. Kühn, I., Durka, W., Klotz, S., 2004. BiolFlor—a new plant-trait database as a tool",Ecological Modelling,Modeling the dynamics and emergence of a multispecies weed seed bank with species traits,Plant Trait Database
10.1002/ecy.1569,"publications: the Botanical Information and Ecology Network (BIEN), the Plant Trait Database (TRY),",Ecology,A plant growth form dataset for the New World,Plant Trait Database
10.1111/gcb.12870,"ranges of ﬁve traits of tropical trees extracted from the TRY global plant trait database, namely",Global Change Biology,Leaf and stem economics spectra drive diversity of functional plant traits in a dynamic global vegetation model,Plant Trait Database
10.1111/aec.12474,565–88. Queenborough S. A. & Porras C. (2014) Expanding the coverage of plant trait databases – a comparison,Austral Ecology,Leaf trait associations with environmental variation in the wide-ranging shrub Dodonaea viscosa subsp. angustissima (Sapindaceae),Plant Trait Database
10.1111/j.1466-8238.2011.00727.x,"al., 2009). Plant functional trait geographic information system Our plant trait database consisted",Global Ecology and Biogeography,The biogeography and filtering of woody plant functional diversity in North and South America,Plant Trait Database
10.1890/12-0747.1,"extended satellite record, and data collation efforts such as TRY (a plant trait database; Kattge",Ecological Applications,Rate my data: quantifying the value of ecological data for the development of models of the terrestrial carbon cycle,Plant Trait Database
10.1111/ecog.00670,"database. – J. Veg. Sci. 14: 611–614. Kühn, I. et al. 2004. BiolFlor: a new plant-trait database as a tool",Ecography,Are different facets of plant diversity well protected against climate and land cover changes? A test study in the French Alps,Plant Trait Database
10.1111/j.1365-2745.2010.01743.x,work underlines the urgent need to build a comprehensive Mediterranean plant trait database. Physiological,Journal of Ecology,"Linking patterns in phylogeny, traits, abiotic variables and space: a novel approach to linking environmental filtering and plant community assembly",Plant Trait Database
10.1002/ece3.2385,"S. Dıaz, S. Lavorel, J. Madin, et al. 2011. A generic structure for plant trait databases. Methods",Ecology and Evolution,The influence of variability in species trait data on community-level ecological prediction and inference,Plant Trait Database
10.1111/nph.15803,"177–189. Enrico L, Dıaz S, Westoby M, Rice BL. 2016. Leaf mechanical resistance in plant trait databases: comparing",New Phytologist,Leaf mechanical strength and photosynthetic capacity vary independently across 57 subtropical forest species with contrasting light requirements,Plant Trait Database
10.1111/nph.14576,collecting data of different traits such as the establishment of TRY plant trait database (https://www.try-db.org;,New Phytologist,Using traits to uncover tropical forest function,Plant Trait Database
10.1111/geb.13052,"METHODS  (http://eflor​as.org/), Tree of Sex (Tree of Sex Consortium, 2014), TRY Plant Trait Database (Kattge",Global Ecology and Biogeography,Drivers of large‐scale geographical variation in sexual systems of woody plants,Plant Trait Database
10.1111/jvs.12659,"(Table 1). Maximum plant height, seed mass and wood density were obtained from the TRY plant trait database (Kattge",Journal of Vegetation Science,Invasive plants in Minnesota are “joining the locals”: A trait-based analysis,Plant Trait Database
10.1111/1365-2664.13338,(H; cm) and seed mass (SeedMass; g). We compiled LHS data from the LEDA plant trait database (Kleyer,Journal of Applied Ecology,Experimental rewilding enhances grassland functional composition and pollinator habitat use,Plant Trait Database
10.1016/j.agee.2010.12.020,"Autónoma de Barcelona, Bellaterra. Paula, S., Pausas, J.G., 2009. BROT: a Plant Trait Database for Mediterranean","Agriculture, Ecosystems & Environment",How does agricultural intensification modulate changes in plant community composition?,Plant Trait Database
10.1016/j.agee.2012.11.005,"Suec. 55, 1–172. Kühn, I., Durka, W., Klotz, S., 2004. BiolFlor: a new plant-trait database as a tool","Agriculture, Ecosystems & Environment",Determinants of fine-scale plant diversity in dry calcareous grasslands within the Baltic Sea region,Plant Trait Database
10.1016/j.biocon.2012.09.009,"Biol. 25, 607–617. Kühn, I., Durka, W., Klotz, S., 2004. BiolFlor – a new plant-trait database as a tool",Biological Conservation,Local and management variables outweigh landscape effects in enhancing the diversity of different taxa in a big metropolis,Plant Trait Database
10.1111/nph.12021,the transport of substrates between the cytosol and the chloroplast. Plant trait databases that include,New Phytologist,Volatile isoprenoid emissions from plastid to planet,Plant Trait Database
10.1016/j.biocon.2022.109531,"Díaz, S., Lavorel, S., Prentice, I.C., Leadley, P., et al., 2020. TRY plant trait database – enhanced",Biological Conservation,Agri-environmental payments drive the conservation and forage value of semi-natural grasslands by modifying fine-scale grazing intensity,Plant Trait Database
10.1080/11263504.2015.1115438,al. 1986–2000) and online databases such as JSTOR (2000–2014) and the Plant Traits Database – TRY,Plant Biosystems - An International Journal Dealing with all Aspects of Plant Biology,An updated inventory of the non-native flora of Sardinia (Italy),Plant Trait Database
10.1111/jbi.13171,"Schildhauer, & Thiers, 2016; Maitner et al., in press), and (2) the TRY Plant Trait Database (www.try-db.org;",Journal of Biogeography,Spatial patterns and climate relationships of major plant traits in the New World differ between woody and herbaceous species,Plant Trait Database
10.1111/jvs.12052,"170: 271–283. Ku€hn, I., Durka, W. & Klotz, S. 2004. BiolFlor – a new plant-trait database as a tool",Journal of Vegetation Science,Functional and phylogenetic community assembly linked to changes in species diversity in a long-term resource manipulation experiment,Plant Trait Database
10.1111/nph.14628,"and OBT. Again, we carried out re-ﬁts based on single sam-  to the TRY Plant Trait Database (Kattge",New Phytologist,"Exploring the bark thickness-stem diameter relationship: clues from lianas, successive cambia, monocots and gymnosperms",Plant Trait Database
10.1139/er-2015-0072,"doi:10.1111/ j.1365-2745.2008.01359.x. Paula, S., and Pausas, J.G. 2013. BROT: A plant trait database for Mediterranean",Environmental Reviews,"Traits to stay, traits to move: a review of functional traits to assess sensitivity and adaptive capacity of temperate and boreal trees to climate change",Plant Trait Database
10.1111/j.1600-0706.2008.16668.x,"method. Á Psychometrika 29: 115Á129. Ku¨hn, I. et al. 2004. BiolFlor: a new plant-trait database as a tool",Oikos,On the challenge of treating various types of variables: application for improving the measurement of functional diversity,Plant Trait Database
10.1002/ecm.1271,"2008), but also to more efficiently assimilate information from large plant trait databases (Kattge",Ecological Monographs,An individual-based forest model to jointly simulate carbon and tree diversity in Amazonia: description and applications,Plant Trait Database
10.1111/geb.12573,"2007; Garnier & Navas, 2012; Lavorel, 2013). The constant improvement of plant trait databases now oﬀers",Global Ecology and Biogeography,Sensitivity of community-level trait-environment relationships to data representativeness: A test for functional biogeography,Plant Trait Database
