10.1007/s12526-014-0255-y,Catalogue of Life (www.sp2000.org) and the number in the ocean on the World Register of Marine,Marine Biodiversity,Invertebrate diversity of the unexplored marine western margin of Australia: taxonomy and implications for global biodiversity,World Register of Marine Species
10.1007/s12526-014-0269-5,"van Ofwegen L. (2014a). Chironephthya Studer, 1887. Accessed through: World Register of Marine",Marine Biodiversity,"Chironephthya mediterranea n. sp. (Octocorallia, Alcyonacea, Nidaliidae), the first species of the genus discovered in the Mediterranean Sea",World Register of Marine Species
10.1007/s12526-021-01170-3,"taxonomic resolution, e.g., genus level. Names were matched with the World Register of Marine",Marine Biodiversity,DNA barcoding and cryptic diversity of deep-sea scavenging amphipods in the Clarion-Clipperton Zone (Eastern Equatorial Pacific),World Register of Marine Species
10.1007/s12526-021-01213-9,exclusively qualitative. Bryozoan nomenclature was updated using the World Register of Marine,Marine Biodiversity,"Bryozoan diversity, biogeographic patterns and distribution in Greenland waters",World Register of Marine Species
10.1016/j.ecss.2023.108546,"of the Algae Base (Guiry and Guiry, 2023, Algaebase. (s.f.)) and the World Register of Marine","Estuarine, Coastal and Shelf Science",Small but key to nature conservation: Small packed communities in a small lagoon from a biodiversity hotspot,World Register of Marine Species
10.1016/j.jembe.2014.04.006,"appropriate literature (Hinton, 1975; Okutani, 2000; Schoppe, 2000) and the World Register of Marine",Journal of Experimental Marine Biology and Ecology,Benthic macrofaunal assemblages in multispecific seagrass meadows of the southern Philippines: Variation among vegetation dominated by different seagrass species,World Register of Marine Species
10.1111/j.1462-2920.2010.02256.x,"Erséus, C. (2009) Tubiﬁcoides benedii (Udekem, 1855). Accessed through the World Register of Marine",Environmental Microbiology,Gamma- and epsilonproteobacterial ectosymbionts of a shallow-water marine worm are related to deep-sea hydrothermal vent ectosymbionts,World Register of Marine Species
10.2110/palo.2014.051,"taxa recognized in the fossil data, with this extant list taken from the World Register of Marine",PALAIOS,OLD DATA FOR OLD QUESTIONS: WHAT CAN THE HISTORICAL COLLECTIONS REALLY TELL US ABOUT THE NEOGENE ORIGINS OF REEF-CORAL DIVERSITY IN THE CORAL TRIANGLE?,World Register of Marine Species
10.1016/j.marpolbul.2015.02.031,and Adjacent Seas (MSBIAS) list which is a subset of the species on the World Register of Marine,Marine Pollution Bulletin,More bang for your monitoring bucks: Detection and reporting of non-indigenous species,World Register of Marine Species
10.1016/j.tree.2013.05.002,"Life (CoL [69]), which is at least two-thirds complete, and 200 to the World Register of Marine",Trends in Ecology & Evolution,"Biodiversity data should be published, cited, and peer reviewed",World Register of Marine Species
10.1111/zsc.12200,Freshwater and Terrestrial Isopod Crustaceans database. Available via World Register of Marine,Zoologica Scripta,A molecular phylogeny of the north-east Atlantic species of the genus Idotea (Isopoda) with focus on the Baltic Sea,World Register of Marine Species
10.1111/zsc.12312,"Ciliophora Database. Parafavella Kofoid & Campbell, 1929. Accessed through: World Register of Marine",Zoologica Scripta,Novel insights into the genetic diversity of Parafavella based on mitochondrial CO1 sequences,World Register of Marine Species
10.1080/14786419.2019.1678615,approximately 170 species have been chemically investigated (Chen et al. 2012; World Register of Marine,Natural Product Research,Terpenoids from the South China Sea soft coral Sinularia multiflora,World Register of Marine Species
10.1016/B978-0-12-819570-3.00019-6,"World Echinoidea database. In: Peronella Gray, 1855. Accessed through: World Register of Marine",Developments in Aquaculture and Fisheries Science,Chapter 19 Peronella,World Register of Marine Species
10.1016/j.jembe.2016.02.001,"and Ryland (2000), further conﬁrming the nomenclature with the WoRMS, World Register of Marine",Journal of Experimental Marine Biology and Ecology,"Human impacts on biogenic habitats: Effects of experimental trampling on Sabellaria alveolata (Linnaeus, 1767) reefs",World Register of Marine Species
10.1080/00222933.2017.1340526,"2:163–188. Bouchet P, Gofas S. 2012. Atys Montfort, 1810. In: molluscaBase. 2016. World Register of Marine",Journal of Natural History,"Redescription of the Cephalaspidea gastropod Atys jeffreysi (Weinkauff, 1866) (Haminoeidae), with a discussion on the phylogenetic affinities of the Mediterranean species of the genus",World Register of Marine Species
10.1007/s12526-015-0385-x,"14:239–250 Appeltans W, Bouchet P, Boxshall GA, De Broyer C, et al. (eds) (2012) World Register of Marine",Marine Biodiversity,"Diversity and distribution of tide pool ornamental fishes along the Andaman coast (Andaman Sea), India",World Register of Marine Species
10.1007/s12526-016-0543-9,"Metzelaar, 1919. In: Froese R, Pauly D (eds) FishBase. Accessed through: World Register of Marine",Marine Biodiversity,"Habitat selection of the coral-dwelling spinyhead blenny, Acanthemblemaria spinosa, at Curaçao, Dutch Caribbean",World Register of Marine Species
10.1007/s12526-019-01003-4,"World list of Bryozoa. Watersiporidae Vigneaux, 1949. Available from: world register of marine",Marine Biodiversity,Watersiporidae (Bryozoa) in Iberian waters: an update on alien and native species,World Register of Marine Species
10.1007/s12526-020-01131-2,previous studies with database from the World Fish Center (Fishbase) and the World Register of Marine,Marine Biodiversity,Reef fish fauna in the coastal waters of Vietnam,World Register of Marine Species
10.1007/s12526-020-01123-2,"Polychaeta database. Pseudopolydora Czerniavsky, 1881. Accessed through: World Register of Marine",Marine Biodiversity,Morphology and reproductive biology of a new Pseudopolydora (Annelida: Spionidae) species from the Arabian Gulf,World Register of Marine Species
10.1007/s12526-014-0222-7,"recent development of online databases on marine biodiversity, such as the World Register of Marine",Marine Biodiversity,"Diversity, distribution, and zoogeography of benthic polychaetes in the Gulf of Mexico",World Register of Marine Species
10.1007/s13358-015-0088-8,"11, pp. 69–104). San Diego, CA: Academic Press. WoRMS Register 2015. World register of marine",Swiss Journal of Palaeontology,"New size data on the enigmatic Spirula spirula (Decabrachia, suborder Spirulina), on a global geographic scale",World Register of Marine Species
10.1111/j.1463-6409.2012.00554.x,"Soest, R. W. M., Sto¨ hr, S., Walter, T. C. & Costello, M. J. (2011). World Register of Marine",Zoologica Scripta,"Cenozoic evolution of Muricidae (Mollusca, Neogastropoda) in the Southern Ocean, with the description of a new subfamily",World Register of Marine Species
10.1016/j.ympev.2021.107122,"Parasitol. 28, 1939–1941. WoRMS, 2020a. Caledoniella Souverbie, 1869. World Register of Marine",Molecular Phylogenetics and Evolution,Snails riding mantis shrimps: Ectoparasites evolved from ancestors living as commensals on the host’s burrow wall,World Register of Marine Species
10.1016/j.ecoinf.2011.11.008,"(TNLs) co-developed with IODP (Integrated Ocean Drilling Program),16 the world register of marine",Ecological Informatics,A comparative evaluation of technical solutions for long-term data repositories in integrative biodiversity research,World Register of Marine Species
10.1016/j.ecss.2015.05.005,The taxonomy used in all data sets was standardized according to the World Register of Marine,"Estuarine, Coastal and Shelf Science",Phytoplankton blooms in estuarine and coastal waters: Seasonal patterns and key species,World Register of Marine Species
10.1016/j.marpolbul.2012.11.003,"zooplankton: a microcosm experiment. Aquacult. Res. 35, 965–969. WORMS – World Register of Marine",Marine Pollution Bulletin,Dose-dependent response of a benthic system to biodeposition from suspended blue mussel (Mytilus edulis) culture,World Register of Marine Species
10.1016/j.marpolbul.2014.01.006,were checked against the Algaebase (http://algaebase.org/) or the WoRMS (World Register of Marine,Marine Pollution Bulletin,Acclimation and toxicity of high ammonium concentrations to unicellular algae,World Register of Marine Species
10.1016/j.marmicro.2015.09.005,"Cedhagen, T., Kaminski, M., Gross, O., 2014. World Foraminifera Database, World Register of Marine",Marine Micropaleontology,"Natural variability of benthic foraminiferal assemblages and metal concentrations during the last 150years in the Ingøydjupet trough, SW Barents Sea",World Register of Marine Species
10.1016/j.marmicro.2015.11.001,"one common generic name for each of these species, mainly following the World Register of Marine",Marine Micropaleontology,"Foram-AMBI: A sensitivity index based on benthic foraminiferal faunas from North-East Atlantic and Arctic fjords, continental shelves and slopes",World Register of Marine Species
10.1080/15564894.2018.1501442,contribution. All nomenclature has been standardized with reference to the World Register of Marine,The Journal of Island and Coastal Archaeology,"Long-term Trends in Terrestrial and Marine Invertebrate Exploitation on the Eastern African Coast: Insights from Kuumbi Cave, Zanzibar",World Register of Marine Species
10.1080/00222933.2019.1637476,"(Razouls et al. 2017), World of Copepod (Walter and Boxshall 2019), and World Register of Marine",Journal of Natural History,Planktonic copepod community of a reef zone in the southern Gulf of Mexico,World Register of Marine Species
10.1007/s00227-016-3063-z,in the reef ecosystem. Nature 428:66–70 WoRMS Editorial Board (2016) World Register of Marine,Marine Biology,Spatial dietary shift in bivalves from embayment with river discharge and mariculture activities to outer seagrass beds in northwestern Philippines,World Register of Marine Species
10.1007/s00343-016-5256-1,These are fully described and illustrated here as a new species. The World Register of Marine,Chinese Journal of Oceanology and Limnology,"A new species of Phyllochaetopterus Grube, 1863 (Polychaeta: Chaetopteridae) from Hainan Island, South China Sea",World Register of Marine Species
10.1016/j.dsr.2023.104025,"Ascothoracida Database. Dendrogaster Knipovich, 1890. Accessed through: World Register of Marine",Deep Sea Research Part I: Oceanographic Research Papers,Insights into the diversification of deep-sea endoparasites: Phylogenetic relationships within Dendrogaster (Crustacea: Ascothoracida) and a new species description from a western Pacific seamount,World Register of Marine Species
10.1007/s00343-013-2323-8,1911. In: Mah C L. 2012. World Asteroidea Database. Accessed through: World Register of Marine,Chinese Journal of Oceanology and Limnology,Three new records of deep-water goniasterids (Echinodermata: Asteroidea: Goniasteridae) from China seas,World Register of Marine Species
10.1007/s12526-020-01048-w,"https://doi.org/10.11646/zootaxa.4444.5.1 MolluscaBase (2018) Goniobranchus Pease, 1866. World Register of Marine",Marine Biodiversity,"A species complex within the red-reticulate Goniobranchus Pease, 1866 (Nudibranchia: Doridina: Chromodorididae)",World Register of Marine Species
10.1007/s12526-020-01151-y,nomenclature of the taxa was updated according to the indications of the World Register of Marine,Marine Biodiversity,Marine invertebrate epibionts on photophilic seaweeds: importance of algal architecture,World Register of Marine Species
10.1007/s12526-020-01061-z,Freshwater and Terrestrial Isopod Crustaceans database. Accessed through: World Register of Marine,Marine Biodiversity,"A new genus of Munnopsidae Lilljeborg, 1864 (Crustacea, Isopoda), with descriptions of two abyssal new species from the Clarion Clipperton Fracture Zone, north-eastern tropical Pacific",World Register of Marine Species
10.1007/s12526-015-0367-z,"et al. (1982, 1989, 1993, 1998), with taxa nomenclature following the World Register of Marine",Marine Biodiversity,Spatial and temporal variation of coastal mainland vs. insular amphipod assemblages on Posidonia oceanica meadows,World Register of Marine Species
10.1139/gen-2015-0208,"http://link.springer.com/10.1007/s00338-013-1055-8 [accessed 29 November 2015].  Board, W.E. World Register of Marine",Genome,Deep COI sequencing of standardized benthic samples unveils overlooked diversity of Jordanian coral reefs in the Northern Red Sea,World Register of Marine Species
10.1016/j.ecss.2024.108802,"that the name E. affinis affinis (Poppe, 1880), in accordance with the World Register of Marine","Estuarine, Coastal and Shelf Science",Environmental factors as drivers of the spatial distribution of the copepods Eurytemora affinis affinis and Eurytemora velox in the Scheldt tributaries,World Register of Marine Species
10.1080/00222933.2014.897768,Freshwater and Terrestrial Isopod Crustaceans database. Accessed through: World Register of Marine,Journal of Natural History,"Review of the parasitic genus Epipenaeon Nobili, 1906 (Crustacea: Isopoda: Bopyridae), with new records and redescription of four species from China",World Register of Marine Species
10.1080/03632415.2014.996806,"references. For other taxa, current scientific names were drawn from the World Register of Marine",Fisheries,Relating Scientific Names to Common Names for Important Fisheries Species of the Mexican Pacific,World Register of Marine Species
10.1080/03632415.2015.1019772,"references. For other taxa, current scientific names were drawn from the World Register of Marine",Fisheries,"Full Issue PDF Volume 40, Issue 2",World Register of Marine Species
10.1016/j.biocon.2016.09.028,"SIAR models. Based on abundance and size data, literature, the WoRMS (World Register of Marine",Biological Conservation,Biodiversity and food web indicators of community recovery in intertidal shellfish reefs,World Register of Marine Species
10.1016/j.fishres.2016.02.012,"the portunid crab Scylla serrata. Mar. Biol. 71, 187–192. WoRMS, 2015. World Register of Marine",Fisheries Research,Relative efficiencies and durabilities of recreational hoop- and lift-nets targeting two Australian portunids,World Register of Marine Species
10.1016/j.ecolind.2016.10.026,"www.iobis.org), FishBase (www.ﬁshbase.org), SeaLifeBase (www. sealifebase.org), World Register of Marine",Ecological Indicators,Spatial differentiation of marine eutrophication damage indicators based on species density,World Register of Marine Species
10.1016/j.ecolind.2016.05.020,"diverging functional identities. Oikos. WoRMS Editorial Board, 2014. World Register of Marine",Ecological Indicators,Spatial and temporal response of multiple trait-based indices to natural- and anthropogenic seafloor disturbance (effluents),World Register of Marine Species
10.1016/j.cub.2012.09.028,compelling summary of existing knowledge. Much credit goes to WoRMS — the World Register of Marine,Current Biology,Biodiversity: Not Just Lots of Fish in the Sea,World Register of Marine Species
10.1016/j.cub.2014.12.023,"226,101 valid marine species names (>99% of all valid marine species in the World Register of Marine",Current Biology,Global Patterns of Extinction Risk in Marine and Non-marine Systems,World Register of Marine Species
10.1016/j.dsr2.2013.01.024,the Scotia Arc and along the Antarctic Peninsula to Adelaide Island (World Register of Marine,Deep Sea Research Part II: Topical Studies in Oceanography,Growth of the Antarctic octocoral Primnoella scotiae and predation by the anemone Dactylanthus antarcticus,World Register of Marine Species
10.1080/10643389.2019.1631990,"Additional information gathered from FishBase (Froese & Pauly, 2018), World Register of Marine",Critical Reviews in Environmental Science and Technology,Plastic ingestion by marine fish in the wild,World Register of Marine Species
10.1111/syen.12068,checklists of species names as part of the Catalogue of Life (CoL) and World Register of Marine,Systematic Entomology,"As in other taxa, relatively fewer beetles are being described by an increasing number of authors: response to Löbl and Leschen",World Register of Marine Species
10.1111/j.1740-9713.2010.00450.x,"widely read. To remedy this, the Census has supported the development of a World Register of Marine",Significance,"The sea, the Census and statistics",World Register of Marine Species
10.1016/j.jembe.2017.08.007,taxonomic hierarchy assembled using the taxa matching function on the World Register of Marine,Journal of Experimental Marine Biology and Ecology,The structure and organisation of integral marine benthic communities in relation to sieve mesh size,World Register of Marine Species
10.1080/22311866.2015.1015611,"Chemical Society, 99(17): 5780-5784. 37. Van-Ofwegen, L. (2012). “Xeniidae” World Register of Marine",Journal of Biologically Active Products from Nature,Xenia Terpenoids as Anticancer Promoters,World Register of Marine Species
10.1111/jbi.12708,"latitude intertidal occurrences for 1416 species/taxa, veriﬁed using the World Register of Marine",Journal of Biogeography,The first comprehensive description of the biodiversity and biogeography of Antarctic and Sub-Antarctic intertidal communities,World Register of Marine Species
10.1016/j.pocean.2018.12.015,diﬀerent  taxonomic groups is that reported in the relevant update check-list: World Register of Marine,Progress in Oceanography,Megafauna distribution along active submarine canyons of the central Mediterranean: Relationships with environmental variables,World Register of Marine Species
10.1016/j.dsr2.2018.08.006,"(A. Flynn), prior to running an automated fuzzy-matching query of the World Register of Marine",Deep Sea Research Part II: Topical Studies in Oceanography,Micronekton assemblages and bioregional setting of the Great Australian Bight: A temperate northern boundary current system,World Register of Marine Species
10.1016/j.geomorph.2018.07.002,"(1977), Ellis and Messina Catalogues (1940–2014) and web sites such as the World Register of Marine",Geomorphology,Sedimentary records of extreme wave events in the southwestern Caribbean,World Register of Marine Species
10.1016/j.seares.2018.10.002,taxonomic nomenclature of all identified species was verified using the World Register of Marine,Journal of Sea Research,"Fouling assemblages of native, non-indigenous and cryptogenic species on artificial structures, depths and temporal variation",World Register of Marine Species
10.1111/j.2041-210X.2009.00008.x,"Information System (ITIS) online data base, (http:// www.itis.gov), from the World Register of Marine",Methods in Ecology and Evolution,An empirical model for estimating aquatic invertebrate respiration,World Register of Marine Species
10.1016/j.seares.2013.10.008,"G.C.B., Read, G., Stöhr, S., Walter, T.C., Costello, M.J. (Eds.), 2012. World Register of Marine",Journal of Sea Research,Shell use and partitioning of two sympatric species of hermit crabs on a tropical mudflat,World Register of Marine Species
10.1016/j.marenvres.2015.06.012,taxonomic nomenclature we use follows that currently accepted in the World Register of Marine,Marine Environmental Research,Response of top shell assemblages to cyclogenesis disturbances. A case study in the Bay of Biscay,World Register of Marine Species
10.1016/j.marpolbul.2015.09.054,"C. (Eds.), (2013 Onwards) World Amphipoda Database (Accessed through: World Register of Marine",Marine Pollution Bulletin,Recommendations on standardizing lists of marine alien species: Lessons from the Mediterranean Sea,World Register of Marine Species
10.1111/bor.12265,"geomorphology. Quaternary Science Reviews 29, 424–442. WoRMS Editorial Board 2016: World Register of Marine",Boreas,Deglaciation and ice shelf development at the northeast margin of the Laurentide Ice Sheet during the Younger Dryas chronozone,World Register of Marine Species
10.1080/0734578X.2017.1416213,obtained from the most recent acceptable names contained in the online “World Register of Marine,Southeastern Archaeology,Prehistoric shell beads on the Georgia coast,World Register of Marine Species
10.1080/0067270X.2016.1173308,"G.C.B., Read, G., Stöhr, S., Walter, T.C. and Costello, M.J. (eds). 2012. World Register of Marine",Azania: Archaeological Research in Africa,"Reinvestigation of Kuumbi Cave, Zanzibar, reveals Later Stone Age coastal habitation, early Holocene abandonment and Iron Age reoccupation",World Register of Marine Species
10.1016/j.dsr2.2017.12.016,"G., Fauchald, K. (Eds.), World Polychaeta database. Accessed through: World Register of Marine",Deep Sea Research Part II: Topical Studies in Oceanography,Phylogeography of benthic invertebrates in deep waters: A case study of Sternaspis cf. williamsae (Annelida: Sternaspidae) from the northwestern Pacific Ocean,World Register of Marine Species
10.1016/j.marpolbul.2018.09.007,"A.F., 2016. Limecola balthica (Linnaeus, 1758). In: MolluscaBase (2016). World Register of Marine",Marine Pollution Bulletin,"Impact of environmental hypercapnia on fertilization success rate and the early embryonic development of the clam Limecola balthica (Bivalvia, Tellinidae) from the southern Baltic Sea – A potential CO2 leakage case study",World Register of Marine Species
10.1111/cla.12239,"(Malacostraca; Crustacea). Cladistics 26, 143–167. WoRMS Editorial Board. 2018. World Register of Marine",Cladistics,A phylogenetic study of krill (Crustacea: Euphausiacea) reveals new taxa and co-evolution of morphological characters,World Register of Marine Species
10.1017/jpa.2016.83,"ZooKeys, v. 562, p. 1–48. Cairns, S., and Hoeksema, B., 2015, Flabellidae: World Register of Marine",Journal of Paleontology,New azooxanthellate genus of Scleractinia (Flabellidae) from the Australian Cenozoic,World Register of Marine Species
10.3109/19401736.2015.1007348,"Dasyatidae. In: Froese R, Pauly D, editors. FishBase. Accessed through: World Register of Marine",Mitochondrial DNA Part A,"The complete mitogenome of the bluespotted ribbontail ray Taeniura lymma (Forsskål, 1775) (Elasmobranchii: Myliobatiformes: Dasyatidae)",World Register of Marine Species
10.1111/geb.12911,"such as the Global Biodiversity Information Facility (www.gbif.org), World Register of Marine",Global Ecology and Biogeography,Physiological acclimation and persistence of ectothermic species under extreme heat events,World Register of Marine Species
10.1111/azo.12279,https://doi. org/10.1002/cne.902720403 WoRMS Editorial Board (2018). World register of marine,Acta Zoologica,The structure of the muscular and nervous systems of the male Intoshia linei (Orthonectida),World Register of Marine Species
10.1002/lno.11086,"Marine Life Information Network (http://www.marlin.ac.uk/biotic/), and the World Register of Marine",Limnology and Oceanography,Seasonality in coastal macrobenthic biomass and its implications for estimating secondary production using empirical models,World Register of Marine Species
10.1016/j.jcz.2016.01.004,"Neuhaus (2013), and authoritative electronic repositories such as the World Register of Marine",Zoologischer Anzeiger - A Journal of Comparative Zoology,"Kinorhyncha from Italy, a revision of the current checklist and an account of the recent investigations",World Register of Marine Species
10.1016/j.ejar.2014.11.002,"were according to the taxonomic database sites, like algaebase.com (ab), World Register of Marine",The Egyptian Journal of Aquatic Research,"Seasonal fluctuations of phytoplankton community and physico-chemical parameters of the north western part of the Red Sea, Egypt",World Register of Marine Species
10.1016/j.marpolbul.2010.12.014,speciﬁc names used here were updated using recent taxonomy articles and the World Register of Marine,Marine Pollution Bulletin,Vessel biofouling as an inadvertent vector of benthic invertebrates occurring in Brazil,World Register of Marine Species
10.1007/s12526-020-01077-5,"World list of Scleractinia. Caryophylliidae Dana, 1846. Accessed through: world register of marine",Marine Biodiversity,"Coenocyathus sebroecki sp. nov.: a new azooxanthellate coral (Scleractinia, Caryophylliidae) from southeastern Brazil",World Register of Marine Species
10.1016/j.jembe.2013.01.010,"10.3391/ai.2009.4.3.3. Davie, P., Türkay, M., 2012. Hemigrapsus Dana, 1851. Accessed through: World Register of Marine",Journal of Experimental Marine Biology and Ecology,Invasion biology of the Asian shore crab Hemigrapsus sanguineus: A review,World Register of Marine Species
10.1016/j.pocean.2016.08.003,depths worldwide. With 292 species currently described and accepted in the World Register of Marine,Progress in Oceanography,Diversity and distribution of hyperiid amphipods along a latitudinal transect in the Atlantic Ocean,World Register of Marine Species
10.1080/17451000.2016.1239021,Congresso Latinoamericano de Zoología 1:204–16. WoRMS Editorial Board. 2016. World Register of Marine,Marine Biology Research,"A new hermit crab of the Paguristes tortugae complex (Crustacea: Anomura: Diogenidae), with a key to the western Atlantic species",World Register of Marine Species
10.1080/10498850.2017.1390714,"Gofas, S. 2008. Arca noae In: molluscaBase (2016). Accessed through: World Register of Marine",Journal of Aquatic Food Product Technology,"Effects of Culinary Methods on Nutritional Characteristics of the Edible Shellfish Noah’s Ark ( Arca noae L., 1758) from Tunisian Coasts",World Register of Marine Species
