10.1016/j.quaint.2015.04.060,"Marcus, 1967 Scaphander clavus Dall, 1889 Scaphander cylindrellus http://www.marinespecies.org/ aphia.php?p=taxdetails&id= 575361Dall, 1908 Cylichnidae",Quaternary International,The gizzard plates in the Cephalaspidean gastropod Philine quadripartita: Analysis of structure and function,www.marinespecies.org
10.1890/09-1546.1,hhttp://www.gbif.org/i 5 hhttp://iobis.marine.rutgers.edu/i 6 hhttp://www.marinespecies.org/i  because the aim of the study was to test the,Ecological Applications,Unite research with what citizens do for fun: “recreational monitoring” of marine biodiversity,www.marinespecies.org
10.1111/j.1744-7410.2011.00231.x,"World Echinoidea Database. Kroh A & Mooi R, eds., Available at http://www.marinespecies.org/Echinoidea/ aphia.php (accessed October 19, 2010). Landry",Invertebrate Biology,Molecular phylogeny of echinometrid sea urchins: more species of Heliocidaris with derived modes of reproduction,www.marinespecies.org
10.1111/maec.12418,"MolluscaBase. Retrieved from World Register of Marine Species at http://www.marinespecies.org/aphia.php?p=taxdetails&id=534190 on 2015-09-15. Burrows,",Marine Ecology,Underwater video reveals decreased activity of rocky intertidal snails during high tides and cooler days,www.marinespecies.org
10.1080/03632415.2012.714323,"Costello, editors. 2011. World register of  marine species. Available: http://www.marinespecies.org. (July 2011). Ausubel, J. 1997. The census of",Fisheries,A Census of Fishes and Everything They Eat: How the Census of Marine Life Advanced Fisheries Science,www.marinespecies.org
10.1080/00222933.2014.905125,"Register of marine species; [cited 2014 Feb 19]. Available from: http://www.marinespecies.org at VLIZ. Zanol J, Bettoso N. 2006. Identity of",Journal of Natural History,"Marphysa cinari , a new species of Eunicidae (Polychaeta) from the coasts of Turkey (eastern Mediterranean) and re-descriptions of Marphysa kinbergi McIntosh, 1910 and Marphysa disjuncta Hartman, 1961",www.marinespecies.org
10.1080/00222933.2017.1293180,observations and diﬀerent sources (http://species-identiﬁcation. org/; http://www.marinespecies.org/;Godeaux et al. 1998).   JOURNAL OF NATURAL HISTORY Family,Journal of Natural History,Pelagic tunicates in the China Seas,www.marinespecies.org
10.1016/j.dsr.2018.01.008,"Editorial Board, 2017. World Register of Marine Species. Available: 〈http:// www.marinespecies.org〉. (accessed February 2017). Young, C.M., Sewell,",Deep Sea Research Part I: Oceanographic Research Papers,"Combining bathymetry, latitude, and phylogeny to understand the distribution of deep Atlantic hydroids (Cnidaria)",www.marinespecies.org
10.1016/j.rsma.2016.11.010,names were checked with the World Register of Marine Species (http://www.marinespecies.org) in July 2016. The fine fraction (<63 µm) was,Regional Studies in Marine Science,Soft bottom macrobenthic communities in a semi-enclosed Bay bordering the English Channel: The Rade de Cherbourg,www.marinespecies.org
10.1111/geb.12358,(2015) World Register of Marine Species (WoRMS). Available at: http://www.marinespecies.org (accessed 31 March 2015).  1508  Global Ecology,Global Ecology and Biogeography,The biogeography of fertilization mode in the sea,www.marinespecies.org
10.1111/zsc.12087,"Bryozoa) were retrieved from the World Register of Marine Species (http://www.marinespecies.org/, accessed November 2011). We also included two",Zoologica Scripta,Size of genera - biology or taxonomy?,www.marinespecies.org
10.1111/jai.13364,"Copepods  database. World Register of Marine Species Retrieved from http://  www.marinespecies.org/aphia.php?p=taxdetails&id=128990  on  2016-06-10  Humanson,",Journal of Applied Ichthyology,"First record of Maccallumtrema xiphiados and the Philichthys xiphiae in the striped marlin Kajikia audax (Philippi, 1887) off Cabo San Lucas, Baja California Sur, Mexico",www.marinespecies.org
10.1111/j.1529-8817.2011.00976.x,"Intergovernmental Oceanographic Commission of UNESCO. Available at: http://www.marinespecies.org/hab/index.php. Montresor, M., John, U., Beran,",Journal of Phycology,DEVELOPMENT OF A MULTIPLEX PCR ASSAY FOR SIMULTANEOUS DETECTION OF SIX ALEXANDRIUM SPECIES (DINOPHYCEAE)1,www.marinespecies.org
10.1016/j.marmicro.2016.02.005,"Ciliophora. Accessed through: World Register of Marine Species at http://www.marinespecies.org/aphia.php?p=taxdetails&id=11. Wassmann, P., Duarte,",Marine Micropaleontology,Dinoflagellate cyst production over an annual cycle in seasonally ice-covered Hudson Bay,www.marinespecies.org
10.1016/j.ecolind.2015.04.008,http://www.ipma.pt/ (IPMA – Portuguese Sea and Atmosphere Institute). http://www.marinespecies.org/ (WoRMS – World Record of Marine Species).,Ecological Indicators,Setting reference conditions for mesohaline and oligohaline macroinvertebrate communities sensu WFD: Helping to define achievable scenarios in basin management plans,www.marinespecies.org
10.1016/j.quaint.2015.07.004,"Zeidler, W., 2014. World Register of Marine Species (WoRMS). from http://www.marinespecies.org . Braidwood, R.J., Wright, H.E., Ewing, J.F.,",Quaternary International,The Ksâr 'Akil (Lebanon) mollusc assemblage: Zooarchaeological and taphonomic investigations,www.marinespecies.org
10.1016/j.marpolbul.2016.08.022,"Board World, 2016. Register of marine species. Available from http:// www.marinespecies.org (at VLIZ. Accessed 2016-06-26). Zaiko, A., Olenin,",Marine Pollution Bulletin,Barcodes of marine invertebrates from north Iberian ports: Native diversity and resistance to biological invasions,www.marinespecies.org
10.1111/ddi.12348,"Editorial Board (2014) World register of marine species. Available at http://www.marinespecies.org (accessed 30 April 2014). Zenetos, A., Gofas,",Diversity and Distributions,"What guides invasion success? Ecological correlates of arrival, establishment and spread of Red Sea bivalves in the Mediterranean Sea",www.marinespecies.org
10.1002/aqc.1145,MJ (eds). 2010. World Register of Marine Species. Available at: http://www.marinespecies.org. Accessed 5 August 2010. Bidartondo MI. 2008.,Aquatic Conservation: Marine and Freshwater Ecosystems,Conserving biosystematics,www.marinespecies.org
10.1111/gcb.12334,"Hooper JNA et al. (2013) World Porifera database. Available at: http://www.marinespecies.org/porifera (accessed 28 March 2013). Verde EA, McCloskey",Global Change Biology,Sponge biomass and bioerosion rates increase under ocean warming and acidification,www.marinespecies.org
10.1002/ece3.4742,"(2018) World Register of Marine Species (WoRMS). Retrieved from http://www.marinespecies.org at VLIZ. doi:10.14284/170 Hugenholtz, P., Goebel,",Ecology and Evolution,Assessing eukaryotic biodiversity in the Florida Keys National Marine Sanctuary through environmental DNA metabarcoding,www.marinespecies.org
10.2989/1814232X.2019.1689169,"Editorial Board. 2019. World Register of Marine Species. Available at http://www.marinespecies.org at VLIZ [accessed 28 May 2019]. Zimmermann J,",African Journal of Marine Science,"A comparison between the morphological and molecular approach to identify the benthic diatom community in the St Lucia Estuary, South Africa",www.marinespecies.org
10.1016/j.marpolbul.2017.03.068,"comparisons with the database of the World Register of Marine Species (http://www.marinespecies.org). As a result, we obtained a ﬁnal inventory of",Marine Pollution Bulletin,"Biodiversity hotspot for marine invertebrates around the Dokdo, East Sea, Korea: Ecological checklist revisited",www.marinespecies.org
10.1016/j.marenvres.2017.08.008,Nomenclature follows the World Register of Marine Species (WoRMS: http://www.marinespecies.org/index.php; last accessed 01 June 2017). Annelida Sabellaria,Marine Environmental Research,"Reducing the data-deficiency of threatened European habitats: Spatial variation of sabellariid worm reefs and associated fauna in the Sicily Channel, Mediterranean Sea",www.marinespecies.org
10.2989/1814232X.2016.1222308,"species of the  genus (WoRMS [World Register of Marine Species], http:// www.marinespecies.org, accessed 05 February 2015). The South African",African Journal of Marine Science,Determining the correct identity of South African Marthasterias (Echinodermata: Asteroidea),www.marinespecies.org
10.1007/s12549-015-0185-0,"Database., Accessed through:World Register of Marine Species at http://www.marinespecies.org/aphia. php?p=taxdetails&id=155944 on 2014-06-12.",Palaeobiodiversity and Palaeoenvironments,Holocene palaeoenvironmental changes in three lagoons on the Algarve coast of Portugal,www.marinespecies.org
10.1080/00222933.2014.897768,database. Accessed through: World Register of Marine Species at http://www.marinespecies.org/aphia.php?p=taxdetails&id=118172 on 2013-10-03. Cheng,Journal of Natural History,"Review of the parasitic genus Epipenaeon Nobili, 1906 (Crustacea: Isopoda: Bopyridae), with new records and redescription of four species from China",www.marinespecies.org
10.1080/00222933.2015.1034211,"includes 93 species, of which 75 are considered valid (WORMS: http://www.marinespecies.org/aphia.php?p=taxdetails&id=137916). Most of these",Journal of Natural History,A new large and colourful species of the genus Doto (Nudibranchia: Dotidae) from South Africa,www.marinespecies.org
10.1111/j.1365-2400.2008.00607.x,Species ERMS (http://www.marbef.org/data/) and MarineSpecies.org (http:// www.marinespecies.org/index.php).  Ó 2008 The Authors. Journal compilation,Fisheries Management and Ecology,Non-commercial invertebrate discards in an experimental trammel net fishery,www.marinespecies.org
10.1002/ece3.1203,was available at the World Register of Marine Species website (http://www.marinespecies.org/). The nested taxonomic matrix formed the basis,Ecology and Evolution,Life history variation in Barents Sea fish: implications for sensitivity to fishing in a changing environment,www.marinespecies.org
10.1016/j.geobios.2016.01.020,"B.J., Turon, X., 2016. Ascidiacea World Database. (Accessed at http:// www.marinespecies.org/ascidiacea/aphia.php?p=taxdetails&id=146420on",Geobios,First fossil record of early Sarmatian didemnid ascidian spicules (Tunicata) from Moldova,www.marinespecies.org
10.1016/j.ecolind.2015.11.010,Encyclopedia of life (www.eol.org) and World Register of Marine Species (www.marinespecies.org).  Tropical species Palaemon northropi Pachygrapsus,Ecological Indicators,Vulnerability to climate warming and acclimation capacity of tropical and temperate coastal organisms,www.marinespecies.org
10.4319/lo.2013.58.6.2046,"of Marine Species [accessed on 2013 January 31]. Available from http://www.marinespecies.org/aphia.php?p5taxdetails&id5129615 ———, AND P. A.",Limnology and Oceanography,"Are similar worms different? A comparative tracer study on bioturbation in the three sibling species Marenzelleria arctia , M. viridis , and M. neglecta from the Baltic Sea",www.marinespecies.org
10.1111/1365-2435.12444,"Register of Marine Species editorial board 2014, available from http://www.marinespecies.org, accessed 2014-10-06). Table S2. Detailed description",Functional Ecology,Investigating isotopic functional indices to reveal changes in the structure and functioning of benthic communities,www.marinespecies.org
10.1111/ivb.12136,through: World Register of Marine Species. Available online at: http://www.marinespecies.org/aphia.php?p= taxdetails&id=123083. Accessed 5,Invertebrate Biology,"The nonfeeding auricularia of Holothuria mexicana (Echinodermata, Holothuroidea)",www.marinespecies.org
10.1111/ivb.12015,"Vacelet J, Dohrmann M. World Porifera database. Available online at http:// www.marinespecies.org/Porifera/porifera.php?p=taxdetails&id=166047.",Invertebrate Biology,A skeleton-less sponge of Caribbean mangroves: invasive or undescribed?,www.marinespecies.org
10.1002/aqc.2683,"are connected with WoRMS, the World Register of Marine Species (http://www.marinespecies.org/), used as the taxonomic backbone ensuring quality",Aquatic Conservation: Marine and Freshwater Ecosystems,e-Science perspectives for the conservation of transitional and coastal wetlands,www.marinespecies.org
10.1080/23308249.2017.1293607,Editorial Board. World register of marine species. Available from http://www.marinespecies.org at VLIZ. (2016). Accessed 25/10/2016 (doi: 10.14284/170),Reviews in Fisheries Science & Aquaculture,A Review of the Parasites Infecting Fishes of the Genus Trachurus (Pisces: Carangidae),www.marinespecies.org
10.3109/24701394.2016.1174224,"Register of Marine Species; [cited on 21 Nov 2015]. Available from: http://www.marinespecies.org/aphia.php?p¼taxdetails &id ¼391295 Chen R, Jiang",Mitochondrial DNA Part A,Genetic diversity and phylogeny of limpets of the genus Nipponacmea (Patellogastropoda: Lottiidae) based on mitochondrial DNA sequences,www.marinespecies.org
10.1080/15564894.2019.1679293,"Organisation. WoRMS Editorial Board. 2019. World register of marine species. http://www.marinespecies.org/ at VLIZ. Accessed May 18, 2018. doi:10.14284/170. Yokota,",The Journal of Island and Coastal Archaeology,"Sea urchins: Improving understanding of prehistoric subsistence, diet, foraging behavior, tool use, and ritual practices in Polynesia",www.marinespecies.org
10.1016/B978-0-12-819570-3.00001-9,"2019. The World Echinoidea Database—Version 3.0. Available at http://www.marinespecies.org/echinoidea. (accessed 25.3.2019). Kroh, A., Smith,",Developments in Aquaculture and Fisheries Science,Chapter 1 Phylogeny and classification of echinoids,www.marinespecies.org
10.1016/B978-0-12-396491-5.00027-7,Database. Accessed through: World Register of Marine Species at http://www.marinespecies.org/aphia.php?p=taxdetails&id=591102 on 2013-04-09.,Developments in Aquaculture and Fisheries Science,Chapter 27 Strongylocentrotus franciscanus and Strongylocentrotus purpuratus,www.marinespecies.org
10.1007/s00227-013-2380-8,"In: Read G, Fauchald K (ed) (2013) World polychaeta database. http://www.marinespecies.org/polychaeta/aphia.php? p=taxdetails&id=129945.",Marine Biology,Identifying trophic relationships within the high Arctic benthic community: how much can fatty acids tell?,www.marinespecies.org
10.5697/oc.55-4.979,"(IOC-UNESCO Taxonomic reference list of harmful micro algae, web: http://www.marinespecies.org/HAB./dinoﬂag.php, accessed 28 June 2013), and",Oceanologia,Dinoflagellate cyst distribution in recent sediments along the south-east coast of India**The financial support for this work was received from the Ministry of Earth Sciences (MoES) under the Indian XBT programme the Ballast Water Management programme funded by the Directorate General of Shipping India.,www.marinespecies.org
10.1111/j.2041-210X.2009.00008.x,"(http:// www.itis.gov), from the World Register of Marine Species (http:// www.marinespecies.org) and from various other online sources. Lifestyle",Methods in Ecology and Evolution,An empirical model for estimating aquatic invertebrate respiration,www.marinespecies.org
10.1016/j.seares.2013.10.008,"Costello, M.J. (Eds.), 2012. World Register of Marine Species (http://www.marinespecies.org on 2012-09-22. Accessed on 6 November 2012). Bach,",Journal of Sea Research,Shell use and partitioning of two sympatric species of hermit crabs on a tropical mudflat,www.marinespecies.org
10.1016/j.marpolbul.2015.09.054,"Database (Accessed through: World Register of Marine Species at http://www.marinespecies.org/aphia.php?p=taxdetails&id= 103163 on 2015-06-04). Yokoyama,",Marine Pollution Bulletin,Recommendations on standardizing lists of marine alien species: Lessons from the Mediterranean Sea,www.marinespecies.org
10.1080/14772019.2018.1536895,"Perrier, V. & Meidla, T. 2018. World Ostracoda Database. Updated at http://www.marinespecies.org/ostracoda, accessed on 9 February 2018. Chaisson,",Journal of Systematic Palaeontology,Palaeoceanographical events from the late Miocene to Pleistocene of the Rio Grande Rise (south-western Atlantic) as indicated by Ostracoda,www.marinespecies.org
10.1016/j.marenvres.2015.07.017,"Board, 2015. World Register of Marine Species. Available from: http://www.marinespecies.org. at VLIZ. Date accessed 15.06.15.",Marine Environmental Research,Annual trend patterns of phytoplankton species abundance belie homogeneous taxonomical group responses to climate in the NE Atlantic upwelling,www.marinespecies.org
10.1016/j.bse.2015.06.015,"15 recognized species (World Register of Marine Species, WORMS; http://www.marinespecies.org), scallops of the genus Pecten represent commercially",Biochemical Systematics and Ecology,The mitochondrial genomes of Pecten albicans and Pecten maximus (Bivalvia: Pectinidae) reveal a novel gene arrangement with low genetic differentiation,www.marinespecies.org
10.1080/14772000.2020.1776785,"(2019). Data from: World Porifera Database [Dataset]. Retrieved from http://www.marinespecies.org/porifera accessed on Mar/22/2019.  Verrill, A.",Systematics and Biodiversity,Delimiting boundaries between species: excavating sponges close to Cliona mucronata (Demospongiae),www.marinespecies.org
10.1002/ece3.3042,"Board (2017). World Register of Marine Species. Available from http://www.marinespecies.org at VLIZ. https://doi. org/10.14284/170 Yang, Z.",Ecology and Evolution,"Rates and relations of mitochondrial genome evolution across the Echinoidea, with special focus on the superfamily Odontophora",www.marinespecies.org
10.2216/PH09-42.1,taxonomic reference list of harmful microalgae. Available at: http://www.marinespecies.org/HAB. (14 September 2009).   Moschandreou et al.:,Phycologia,"Morphology, phylogeny and toxin analysis of Pseudo-nitzschia pseudodelicatissima (Bacillariophyceae) isolated from the Thermaikos Gulf, Greece",www.marinespecies.org
10.1080/19440049.2011.628340,taxonomic reference list of harmful micro-algae. Available from: http://www.marinespecies.org/HAB   Peperzak L. 2005. Future increase in harmful,Food Additives & Contaminants: Part A,Monitoring phytoplankton and marine biotoxins in production waters of the Netherlands: results after one decade,www.marinespecies.org
10.1002/zoos.201100008,2011. Pycnobase: World Pycnogonida Database. Available online at http://www.marinespecies.org/pycnobase  # 2011 WILEY-VCH Verlag GmbH & Co.,Zoosystematics and Evolution,Antarctic Pycnogonida housed at the Bavarian State Collection of Zoology,www.marinespecies.org
10.1111/jzo.12674,"database. Anilocra Leach, 1818. World Register of Marine Species at: http://www.marinespecies.org/aphia.php? p=taxdetails&id=146493. Accessed 2018-07-19.  Brusca,",Journal of Zoology,Influence of Marine Protected Areas on parasitic prevalence: the case of the isopod Anilocra physodes as a parasite of the fish Lithognathus mormyrus,www.marinespecies.org
10.1080/14772000.2014.902867,"Database. Accessed through: World Register of Marine Species (WoRMS) [http://www.marinespecies.org/ aphia.php?p ¼ taxdetails&id ¼ 1337, accessed",Systematics and Biodiversity,"Description of the eudoxid stages of Lensia havock and Lensia leloupi (Cnidaria: Siphonophora: Calycophorae), with a review of all known Lensia eudoxid bracts",www.marinespecies.org
10.1080/13235818.2016.1207280,"Zealand. WoRMS. (2015) World Register of Marine Species. Available online at http://www.marinespecies.org. [Accessed on 21 February 2015]. Yonow, N. (2000)",Molluscan Research,"Is Port Stephens, eastern Australia, a global hotspot for biodiversity of Aplysiidae (Gastropoda: Heterobranchia)?",www.marinespecies.org
10.1111/mec.14486,". Zeidler, W. (2016). World Amphipoda Database. Retrieved from http://www.marinespecies.org/amphipoda Hou, Z., & Li, S. (2010). Intraspecific",Molecular Ecology,Cryptic species as a window into the paradigm shift of the species concept,www.marinespecies.org
10.1016/j.ecoinf.2011.11.003,"Soest, R.W.M., Stöhr, S., Walter, T.C., Costello, M.J. (Eds.), http://www.marinespecies.org (accessed 2011-11-09). Baltic Sea Alien Species",Ecological Informatics,Biological invasion impact assessment system: From idea to implementation,www.marinespecies.org
10.1016/j.ocecoaman.2015.04.003,"Manning, 1993. Accessed through: World Register of Marine Species at. http://www.marinespecies.org/aphia.php? p¼taxdetails&id¼442711. on 2014-09-12. Demestre,",Ocean & Coastal Management,Composition and abundance of deep-water crustaceans in the Southwest Indian Ocean: Enough to support trawl fisheries?,www.marinespecies.org
10.1016/j.seares.2017.02.006,"Gross, O. (Eds.), (2016) World Foraminifera Database Accessed at http://www.marinespecies.org/foraminifera/aphia.php?p=taxdetails&id=112874",Journal of Sea Research,"Recent oxygen depletion and benthic faunal change in shallow areas of Sannäs Fjord, Swedish west coast",www.marinespecies.org
10.1016/j.annpal.2018.11.001,"Bellardi, 1875. Accessed through: World Register of Marine Species at: http://www.marinespecies.org/aphia. php?p=taxdetails&id=138554 on 2018-06-14. Sacco,",Annales de Paléontologie,"Tindaria kretensis n. sp., a new deep water protobranch (Bivalvia) from the Early Pliocene of Crete (Southern Greece)",www.marinespecies.org
10.1080/00288330.2020.1713180,"(Iredale, 1915). Accessed through: World Register of Marine Species http://www.marinespecies.org/aphia.php?p=taxdetails&id=744521 [Accessed 26",New Zealand Journal of Marine and Freshwater Research,"A genetic assessment of the taxonomic status of New Zealand mussels of the genus Xenostrobus Wilson, 1967",www.marinespecies.org
10.1111/j.1550-7408.2011.00571.x,"M. J. (ed). 2011. World Register of Marine Species. Accessed at http://www.marinespecies.org on 2011-05-12. Archibald, J. M. & Keeling, P.",Journal of Eukaryotic Microbiology,Sorosphaerula nom. n. for the Plasmodiophorid Genus Sorosphaera J. Schröter 1886 (Rhizaria: Endomyxa: Phytomyxea: Plasmodiophorida),www.marinespecies.org
10.1111/mms.12244,"Jefferson & Van Waerebeek, 2002. World Cetacea Database. Available at http://www.marinespecies.org/cetacea/ (accessed 2013). Perrin, W. F. 2011b.",Marine Mammal Science,Comparison of reproductive parameters for populations of eastern North Pacific common dolphins: Delphinus capensis and D. delphis,www.marinespecies.org
10.1016/j.dsr2.2016.06.017,"2002; Gaard et al., 2008). Synonymy of species was corrected according to www.marinespecies.org. Gelatinous species and shrimps were weighted",Deep Sea Research Part II: Topical Studies in Oceanography,"The deep-sea zooplankton of the North, Central, and South Atlantic: Biomass, abundance, diversity",www.marinespecies.org
10.1016/j.pocean.2016.08.003,"described and accepted in the World Register of Marine Species (WoRMS: http://www.marinespecies.org), this peracarid crustacean group is a diverse",Progress in Oceanography,Diversity and distribution of hyperiid amphipods along a latitudinal transect in the Atlantic Ocean,www.marinespecies.org
10.1002/ece3.1381,"Boury-Esnault, J. N. A. Hooper, et al. 2014. World Porifera Database. www.marinespecies.org/ porifera. Sperling, E. A., K. J. Peterson, and",Ecology and Evolution,Discordance between morphological and molecular species boundaries among Caribbean species of the reef sponge Callyspongia,www.marinespecies.org
10.2110/palo.2009.p09-149r,"HANSSON, H.G., 2010, Comatulida, in World Register of Marine Species, http://www.marinespecies.org/aphia.php?p5taxdetails&id5123093. Checked May",PALAIOS,COULD A STALKED CRINOID SWIM? A BIOMECHANICAL MODEL AND CHARACTERISTICS OF SWIMMING CRINOIDS,www.marinespecies.org
10.1007/s13199-021-00750-y,"Board (2020) World Register of Marine Species. Available from http://www.marinespecies.org at VLIZ. Accessed 25 Aug 2020. Yeom J, Nikitin",Symbiosis,Global diversity and distribution of Lamippidae copepods symbiotic on Octocorallia,www.marinespecies.org
10.1016/j.dsr2.2010.09.005,of species was matched against the World Register of Marine Species (www.marinespecies.org) and SCARMarBIN’s Register of Antarctic Marine,Deep Sea Research Part II: Topical Studies in Oceanography,Admiralty Bay Benthos Diversity—A census of a complex polar ecosystem,www.marinespecies.org
10.1016/j.dsr2.2013.10.010,"Dohrmann, M., Cristina Díaz, M. (2012) World Porifera database. 〈http://www.marinespecies.org/porifera/pori fera.php?p=taxdetails&id=167419〉",Deep Sea Research Part II: Topical Studies in Oceanography,"Epibiotic relationships on Zygochlamys patagonica (Mollusca, Bivalvia, Pectinidae) increase biodiversity in a submarine canyon in Argentina",www.marinespecies.org
10.1016/j.dsr2.2016.03.011,"Raﬁnesque, 1815. Accessed through: World Register of Marine Species at 〈http://www.marinespecies.org/aphia.php?p¼taxdetails&id¼ 211 on 2015-05-7〉. Carney,",Deep Sea Research Part II: Topical Studies in Oceanography,Genome-wide discovery of single nucleotide polymorphisms (SNPs) and single nucleotide variants (SNVs) in deep-sea mussels: Potential use in population genomics and cross-species application,www.marinespecies.org
10.1002/aqc.2977,"taxonomic nomenclature is as listed in the World Register of Marine Species (www.marinespecies.org) in March 2018, except for the two microgastropods",Aquatic Conservation: Marine and Freshwater Ecosystems,Context dependency in the effect of Ulva -induced loss of seagrass cover on estuarine macrobenthic abundance and biodiversity,www.marinespecies.org
10.1016/j.dsr2.2018.02.005,"J.L., Rios Lopez, P., 2017. World Porifera database. Accessed at 〈http:// www.marinespecies.org/porifera〉 on2017–11–27. Van Soest, R.W.M., Hajdu,",Deep Sea Research Part II: Topical Studies in Oceanography,"Unusually diverse, abundant and endemic deep–sea sponge fauna revealed in the Sea of Okhotsk (NW Pacific Ocean)",www.marinespecies.org
